Headline,Authors,Main_Image,Published_Date,News,Source_urls
Why an openly gay PM such as Leo Varadkar is an impossibility in India,[],https://www.hindustantimes.com/rf/image_size_960x540/HT/p2/2017/06/03/Pictures/ireland-politics_ec045f7e-4832-11e7-815c-f4e1adc20f07.jpg,2017-06-03T13:42:47,"January 2015, Dublin, Ireland: The country’s health minister Leo Varadkar has just made history by coming out as gay on a live national radio broadcast. “It’s just part of who I am…it is a part of my character,” he says, months before Ireland votes in a landmark referendum to legalise same-sex marriage.January 2015, Panaji, India: Goa youth affairs minister Ramesh Tawadkar has just declared setting up “gay cure” centres to deal with homosexual youth. “We will make them normal. Like Alcoholic Anonymous centres, we will train them and (give them) medicines,” he says.India woke up on Saturday to celebrate the success of Leo Varadkar, the son of a Mumbai doctor who rose to become Ireland’s youngest prime minister. But among the adulations showered on the 38-year-old lies one deliberate omission: The shameful way in which Indian society and political leadership treats it Lesbian, Gay, Bisexual, Transgender (LGBT) population.The challenges of living queer in India are well documented. LGBT folks are shut out of our education and employment institutions, and pushed out of housing and public spaces. To be out or present non-normatively is to often invite ridicule, bias and outright violence. And if one is poor, or lower-caste or disabled and is queer, they stop existing not just in collective memory but also for public policy.But a far more insidious form of discrimination flies under the radar: The refusal of our political leadership to discuss, let alone reform, India’s outdated laws that outlaw homosexual people and criminalise the lives of LGBT folks.Section 377 of the Indian Penal Code has been on the national agenda for at least a decade and half now, since activists approached the Delhi High Court to read down the provisions of the colonial statute. But in these 16 years, not once has the government of the day or the political leadership taken up the cause of people who are among the most marginalised sections of society.In 2013, when the Supreme Court sounded out Parliament to read down section 377, the political leadership ducked. Two years later, a majority of lawmakers blocked even any discussion on a bill brought by Congress MP Shashi Tharoor to scrap the section. Despite intermittent comments by leaders of the ruling party, and apparent attempts at sounding progressive, little has moved on a basic human rights issue that most parts of the world have resolved. The government seems content on passing the buck to the judiciary, apparently paralysed by the fear of offending sections of the population obsessed with cows.This toxic concoction of opportunism and apathy is why a Leo Varadkar is impossible in India – an ironic situation considering we regularly elect repeat offenders, people accused of rape and murder who blithely suspend investigations against themselves when in power. We look the other way when suspects, even convicts, enter Parliament. As a nation that seems to have little problem with leaders accused of embezzlement, corruption or murder, a person being gay should be the least of our concerns.But there are no openly gay politicians in India, and the few transgender representatives have found it difficult to break into larger than a local arena – mainly because non-normative sexual or gender orientation is considered a death knell for one’s career.Varadkar has presented himself as any other politician to be judged on the merit of his policy -- and there are problems, say, with his position on immigration reform or housing. But in that appraisal, his sexual orientation is increasingly faint as a factor —something unimaginable in our society.Varadkar’s election isn’t an event to celebrate for Indians. It is a moment of introspection on how we have systematically disenfranchised a section of our country. Leo Varadkar only has his father to be grateful to, not his country of origin that would have made him a criminal. Thank god he left India.First Published: Jun 03, 2017 13:42 IST",https://www.hindustantimes.com/opinion/why-an-openly-gay-pm-such-as-leo-varadkar-is-an-impossibility-in-india/story-J7Rsvde6H3sO7kLJ54QNzK.html
"Maha Min says LGBTs need psychological treatment, draws flak",['Ht Correspondent'],https://www.hindustantimes.com/images/app-images/2019/2/icon-57x57.png,2015-03-24T12:13:00,"The opposition on Tuesday strongly condemned Maharashtra health minister Deepak Sawant's statement advocating psychological treatment for the LGBT community, urging him to direct his time and energy towards the development of the state rather than creating unnecessary controversies.Terming the statement as unwarranted, Nationalist Congress Party (NCP) leader Majeed Memon said that Sawant's remarks had betrayed the ignorance of ministers on the matter.""Such statements by ministers only show their ignorance. They are unnecessarily creating controversies when they should be directing their time and energy towards the issues which are pending and for the development of Maharashtra. This statement is absolutely unwarranted and uncalled for,"" Memon told ANI.Congress leader Manish Tewari took a dig at Sawant and said that the latter needs psychiatric counseling for making such a statement.""Someone who feels that the LGBT community requires psychological treatment, possibly himself requires psychiatric counseling,"" Tewari said.On Monday, Sawant, while speaking in the Maharashtra assembly, said that lesbians, gays, bisexuals and transgenders were in need of psychological treatment and counseling.According to an Indian Express report, responding to a query seeking to know the government's action plan to contain the transmission of HIV among the LGBT community, Sawant said, ""there is a need for psychological treatment and counselling of the community. We would work with NGOs working in the sector,” Sawant said in his reply.Earlier this year in January, Goa's sports and youth affairs minister Ramesh Tawadkar had said that the state government was contemplating to set up centres on the line of Alcoholic Anonymous for LGBT youth, where they will be trained and administered medicine in order to make them ""normal"".The minister had, however, later did a U-turn, saying he was misunderstood and misquoted on the issue.(With inputs from ANI)First Published: Mar 24, 2015 12:13 IST",https://www.hindustantimes.com/india/maha-min-says-lgbts-need-psychological-treatment-draws-flak/story-6iIeo3VDoajOsRW2WvB9fO.html
I was misquoted: Goa minister's U-turn on LGBT row,[],https://www.hindustantimes.com/rf/image_size_640x362/HT/p1/2014/01/11/Incoming/Pictures/1171751_Wallpaper2.jpg,2014-01-11T00:00:00,"After his controversial remarks over the LGBT community drew flak, Goa minister Ramesh Tawadkar did a U-turn Tuesday over the issue saying he was misunderstood and misquoted on the issue.""I was misunderstood and misquoted. I was not talking about the LGBT (youths) but about drug addicted and sexually abused youths,"" Tawadkar told PTI, even as local channels continued to air the footage where he assured medical treatment to make LGBT youths ""normal"".""Youth policy speaks about drug addicted youths and sexually abused youths as a focused group. There are provisions in the central government sponsored Social Justice Scheme for such youths which can be implemented in Goa,"" the minister said, a day after he was widely criticised for his statements.He said when journalists asked me about LGBTs, I told them ""I am not expert on the issue"".The minister also refused to acknowledge LGBT as a focused group, though the youth policy document which is currently in public domain has mentioned them as one.""We will make them normal. We will have a centre for them. Like Alcoholic Anonymous centres, we will have centres. We will train them and give them medicines too,"" the minister had said.""Like in the case of other target groups such as juvenile offenders, drug afflicted youth, marginalised or migrant youth, geographically disadvantaged youth, a detailed survey would be carried out among state LGBT community, so that their problems could be specifically addressed,"" he had added.First Published: Jan 13, 2015 14:18 IST",https://www.hindustantimes.com/india/i-was-misquoted-goa-minister-s-u-turn-on-lgbt-row/story-i6IVO670OqOr2rYOlU4A2L.html
"News Headlines, Breaking News, Election 2019 News, Today News, English News",[],https://www.hindustantimes.com/images/app-images/2019/2/icon-57x57.png,2019-04-08T00:00:00,"Apr 08, 2019 05:36 ISTThe parenting journey can sometimes be draining. We all have had our moments in the parenting journey where we have felt clueless and wondered if we were indeed doing the right thing. ...read more",https://www.hindustantimes.com/india/india-s-gay-law-breeds-intolerance-says-un-chief/story-uU2XQxyt0IsVmyyZaxLmDP.html
Gay Goa Gone? State seeks to ‘cure’ homosexuals,[],https://www.hindustantimes.com/rf/image_size_640x362/HT/p1/2013/12/11/Incoming/Pictures/1161690_Wallpaper2.jpg,2013-12-11T00:00:00,"The Goa government is contemplating to set up centres on the line of Alcoholic Anonymous for LGBT youth, where they will be trained and administered medicine in order to make them ""normal"", state sports and youth affairs minister Ramesh Tawadkar said on Monday.Tawadkar was speaking to reporters on the sidelines of an event held in Panaji to launch the Goa State Youth Policy 2015 on the occasion of National Youth Day. The policy lists ""stigmatised"" LGBT youth as one of the many ""target groups"" which the documents says required ""focused attention"".""We will make them normal. We will have a centre for them. Like Alcoholic Anonymous centres, we will have centres...,"" Tawadkar said.When asked what exactly was the role of the special centres that the government was proposing to set up for Lesbians, Gay, Bi-sexual and Transgender (LGBT) youth, Tawadkar said: ""We will train them and (give them) medicines too.""Like in the case of other ""target groups"" such as juvenile offenders, drug afflicted youth, marginalised or migrant youth, geographically disadvantaged youth, a detailed survey would be carried out among state LGBT community, so that their problems could be specifically addressed, he said.First Published: Jan 12, 2015 18:37 IST",https://www.hindustantimes.com/india/gay-goa-gone-state-seeks-to-cure-homosexuals/story-gN8eo6E7Dv47VxpaJERYaI.html
Critics' review: Aashiqui 2 misses the quintessential romance,[],https://www.hindustantimes.com/rf/image_size_640x362/HT/p1/2013/03/28/Incoming/Pictures/1033738_Wallpaper2.jpg,2013-03-28T00:00:00,"Aashiqui 2Mohit SuriAditya Roy Kapur, Shraddha KapoorAt the peak of his career, a rock star discovers talent in a shy female singer, whom he falls in love with. While she goes on to become a successful singer, he loses his career and then his mind. She, being the honest girlfriend, then helps him revive his career, and thus, their relationship.Mithoon, Jeet Ganguly and Ankit TiwariContrary to the hopes pinned upon this much awaited sequel to Mahesh Bhatt's hit film Aashiqui, Mohit Suri's flick Aashiqui 2 does not live up to the expectation.Though the treatment and story has little new or fresh to offer, Aditya Roy Kapur's intense acting skills are widely being appreciated. Read for yourself what the critics think of the film.Mayank Shekhar finds the plot of the film confusing. He begins his review ridiculing the plot and says, ""This is a film on the dangers of alcohol addiction, subsequent loss of voice, and the end of a musical career."" He further clarifies, ""Alcoholic Anonymous and similar agencies that work on alcohol dependence issues should ideally co-opt this picture for their public service message. But they may not be quite satisfied with this effort.""Claiming to portray the sins of fame, Aashiqui 2 shows Aditya Roy Kapur as the arrogant famous singer who loses his career. For all the loss and sins of fame, the audience will not know the cause or the story of the protagonist's downfall.Shekhar also writes, ""It is a film about the transient nature of fame. The ideal subject could have been the original Aashiqui’s lead actors Rahul Roy and Anu Aggrawal themselves. BBC did a lovely documentary on the ""one-film wonder"" Roy. I met Aggrawal a couple of years ago, her face destroyed by a motor accident, her thoughts still pinned to her glorious past, she almost made me cry. Few people are likely to understand this tragic phenomenon called fame more than those who work in Bollywood that cruelly measures success and worth of artistes almost every week.""Why do I always feel that a lot of such characters should be seeing therapists rather than having films made on them? If this went on for any longer, I’d need to see a shrink too.**Mohit Suri has tried a ""terribly tried and tested"" method. Saibal writes that this 'old' plot does not have anything new to offer, ""Even the lead actors aren't newcomers, so do not expect them to inject any freshness.""Chatterjee further writes, ""The film is obviously meant for a youth audience, which is probably not the easiest segment to inveigle. Aditya Roy Kapoor, in his first full-fledged lead role, exudes the kind of confidence that borders on airiness. He is fine in the lighter moments, but when the drama turns intense, the chinks begin to show. There are situations in the plot that simply aren’t convincing enough, and the young actor can do little to extract something of significance out of them.""The film has sadly stirred up an old story filled it up with even older cliches and the lead pair perhaps does not have the ability yet to perform to cover up where the script lacks.Fluffy and flaky, Aashiqui 2 is simply not peppy enough to paper over its cracks. It does not strike any chords. There aren't too many highs in its hackneyed saga of songs and sighs.*1/2Madhureeta finds the movie pretty entertaining. She writes for her review, ""The real lyric of this story is their romance, pulsating with passion and intensity - on high notes and 'higher spirits'.""Aashiqui 2 does not hold any resemblance either to the 1990 film Aashiqui (to which Aashiqui 2 is claimed to be a sequel) nor can we spot any inspiration from Amitabh Bachchan-starrer Abhimaan. Mukherjee writes, ""Suri's musical love story doesn't bear much semblance to the original 'Aashiqui'; instead it finds its own rhythm.""As for the acting, ""Aditya is likeable in mushy moments, he shows intensity in flashes but sometimes loses grip. A mature role like this demands a lot, nonetheless, it's a good effort.""This could be good soup for the lovers' soul - with a dash of old-world flavour.***1/2The film certainly rides on high hopes with a title as Aashiqui 2, reminiscent of the 1990 film Aashiqui. Shomini writes, ""To make a film with the title 'Aashiqui 2' is not an easy thing as this name carries a baggage of superhit songs and innocent romance.""The film seems to have some misplaced direction as well, Sen writes, "" A beer bar has pictures of Lata Mangeshkar, Manna Dey on its walls. Okay then."" She further says that the movie is completely a predictable romantic film.Moving on to acting, Sen writes, ""Shraddha Kapoor looks beautiful throughout the film. But her performance is..well..too flat..But it's Aditya Roy Kapur who shines as the self destructive super star Rahul Jaykar.""Watch it for the shining star - Adita Roy Kapur.Sengar believes the film could have turned out better with a little more of an intelligent treatment. Resham writes, ""Remaking the 1990`s hit, Aashiqui, was a bright idea, given the adulation for the film still exists in the hearts of the audience. But sadly, Aashiqui 2 has not been given the kind of treatment that a classical on-screen romance should have been given.""The film also fails to even stand up to its title - Aashiqui (romance). Resham writes, ""Aashiqui 2 is quite a clean film unlike the ones that are churned out by the Vishesh Films` factory these days but the quintessential romance element is missing here.""Switching to acting skills of the artists, ""The passion between the lead pair is weakened mainly because of Shraddha Kapoor, who can neither emote nor act to intensify the romance. Instead, it is Aditya Roy Kapur who has tried to make things work in the film by being as real as possible while speaking his lines. He puts in genuine efforts to ignite the much-needed spark of passion between him and his on-screen lady love.""Aashiqui 2 must be watched only for three reasons: a) If you love Aditya Roy Kapoor; b) If the songs are of your liking; c) Just out of curiosity. Otherwise, watch the one starring Anu Agarwal and Rahul Roy and save money.**1/2Going by the reviews, Aashiqui 2 has little to offer if you are looking for a fresh story or awesome cinematic experience. However, Aditya Roy Kapur's acting seems promising. Watch the film, if you must, for Aditya Roy Kapur.Have you watched the movie yet? Share your experience with us.First Published: Apr 26, 2013 14:10 IST",https://www.hindustantimes.com/movie-reviews/critics-review-aashiqui-2-misses-the-quintessential-romance/story-iE7ynbcPT2iHcMOHOyFsPJ.html
Suffering from the ‘Like’ me syndrome?,['Amrah Ashraf'],https://www.hindustantimes.com/images/app-images/2019/2/icon-57x57.png,2011-11-12T16:08:00,"Gunjan Arora, a Delhi-based primary school teacher, is surrounded by close friends with grave looks on their faces. She looks uneasy and defensive. It looks like an Alcoholic Anonymous meeting, but is actually an intervention popularised by famous sitcom How I Met Your Mother.Gunjan is guilty of being addicted to uploading pictures on Facebook and Picasa. The situation is so grave that she wakes up in the middle of the night to upload new pictures and check comments on her older ones. Every new dress, dinner, or even a visit to a doctor, is documented on her Facebook page in pictures. After updating her status, she pings her friends to like it. Each picture, colour corrected and photoshopped, needs at least five comments for her to feel content or she feels restless. How did things get so bad? She doesn’t know. Her friends have decided to intervene and make her realise that she is basing her self-worth on the comments and likes of her friends, and in that process compromising on her self-esteem. Sadly, Gunjan uploaded pictures of the intervention too!This problem is not limited to Gunjan alone. There are many youngsters out there battling with ‘Facebook validation syndrome.’ They spend a large portion of their day uploading pictures on various sites and regularly updating their status messages. The fact that they compare their lives with that of others based on who went out partying more and the number of new friends others have, make it obvious that the need for validation is constant. Lack of real friends and conversations induces a sense of alienation and more and more people are falling prey to this problem. Interestingly, you are considered ‘cool’ and your life ‘happening’ if you upload more pictures and if your life looks like it’s going places virtually.""I feel that since most youngsters are living in virtual reality, they don’t have too many friends in real life. Obviously they feel a vacuum inside and base their lives on the acceptance of their virtual friends. You always want to be a part of a group; you want to belong somewhere and therefore you wear a mask online to look and sound like your peers so that they accept you,"" says U Vindhya, professor, psychology department, TISS, Mumbai.In fact, if you Google ‘Why people post pictures on Facebook’, you get 1,010,000,000 results. So, we’re not the only ones thinking about this, are we!Earlier, a dinner with friends or a movie with a loved one was all about spending quality time with each other. People chatted about their lives and of course pictures were taken for memories, but today the situation is almost bizarre. Even when one is out with a loved one having a cozy dinner, one is always wondering whether they should tweet a pictures of that perfect lobster or BBM friends about the party tomorrow.""Once a friend of mine tweeted about his plans of proposing to his girlfriend at dinner that night and completely forgot that she was following him. Obviously she got to know and was really angry with him for publicising their private moment but we couldn’t stop laughing about it. Show off!"" says Shaleen Singh, a BPO employee.People tinker away on their cellphones either uploading pictures on Facebook, commenting or waiting restlessly for comments. It is easy to spot the restless eye constantly looking at the cellphone to see if people have responded to his ‘awesome’ twitpic. ""It is very disturbing to see people like that. The constant need for approval and validation from friends and peers is alarming. I see so many girls and boys with a cellphone in their hands, glancing repeatedly at it,"" adds U Vindhya.Getting a response may be quite high on their agenda but what happens if the response if negative? It is almost catastrophic. ""We were out for dinner when a friend of mine realised that some of her friends had written nasty things about her new display picture. Not only did she refuse to eat anything, she picked a fight with them online and ruined dinner for all of us,"" says Robin Raju, a Mumbai-based PR professional.A recent study from the University of Buffalo in the US stated that women who post a lot of pictures on Facebook base their self-worth on appearance and crave approval. It went on to receive a lot of flak for being insensitive towards women, but one couldn’t help but accept that most social activity on the Net does have a lot to do with self-worth. Adding to this study, many psychologists feel that it is definitely not just a woman thing. Men are equally active and concerned about how they come across on the Internet.""It is utter rubbish to assume that only women are concerned about their social identity on the Internet.I feel men are equally concerned about it. It is preposterous to assume that women are vain and men are not. Whether it is about self-worth or not, that is debatable, but men and women are equally active on social networking sites and love to change their profile pictures to look better in the eyes of the others,"" says Farzana, a Mumbai-based psychologist.Psychologists feel that people need to start living their lives outside the ""realms of social networking."" No one’s asking you to stop posting pictures or relinquishing your online identity, but one needs to draw a line somewhere. Twitter on they say but don’t let the bird dictate terms to you. Don’t lose your identity in the ping-post, update-upload shenanigans of social networking sites.Recently, Demi Moore posted her nude picture on Twitter. Are we supposed to love your new skinny frame Ms Moore?Lenny Kravitz tweeted a picture of his nude rear. Salvaging his career, maybe!Courtney Love is quite infamous for posting scandalous pictures on Twitter and seeking comments from her followers.How can we forget Lindsay Lohan’s numerous nude attempts to grab attention on social networking sites. Desperation, we say!From HT Brunch, November 13Follow us on twitter.com/HTBrunchConnect with us on facebook.com/hindustantimesbrunchFirst Published: Nov 12, 2011 16:08 IST",https://www.hindustantimes.com/social-media/suffering-from-the-like-me-syndrome/story-MNnhoMFWXAeirHDk2YAkTN.html
