Headlines,Descriptions,Authors,Published_Dates,Articles,Keywords,Summaries
COPS BUST BOOZE THIEVES!,THE two thugs wanted to show their friends they could party and drink expensive booze all day.,Doreen Mokgolo,2016-02-26T10:00:00.000Z,"THE two thugs wanted to show their friends they could party and drink expensive booze all day. They didn’t have any money to buy good alcohol, so they robbed a local tavern of its expensive whiskies.But when they started selling the top booze at rock bottom prices, residents smelled a rat and reported them to the cops.The residents figured out the two were responsible for the break-in at Dimatis Tavern in Mogogelo, Hammanskraal last Tuesday.The two boozing buddies took the stolen liqour and started throwing parties, flaunting their stolen goods to their friends.But by Saturday morning, the community was gatvol of their non-stop partying and boozing and called the cops.Resident Shadi Seoka (36) said they were tired of criminals taking over their community.“We tried to talk to one of the suspect’s girlfriend, who owns the house where they were partying, but nothing happened.” She said they also heard the two thugs were selling expensive liquor for next to nothing.“We informed the tavern owner and the police after we heard about the burglary. “We decided to take action and get rid of them before they commit more crime in the area.”Residents gave the two a taste of mob justice before the cops arrived. Police spokesman Constable Herman Moremi said they received an anonymous tip-off informing them about the two suspects. “We discovered 15 boxes of expensive whiskies with an estimated value of R4 000. “They had already drunk some of the alcohol,” said Moremi.“The suspects were taken to hospital and will appear in court soon.”","['suspects', 'started', 'expensive', 'partying', 'bust', 'thieves', 'heard', 'tavern', 'residents', 'cops', 'selling', 'booze', 'stolen', 'thugs']","THE two thugs wanted to show their friends they could party and drink expensive booze all day.
They didn’t have any money to buy good alcohol, so they robbed a local tavern of its expensive whiskies.
But when they started selling the top booze at rock bottom prices, residents smelled a rat and reported them to the cops.
The two boozing buddies took the stolen liqour and started throwing parties, flaunting their stolen goods to their friends.
But by Saturday morning, the community was gatvol of their non-stop partying and boozing and called the cops."
Search,,,None,"FIVE YEARS ON, VICTIMS' FAMILIES STILL STA...Families affected by the Marikana massacre deserve justice and closure after what happened to their loved ones.These families have lost breadwinners and five years on, many haven’t received anything concrete.It’s clear no one will ever be arrested even though police are seen shooting people on video.These families are starving and their kids no longer can study because of what happened in 2012.For these victims, justice has been delayed. They are still waiting for meaningful compensation beyond assistance with funerals and school fees.Those who were in charge during the massacre still have their jobs and there has been no accountability or punishment.Where are the houses, roads, clinics and basic services promised by the different government departments?During these five years, no one has come forward to apologise for what they have done.No one has accepted responsibility or come forward with solutions for the mess they created.It is our duty as a people to rebuild that community and keep the dead people’s memory alive.The history books must record what happened at Marikana so we can learn from it.The families deserve more.A fund should have been created long ago as these people have been very badly treated.Our leaders must take responsibility and tackle the families’ poverty. Something must be done as things cannot carry on like this.Even the unions must take full responsibility. Let people actively help them rather than just commemorate the massacre. They deserve justice.","['world', 'way', 'unsung', 'bold', 'things', 'unleash', 'need', 'life', 'youre', 'focus']",
