Headlines,Descriptions,Authors,Published_Dates,Articles,Keywords,Summaries
Alarming number of youngsters in Indian cities take to drinking,Egged on by peers and condoned by indulgent parents an alarming number of youngsters in Indian cities are taking to the bottle. And chasing their own doom.,,2013-01-04T12:28:58+05:30,"Every fifth college student in Delhi drinks regularly. About three lakh teenagers can't kick the habit and one lakh need treatment. Every fifth college student in Delhi drinks regularly. About three lakh teenagers can't kick the habit and one lakh need treatment.

The parents were influential, the police turned silent and the incident got an official burial. But in Bangalore they still talk about it and with every telling the room turns cold with fear.

Five Bangalore boys decide to board a bus bound for Goa. One boy has stolen Rs 1.5 lakh from his parents to fund the trip. One of them gets cold feet and tips off the police. The errant four are found in Hubli, completely drunk. They are all 13 years old. They were going, they say, ""to drink and then die in Goa"".

Maybe that isn't chilling enough, so try this then. At 15, Sanjay Kumar was drinking Scotch. His father, a building contractor in Delhi wanted his son to ""live like a king"". This is a short story. At 19, the ""king"" was dead. Inebriated at a new year's party he drove his Zen into a pole.

The stories are getting gruesome, the evidence is mounting, the message is stark: teenage drinking is spiralling out of control. Drunk children in their shiny new cars with an alcohol-induced disdain for the law are worrying policemen.

Since January 1999, when the Chandigarh Police acquired a breath analyser, 226 people have been challaned for drunk driving. Nearly 40 per cent of them were teenagers. Similarly, the Maharashtra Police statistics show that in 1999 there were 244 accidents linked to teenagers who had imbibed a peg too many. Many of the accidents were fatal.

Teenagers, with no ID in hand, are streaming into liquor shops to buy their bottle of choice. Daljit Singh of Calcutta's Empire Stores says he gets an average of 60 teenage customers a day. ""They come during the daytime, and buy either canned beer or white drinks like vodka which are easy to conceal.""

Youngsters arriving at school with the stale smell of beer on their breath are not completely unknown. In Calcutta the principal of one of the city's posh schools suspended a boy for drinking on the campus.

In Delhi, Rajesh Kumar, then 15, drove to school with his friends, all clearly inebriated, and was thrown out. Today, with a history of deviant behaviour like locking his parents out of the house because they refused to give him a Gypsy, he is an alcoholic undergoing counselling. He is only 17.

Psychiatrists across the country are alarmed by this sudden spurt in teenage alcoholism. Delhi psychologist Dr Achal Bhagat puts it starkly, ""Alcoholism is becoming a lifestyle for teenagers"". In Chennai, Dr Gopalakrishnan at Chennai's Apollo Hospitals says, ""Children are misinterpreting a mug of beer for a fashion fad.""

He has six to 10 troubled teenage drinkers visiting him every month. Society in its ambivalence may pass it off as youthful indiscretion but it is far more serious than that. Alcohol routinely destroys brain cells, binge drinking can kill - in Bangalore, 17 youngsters drank all night late last year to find one of their friends dead in his own vomit the next morning - and the liver begins to malfunction.

Research by the WHO says that one out of 25 drinkers turns into an alcoholic. That's a scary statistic considering that alcoholics are 50 to 100 times more prone to commit suicide. As R. Kumar, a counsellor at the Bangalore chapter of Alcoholics Anonymous, confirms, ""We have more and more young people coming to us with drinking problems.""

Beyond the health impact is a larger social problem: young drinkers who move from use to abuse find their grades dropping, their interpersonal relationships turning sour and they often resort to deviant behaviour.

Says Harsh Vardhan, former health minister of Delhi and currently adviser to WHO's regional director for South-East Asia: ""When teenagers drink they damage their physical and mental growth. They are in fact chasing death.""

Almost half the 3,000 schoolchildren surveyed in Mumbai felt that alcohol was not harmful and that it enhanced self-confidence. Almost half the 3,000 schoolchildren surveyed in Mumbai felt that alcohol was not harmful and that it enhanced self-confidence.

The malaise is rooted in the societal acceptance of alcohol and society's indulgent view towards teenagers knocking down the odd peg. Unlike drugs that have an alarming connotation to them, a frothy glass of beer is hardly taboo.

If anything, there is a conspicuous absence of deterring messages. The images that waft into living rooms through cable television seem to promote the idea that a swig of beer equals youthful exuberance. Instead of public caution over alcohol's harmful effects, the signals are positive.

It's hard to convict Shah Rukh Khan for sauntering through a Bagpiper advertisement or Ajay Jadeja for dancing for Kingfisher, but there's no one there to interpret the message for children who go wide-eyed at what their heroes are doing. As psychiatrist Dr Debashish Bhattacharya explains, ""Teenagers have several mistaken notions about drinking: that it is masculine, it enhances the sex drive and that achievers do it.""

Hanging around at home with 17-year-old friends and posturing over a whisky bottle, or popping into a bar for an illegal pitcher of beer because it's hep, is common conduct among teenagers. For a generation of sensation seekers with an extremely low threshold of boredom, this is terrific pastime.

As Shruti, an 18-year-old pub-goer from Chandigarh, says, ""Beer is not an intoxicant. It's a social lubricant."" Alcohol becomes an excuse for everything. If you're too shy to talk to a girl, rum will give you courage; if you're not fitting in with your peers what's a vodka if it means acceptance.

Peer pressure as always can be tortuous and as Deepa, a fresher at a Mumbai college puts it, ""If you say no you could be alone for the entire evening and labelled a spoilsport. So what's the big deal in a couple of beers?"" Dilip, a third-year student explains soothingly, ""The next morning the maximum you have is a headache.""

If only it was that simple. Sanjay Sahney knows, for he too began with a glass of beer just to be part of the crowd. An engineering student in Mumbai, the metropolis was a different world for this insular Indore boy.

No parents to note his movements, a rich girlfriend who enjoyed frequenting the city's hot spots, life was that cliched ""big party"", he says. Except that one glass of beer grew to a bottle, one bottle grew to four a day. ""I used to crave for the high because it left me happy.""

Except that his grades slipped and he fell into debt, till a student counsellor sent him to Seva Dan, an NGO that works with alcohol and drug abusers. Today, eight months later, Sahney is limping back to normalcy.

In the heat of the moment, young men are too busy to realise that the confidence a bellyful of beer brings is entirely false and often dangerous. They strut out of bars ready to do Michael Schumacher impersonations on city roads only to wind up sober in the morgue.

Similarly, a brain addled by too many whiskies emboldens shy young men and leads them into risky sexual behaviour. ""They consume alcohol to get the confidence ... and then they visit prostitutes,"" says Sekhar Sheshadri, additional professor of psychiatry, NIMHANS. A scary corollary to this is another NIMHANS study which reveals that 70 per cent of HIV patients are alcoholics, especially teenagers.

The best way to control the problem is to make it more difficult for youngsters to find a drink. Liquor shops must insist on proof of age. The best way to control the problem is to make it more difficult for youngsters to find a drink. Liquor shops must insist on proof of age.

As alcohol abuse grows it becomes a significant crutch and much like Asterix, young people believe that one sip of this magic potion is all it takes. A survey of 3,000 class 10 students by Seva Dan in 13 schools in Mumbai revealed some frightening figures.

Forty-eight per cent of the children didn't think that alcohol was harmful, 47 per cent said it helped gain confidence and 52 per cent said it helped decrease mental tension.

If parents are slow to recognise their child is stressed, they take a mild view if their children toss back a few even if they haven't reached the legal age. As Panjab University sociologist Rajesh Gill says, ""It's no longer stigmatised."" The comments are not out of place.

A fortnight ago, Sanjeev Verma, owner of Wild West, one of Chandigarh's oldest pubs, was told by a father that he wanted beer served at his son's school passing-out party. A manager of a bowling company in Mumbai concurs: ""We have the right to refuse but if a parent asks for a pitcher of beer and pours his teenage son a glassful we are helpless.""

Not all parents grant their children a drinking license. Yet when both parents work and attempt to compensate for their absence by doling out large sums of pocket money, it can be a dangerous indulgence.

It is a situation that is compounded by the easy availability of alcohol, says Vimla Nadkarni, professor at the Tata Institute of Social Sciences, Mumbai. Unlike most western countries where only the flash of a required ID is a passport to a drink, laws in India are loosely enforced.

Eighteen may be the legal age to ask for a beer but one round of the pubs in any city confirms that few bartenders have ever heard of it. And there are certainly no shortage of pubs. Six years ago, Chandigarh, a city of white beards, had just two pubs; today there are 26.

Excise Department rules also stipulate that a liquor outlet must not come up within 100 m of an educational institution or religious place, but it is a rule easily flouted. Governments see no sin in being casual, blinded as they may be by profits.

In Maharashtra, the excise income from sales of beer, IMFL, and wine in 1997-98 was Rs 774.79 crore; in 1998-99 it is expected to be Rs 1,023.23 crore.

Naturally, teenage alcoholism is also on the rise. According to studies done by the De-Addiction Centre at AIIMS in Delhi, every fifth teenager in the 15-19 age group in the capital drinks regularly and around three lakh are addicted.

Another one lakh, it is estimated, need medical attention for alcohol-related disorders. Says H.K. Sharma, a social scientist who was associated with the studies: ""Any party or get-together is incomplete without corks popping open. It's a whirlpool into which children get sucked so easily.""

To alter established mind-sets, to convince a generation that the buzz that comes with a beer has dangerous implications, requires a mammoth effort.

Counsellors stress that parents must start communicating with their children, identify reasons for their stress and not turn away with a grin when junior steals a peg of whisky from daddy's cabinet. In fact, some Mumbai colleges have already put up posters that read, ""Drinking with Dad is also Bad"".

The most basic of all prevention is enforcing the ban on sale to those under 18. The harder it is for kids to find a drink the better it is. As Y.G. Rajalakshmi Parthasarathy, dean of the Chennai's Padma Seshadri group of schools insists: ""Age certificates have to be made a must.""

Chennai Police say they conduct surprise raids in front of schools on Saturday nights when teenagers are prone to drink and drive, but it's not enough.

Also, a society that merely smirks at underage kids trying to find some machismo in a beer mug needs to understand there's nothing amusing in it. The journey from recreation to addiction, or to death in a Zen at 19, is not a long one.

-with Sayantan Chakravarty, Avirook Sen, Ramesh Vinayak, Stephen David and Methil Renuka","['cities', 'alarming', 'youngsters', 'teenagers', 'delhi', 'number', 'children', 'parents', 'drinking', 'beer', 'mumbai', 'lakh', 'drink', 'indian', 'alcohol']","About three lakh teenagers can't kick the habit and one lakh need treatment.
About three lakh teenagers can't kick the habit and one lakh need treatment.
The stories are getting gruesome, the evidence is mounting, the message is stark: teenage drinking is spiralling out of control.
In Calcutta the principal of one of the city's posh schools suspended a boy for drinking on the campus.
In fact, some Mumbai colleges have already put up posters that read, ""Drinking with Dad is also Bad""."
'I would like to do more work than what I get to do',,,2008-01-19T09:58:17+05:30,"A well-known face on TV, hes acted in serials like Hasrateein, Ghar Ek Sapna, Love Story and Thodi Si Zameen, Thoda Sa Aasman. Apart from some regional movies, he has also acted in Bollywood movies like Ramji Londonwale and Corporate. He was last seen in a cameo role in Yash Rajs Laaga Chunari Mein Daag. Currently shooting for Madhur Bhandarkars Fashion where he is playing a gay character, Harsh Chhaya speaks to Shruti Vashist about his journey from being a TV actor to working in films.

Q. Tell us about your role in Fashion.

A. In the movie, I am playing a gay fashion designer. We just started shooting for the movie this month and it has already been quite an experience for me. While I havent changed my lifestyle or the way I look physically, I have to walk, talk and behave in a certain manner which complements my character. This has really been an out-of-body experience for me that I have enjoyed doing so far.

Harsh Chhaya Harsh Chhaya

A. I heard that Madhur Bhandarkar was making this movie. I really liked the concept of it and shot myself with a home video camera for the auditions of the various roles in the movie. I presented it to Bhandarkar and, within a few days, I got a call from him. I was happy to get this particular role because Bollywood rarely offers experimental roles like this.

Q. How has the transition from TV to films been?

A. Well, I have done TV for many many years now and that can sometimes go against you as an actor. As an accomplished TV actor, I have to face a lot of resistance from the film world. So it is almost like starting from scratch. For whatever reason, I have not been offered too many film roles and would like to do more work. Fashion will help me prove to people that I am a versatile actor and hopefully get me more offers.

Q. Whats in the pipeline?

A. I will be seen in a comedy called Oh God No God with director Saurabh Srivastav which stars Divya Dutta and Vinay Pathak. Another upcoming venture is Dhuan, which will be directed by Mrinalini Dayal and is based on an issue very relevant today.

Q. Your views on anything Gujarati?

A. Although I dont know much about Gujarati cinema, as I have been born and brought up in Delhi, they seem to be too stuck on traditional plots. While my father is from Vadodara, I have relatives in Gujarat in the interiors like Surendranagar and Limbdi. There is stuff about Gujarat which amuses me like the alcoholics anonymous in a totally dry state!

Q. Can you read and write Gujarati?

A. Yes. I taught myself Gujarati by reading local papers whenever I visited Gujarat.","['gujarat', 'actor', 'really', 'movie', 'roles', 'shooting', 'tv', 'work', 'seen', 'fashion', 'role']","He was last seen in a cameo role in Yash Rajs Laaga Chunari Mein Daag.
Currently shooting for Madhur Bhandarkars Fashion where he is playing a gay character, Harsh Chhaya speaks to Shruti Vashist about his journey from being a TV actor to working in films.
We just started shooting for the movie this month and it has already been quite an experience for me.
As an accomplished TV actor, I have to face a lot of resistance from the film world.
For whatever reason, I have not been offered too many film roles and would like to do more work."
Shubhangi to replace Shilpa Shinde in Bhabi Ji Ghar Par Hai,Shubhangi to replace Shilpa Shinde in Bhabi Ji Ghar Par Hai,,2016-04-16T15:40:40+05:30,"Mumbai, Apr 16 (PTI) Well-known television actress Shubhangi Atre will essay the role of Angoori Bhabhi in the show ""Bhabi Ji Ghar Par Hai"".

After actress Shilpa Shinde, who played the role of Angoori had quit the show, the makers were in search for her replacement.

""Shubhangi Atre is an ideal combination of innocence and attractiveness. She is a fabulous actress and I think she will make an exceptional Angoori Bhabhi and will capture everyones heart with ease,"" producer Benaifer Kohli said in a statement issued here.

Shubhangi is known for her roles in ""Kasturi"" and ""Do Hanson Ka Jodaa"".

Shilpa had sparked a controversy when she announced that she had quit ""Bhabi Ji Ghar Par Hai"" and accused the makers of mentally torturing her.

According to Shilpa, the problem started when the makers wanted her to sign a contract which would bar her from doing other shows.

Reportedly she was approached for a comedy show of Kapil Sharma.

On the other hand, the makers had alleged unprofessional behaviour on Shilpas part and said the actress had demanded a pay hike and wanted her own designers on the show.

The popular sitcom ""Bhabi Ji Ghar Par Hai"" is aired on &TV. PTI KKP NRB SHD","['par', 'ghar', 'makers', 'shubhangi', 'hai', 'wanted', 'shinde', 'angoori', 'shilpa', 'ji', 'bhabi', 'actress', 'role', 'replace']","Mumbai, Apr 16 (PTI) Well-known television actress Shubhangi Atre will essay the role of Angoori Bhabhi in the show ""Bhabi Ji Ghar Par Hai"".
After actress Shilpa Shinde, who played the role of Angoori had quit the show, the makers were in search for her replacement.
Shilpa had sparked a controversy when she announced that she had quit ""Bhabi Ji Ghar Par Hai"" and accused the makers of mentally torturing her.
According to Shilpa, the problem started when the makers wanted her to sign a contract which would bar her from doing other shows.
The popular sitcom ""Bhabi Ji Ghar Par Hai"" is aired on &TV."
Anita Nair's Ladies Coupe: A brilliant evocation of sisterhood on the move,Book review of Anita Nair's 'Ladies Coupe'.,,2012-10-29T12:52:51+05:30,"By Anita Nair

Penguin



In the flood of ""Wimmen's writing"" that depicts women as battered, bartered and abandoned on the shoals of low self worth, Anita Nair's second novel rides triumphantly against the tide. Second novel? Is it possible? The ink has barely dried on Nair's first one, The Better Man, that trawled with intent through fiction's latest heart of darkness, the matrilineal murkdom of Kerala, when she's produced another one.

The better woman: A store of revelatory life-affirming tales The better woman: A store of revelatory life-affirming tales

Apparently, Nair's imagination teems with stories that leap out like tiny silver fish, struggling to escape a fisherman's basket. As though to acknowledge the fact, she has signalled that her book is ""a novel in parts"" and indeed she seems more adept at stringing together a collection of short stories than in going for the long haul.

In Ladies Coupe Nair has resorted to one of the oldest ploys. She has taken a leaf out of Chaucer's mixed crowd of pilgrims travelling to Canterbury telling tales to each other. He himself, as is well known, borrowed from Boccacio who had his well-heeled cast of characters relating stories to each other while sitting out the plague. Nair's characters too are singularly life affirming.

Though they do not confess their life stories publicly to each other while sitting in what used to be a regular feature of rail journeys, the ""ladies compartment"" or coupe of the title, the manner in which she has them sharing their experiences with the protagonist, Akhila or Akhilandeswari, as she becomes towards the end, assuming her full potential as a woman, quite often sounds like a female version of Alcoholics Anonymous.



Excerpt Akhila dreams: a train that trundles, truckles and troops into a station. Akhila is seated by a window. Everything but the train is still. The moon hangs at her shoulder and rides with her. She travels through a gallery of nightscapes, each framed by the window. A light in a house. A family huddled around a fire. A howling dog. A distant town. Black oily waters of a river. A menacing hill. A curling road. A railway-crossing with the streetlight glinting on the glasses of a man on a static scooter, hands dangling at his side, heel on the ground, head cocked, watching, waiting for the train to hurtle past. At the station, portraits replace impressions. Reunions. Farewells. A smile. Tears. Anger. Irritation. Anxiety. Boredom. Stillness. Akhila sees them all. The train begins to move.

Akhila dreams of being there. And not there. Of adding a memory by the moment.

Were the railways providing a hitherto unknown service to the sisterhood of women by throwing them in together for a night and a day of bonding through the boondocks of the Indian countryside? We shall never know. Part of the charm of Nair's narrative is that we are lulled into accepting her thesis.

Once locked in together, it's a question of age no bar, caste no bar, sex no bar, indeed the intimacy with which the ladies discuss their sexual adventures seems to underline the message that ""having sex"" is destiny.



Akhila herself is the magnet for their stories. She has suddenly decided to take her life in her hands. At the age of 45, having achieved near anonymity working as a clerk in the Income Tax Department she is suddenly filled with the idea of revolt. She decides to bolt, to take a long train journey to Kanyakumari.

Are there shades of an Anita Brookner heroine here, encased in stiffly starched cotton saris and the disappointments of a lifetime of sacrifice travelling to her own Hotel Sea Breeze by the seafront? Though she might lack the subtlety of a Brookner heroine, Akhila is not without her desires.

There's a hilarious description of her singular form of revolt when she wants to taste a boiled egg brought by an Anglo-Indian colleague to work and, much later, a tense moment when she discovers herself responding to the anonymous groping of a man's hand in a crowded bus.



Nair's evocation of the ordinariness of a middle-class Brahmin family struggling to keep itself afloat in Chennai, hanging on to the rigid pattern of their lives, as exemplified in the patterns of kolam traced in front of their houses and expecting an unquestioning sacrifice from the women in the family to underwrite this myth, is what powers her narrative.



Akhila and her friends are on the threshold of self-discovery. The manner in which Nair relates these transformations is in turn revelatory and redeeming. Her tale is light enough to relieve the tedium of a long journey and yet filled with the incantatory power to burn up the tracks, to seek a new destination. To change.","['sisterhood', 'brilliant', 'akhila', 'life', 'novel', 'revelatory', 'evocation', 'train', 'women', 'ladies', 'woman', 'long', 'coupe', 'anita', 'nairs']","By Anita NairPenguinIn the flood of ""Wimmen's writing"" that depicts women as battered, bartered and abandoned on the shoals of low self worth, Anita Nair's second novel rides triumphantly against the tide.
In Ladies Coupe Nair has resorted to one of the oldest ploys.
She has taken a leaf out of Chaucer's mixed crowd of pilgrims travelling to Canterbury telling tales to each other.
Part of the charm of Nair's narrative is that we are lulled into accepting her thesis.
She decides to bolt, to take a long train journey to Kanyakumari."
