Headlines,Descriptions,Authors,Published_Dates,Articles,Keywords,Summaries
One of the most successful ways of treating addicts is Alcoholics Anonymous programme,Today the T.T. Ranganathan Clinical Research Centre (TTRC) has grown into an institute of national repute and is the only one of its kind for treating alcoholics.,,2014-01-27T16:19:47+05:30,"Aversion therapy: effective Aversion therapy: effective

When Shanthi Ranganathan, a Madras housewife, decided to set up an exclusive centre for the treatment and rehabilitation of alcoholics five years ago, many people dismissed her efforts as the desperate actions of a grief-stricken wife. Her husband, an industrialist, had just died from alcoholism and Shanthi recalls: ""People thought I was crazy. They could not accept that alcoholism could be cured, and doctors warned me that it was a disease of only relapses and remissions."" But Shanthi was determined. She did a course in the US on the treatment of alcoholics and started a centre in her sprawling home on the quiet Santhome High Road in Madras.Today the T.T. Ranganathan Clinical Research Centre (TTRC) has grown into an institute of national repute and is the only one of its kind for treating alcoholics. Given the excellent cure rate of almost 60 per cent, the annual inflow of patients has gone up from 62 in 1981 to 320 last year.Before the centre was established, there were hardly any treatment facilities for the country's three million alcoholics, most of whom were admitted to the general wards of hospitals and treated for symptoms like jaundice or hallucinations. The centre's success lies in the fact that it offers treatment for the basic problem of alcoholism. It first admits patients to a nursing home for withdrawal symptoms like hallucinations, vomiting and severe shakes.Once the ""detoxification programme"" is over, patients undergo intensive individual and group therapy sessions. Surprisingly, most patients blame their problems on others. A bank manager undergoing treatment blamed his son who dropped out of college as the reason for his heavy drinking.The group therapy sessions help patients to confront their problems head on. In these sessions, recovering alcoholics narrate their problems, providing hope and making it easy for new patients to identify with them. Says psychologist Christina Chakravarthy: ""Group therapy helps in assuaging their guilt and releases their bottled-up feelings."" The patient is able to admit both to himself and others that he is an alcoholic.But to ensure that he does not yield to fresh temptation, the patient is put on a drug called Antabuse which causes a violent reaction if he consumes alcohol while on the course. The reactions could even result in death unless an antidote is administered within 24 hours.However, getting an alcoholic to admit that he is one and keeping him off liquor for a month is, as psychiatrist J.V. Devar puts it, ""only half the battle won"". The more difficult part is rehabilitating him so that he can start living a normal life. Most alcoholics have snapped ties with their family and friends and have probably lost their jobs too. One of the major hurdles psychiatrists face is in getting the family to be more understanding towards recovering alcoholics. This is easier said than done as the wife of a salesman-turned-alcoholic narrates. Her husband found that he hardly had any role to play at home because she did all the work and the children held back from him. To overcome these problems, the centre holds regular family counselling sessions where the families are taught how to cope with recovering alcoholics.While centres like TTRC may be difficult to replicate in the country, elsewhere, hospitals which have set up de-addiction clinics (and there are very few) have also been reporting encouraging results. One of them is the de-addiction centre run by the KEM Hospital in Bombay. Using a judicious combination of group therapy, individual counselling and an Antabuse course, the clinic reports that in the past two years it has been able to achieve a cure rate of 46 per cent. And in Bangalore, NIMHANS psychologists using aversion have reported an encouraging 45 per cent cure rate. Says psychologist V. Kumaraiah: ""We found that married people responded to treatment better than the rest, and the recovery rate was the highest among the older groups.But probably one of the most successful ways of treating addicts is the Alcoholics Anonymous (AA) programme which is fast gaining popularity in the country. AA is a non-profit world-wide organisation of recovered alcoholics trying to help others in the same plight. There are already 100 such groups in the country, with Bombay alone boasting 55. Other cities with AA groups are Bangalore, Goa, Madras, Secunderabad, New Delhi, Cochin, Mangalore, Nagpur, Pune and Mysore.

AA members find that the group sessions help alcoholics to come to terms with their problems. In fact the first step for all AA members is to admit that ""we were powerless over alcohol, that our lives had become unmanageable"". The sessions also help other recovering alcoholics by constantly reminding them of their earlier plight. Said an a a member: ""By trying to help others we are actually motivating ourselves to keep away from liquor.""

For the families of alcoholics, the AA has a separate group called Al-Anon where members hold similar group therapy sessions. Rather than impose a set period of abstinence, the AA's golden rule for its members is: Get up every morning and tell yourself that you will remain sober for the next 24 hours. It seems to work.","['centre', 'help', 'aa', 'sessions', 'treatment', 'problems', 'patients', 'therapy', 'alcoholics', 'treating', 'successful', 'programme', 'anonymous', 'group', 'ways', 'addicts']","It first admits patients to a nursing home for withdrawal symptoms like hallucinations, vomiting and severe shakes.Once the ""detoxification programme"" is over, patients undergo intensive individual and group therapy sessions.
In these sessions, recovering alcoholics narrate their problems, providing hope and making it easy for new patients to identify with them.
Says psychologist Christina Chakravarthy: ""Group therapy helps in assuaging their guilt and releases their bottled-up feelings.""
AA members find that the group sessions help alcoholics to come to terms with their problems.
For the families of alcoholics, the AA has a separate group called Al-Anon where members hold similar group therapy sessions."
Original 1939 Alcoholics Anonymous Manuscript Could Sell for $3 Million,"The original manuscript of Alcoholics Anonymous, first published in 1939, will go up for auction in California on June 8, and is currently being displayed at the Questroyal Fine Art gallery in Manhattan, New York City. The ""Big Book"" as it is known by AA members contains annotations and revisions made by Alcoholics Anonymous' author William Griffith Wilson. The 12-step program designed to end addiction to alcohol has sold more than 30 million copies and is considered to be one of the most influential books of the twentieth century.",,2017-05-19 00:00:00,"The original manuscript of Alcoholics Anonymous, first published in 1939, will go up for auction in California on June 8, and is currently being displayed at the Questroyal Fine Art gallery in Manhattan, New York City. The ""Big Book"" as it is known by AA members contains annotations and revisions made by Alcoholics Anonymous' author William Griffith Wilson. The 12-step program designed to end addiction to alcohol has sold more than 30 million copies and is considered to be one of the most influential books of the twentieth century.","['million', 'wilson', 'sold', 'manuscript', 'sell', '1939', 'revisions', 'william', 'alcoholics', 'york', 'questroyal', 'anonymous', 'published', 'twentieth', 'original']","The original manuscript of Alcoholics Anonymous, first published in 1939, will go up for auction in California on June 8, and is currently being displayed at the Questroyal Fine Art gallery in Manhattan, New York City.
The ""Big Book"" as it is known by AA members contains annotations and revisions made by Alcoholics Anonymous' author William Griffith Wilson.
The 12-step program designed to end addiction to alcohol has sold more than 30 million copies and is considered to be one of the most influential books of the twentieth century."
Demi Lovato left Met Gala to go to Alcoholics Anonymous meeting,Demi Lovato left Met Gala to go to Alcoholics Anonymous meeting,,2018-03-10T11:05:11+05:30,"Los Angeles, Mar 10 (PTI) Demi Lovato has recalled her ""terrible"" Met Gala experience from two years ago, saying the atmosphere was so off-putting that she ended up leaving the party for an Alcoholics Anonymous meeting.

The 25-year-old singer said it was a ""very cliquey"" party.

""I had a terrible experience. This one celebrity was a complete b**tch and was miserable to be around. It was very cliquey... I remember being so uncomfortable that I wanted to drink,"" Lovato, who has been sober for six years, told Billboard.

She said she ditched her party clothes but went to the 10 pm meeting wearing her diamonds.

""I changed my clothes, but I still had my diamonds on-millions of dollars of diamonds on in an AA meeting. And I related more to the homeless people in that meeting who struggled with the same struggles that I deal with than the people at the Met Gala-fake and sucking the fashion industrys d**k,"" Lovato said.

Alcoholics Anonymous is a fellowship of men and women who share their experience and hope with each other that they may solve their common problem and help others to recover from alcoholism. PTI RDS SHD SHD","['left', 'met', 'diamonds', 'party', 'terrible', 'lovato', 'clothes', 'meeting', 'demi', 'alcoholics', 'anonymous', 'shd', 'pti', 'experience', 'gala']","Los Angeles, Mar 10 (PTI) Demi Lovato has recalled her ""terrible"" Met Gala experience from two years ago, saying the atmosphere was so off-putting that she ended up leaving the party for an Alcoholics Anonymous meeting.
""I had a terrible experience.
She said she ditched her party clothes but went to the 10 pm meeting wearing her diamonds.
""I changed my clothes, but I still had my diamonds on-millions of dollars of diamonds on in an AA meeting.
PTI RDS SHD SHD"
"Compounded by denial and loneliness, alcoholism among women becomes growing urban problem","Compounded by denial and a dearth of treatment centres, alcoholism anions women is a growing urban problem.",,2013-06-20T14:12:29+05:30,"More than anything else, this letter from her 11-year-old daughter put Priya Singh, a Delhi housewife, back on the road to sobriety. ""That was my rock-bottom. I decided that I had to do something about my alcoholism."" But after drinking heavily for almost two years - something that pushed her marriage to the brink - she knew getting back to normal wasn't going to be easy.

She visited a rehabilitation centre, and after several relapses finally succeeded in giving up alcohol altogether. Frequent attendance at the Alcoholics Anonymous (AA) meetings helped and Priya is beginning to pick up the broken pieces of her life. She is now reunited with her two children and is trying to make her marriage work.

In urban India, alcoholism has for long been regarded as a male affliction. Not any more, as psychiatrists in the country's metropolises report. What began as a trickle of female patients coming in for treatment is now a widening stream. An estimated three out of 10 alcoholics in many established clinics across the country are now women.

Unfortunately, only now is the problem being taken seriously. At the National Institute of Mental Health and Neurosciences (NIMHANS) in Bangalore, the country's premier neurosciences research institute, around 10 female patients used to report for treatment every month just five years ago. Now, there are 30 to 35 every month and the institute has been forced to open a separate outpatient department for women alcoholics.

Explains Dr LA. Shariff, head of the Department of Psychiatric Social Welfare at NIMHANS: ""Nobody speaks or makes public this problem because, in the Indian situation, for a woman to be alcoholic is considered worse than being a prostitute or a criminal. There is social ostracism. So, the way most women cope with it is by hiding their problem.""

In Bombay, as the problem escalated, the Kripa Foundation, which has seven centres across the country for treating alcoholics and drug addicts, had to open a separate section for women. Part of the reason, according to Ossie Pereira, co-founder of the foundation, was that ""most alcoholics, men and women, haven't been able to handle sex normally. So if I had a mixed centre, I would have to start a maternity ward instead.""

And Dr D. Mohan, head of the Department of Psychiatry, All India Institute of Medical Sciences (AIIMS), predicts that by the year 2000, overall India is likely to see one female alcoholic for every three male alcoholics - a ratio prevalent in the West today.

So, why exactly are women in India hitting the bottle in such alarming numbers? There is no clear answer. Research worldwide points a finger at a gene which could make alcoholism hereditary. Others talk of a certain percentage of people who are exposed to alcohol automatically becoming chemically dependent on it. For instance, the who estimates that one out of 25 people who drink will turn alcoholic as a result.

Part of the reason for the dramatic rise in women's dependency on alcohol is simple - they are now more exposed to alcohol socially than at any time in the recent past. It is no longer taboo for women to drink in public, and in parties it is the done thing. Confirms Rakesh Ghildiyal, Associate Professor of psychiatry at KEM, Bombay: ""Alcohol is a bigger problem among women than any other drug because it now has social sanction.""

Nowadays, three out of 10 alcoholics reporting for treatment in established clinics in Indian cities are women.

Others, like Delhi-based psychiatrist Dr Avdesh Sharma, feel that it could be modern-day problems which are driving women to alcoholism.

The most cited reason is stress. The balancing act required to keep a home and a career going has been known to take its toll. Conversely, a workaholic husband could lead to a depressed and lonely wife at home.

Rachna Sharma, 38, would agree. Three grown-up children meant more time in her hands and a loving but hopelessly busy husband had no time to fill that. The bottle provided the initial solace and then the addiction took over.

If loneliness is creeping stealthily into Indian lives as joint families - and even nuclear ones - break up, it is compounded by an increasing identity crisis faced by urbanised Indians. Are we as cool and hip as our western counterparts? Hot-shot marketing executive Sonia Malik, 40, wanted to be all that and more.

""I started drinking to deal with stress and to be in with the crowd."" The only problem was that her drinking continued well after everyone went home. And often, just as others were beginning their day - a pattern common among alcoholics.

Denial and lack of empirical data have led to the problem turning even more serious. Says Ashwini Ailawadi, an addiction counsellor in Delhi: ""We have this neat policy of denial. Indian women do not have sex, they don't have orgasms and they don't drink. We simply solve the problem by denial."" The issues a woman alcoholic faces are very different from what a man goes through - this needs to be addressed.

Her drinking is even more hidden than his, thus making it all the more difficult to detect. Says Sonia: ""I used to stay late in the office and drink secretly, but I was always very controlled in public - a woman has to be. I would fall apart the minute I reached home.""

Home, unfortunately, is not where the support system is anymore. Husbands could be alcoholics or, at the very least, the initiating party. At the other end of the scale could be an alcoholic parent hovering in the background. Rahul Khanna, 40, became the target of his wife's criticism about five years ago. Her complaint? That he drank too much.

In what she thought was an attempt at getting closer to him, Deepti, 35, too started drinking. ""We began to share a few drinks together and things began to look more cheerful."" she recalls. The cheer proved as short-lived as the fizz in a glass of beer. A truncated career and several violent fights later, the Khannas realised the severity of the problem.

Career and family life are not the only things at risk. Studies conducted in the US show that spontaneous abortions and early miscarriages are more likely to occur among alcoholic women.

Pregnant women in their first trimester are at a risk factor of 12 per cent even if they are modest drinkers. And the risk of congenital abnormalities is estimated to be as high as 32 per cent for women who are heavy drinkers. Worse, children are found to be more seriously affected by alcoholic mothers than fathers.

The problem also persists because there are no stereotypes, no target groups. And unfortunately, no safe groups either. At one end of the spectrum are groups like tribals and plantation workers, from whom come 48 per cent of women alcohol users.

Women in the weaker economic strata have always consumed alcohol. Now, there is the new addition of the middle classes, which could include anyone from a college student to a bored housewife. Says Karl Sequeria, joint director of the Bangalore-based Freedom Foundation, a rehabilitation centre: ""I find that more and more young college-going women are drinking heavily, a cause for grave concern.""

Why Treatment is Tough





Alcohol is often abused, with prescription pills making it a deadly cocktail.

Complete lack of rehabilitation centres and support groups.

Families are rarely supportive.

So, while recognition is often myopic, treatment runs into a blind alley.

Women face specific guilt trips and problems but rehabilitation centres and support groups are dominated by, and are often for, men.

Rape, manipulation and sexual baiting are all part of a woman alcoholic's routine.

With such a negative gender background, a woman with this problem finds it difficult to enter a predominantly male group. Even an immensely successful support group like AA faces this problem. There is now a crying need for separate rehabilitation centres for women, like the one NIMHANS has begun.

The silver lining to this dark cloud is that sobriety gives recovering women alcoholics an unparalleled high. Every experience is savoured with a new enthusiasm and talk of a new life.

Sonia, who was considered dead for all practical and financial reasons, is today at the centre of all family decisions. Priya is the emotional anchor for her two teenage children. Most of them further the cause of sobriety by keeping their doors open to fellow alcoholics.

- with Arun Kattyar in Bombay and Saritha Rai in Bangalore

______________________________________________________________________________



(Names of some people have been changed to protect their identities.)","['problem', 'support', 'alcoholic', 'denial', 'treatment', 'women', 'compounded', 'alcohol', 'woman', 'alcoholics', 'drinking', 'loneliness', 'alcoholism', 'rehabilitation', 'growing', 'urban']","Now, there are 30 to 35 every month and the institute has been forced to open a separate outpatient department for women alcoholics.
The issues a woman alcoholic faces are very different from what a man goes through - this needs to be addressed.
Studies conducted in the US show that spontaneous abortions and early miscarriages are more likely to occur among alcoholic women.
At one end of the spectrum are groups like tribals and plantation workers, from whom come 48 per cent of women alcohol users.
The silver lining to this dark cloud is that sobriety gives recovering women alcoholics an unparalleled high."
