Headlines,Descriptions,Authors,Published_Dates,Articles,Keywords,Summaries
Britney Spears' ex-lover killed by Afghan Taliban,"Pop star Britney Spears is left ""devastated"" after her former lover and a hero pilot, who helped her quit booze, has been killed by the Taliban in Afghanistan.",,2015-01-18T12:18:25+05:30,"Britney remained friends with John after their romance ended but were said to have reignited their relationship last summer. Britney remained friends with John after their romance ended but were said to have reignited their relationship last summer.

Pop star Britney Spears is left ""devastated"" after her former lover and a hero pilot, who helped her quit booze, has been killed by the Taliban in Afghanistan.

John Sundahl's helicopter was shot down near Kabul where he had been working for several months as a private contractor ferrying officials across the war-torn country.

The 44-year-old's brother Karl said: ""It's heartbreaking - John went there to try to repair the country.

Britney, 33, dated John in 2007 after they met at an Alcoholics Anonymous meeting in Los Angeles and she has credited him with helping her beat her drink problems, the mirror.co.uk reported.

They remained friends after their romance ended but were said to have reignited their relationship last summer.

A source close to Britney, who has sons Jayden James, 8, and Sean Preston, 9, with ex-husband Kevin Federline, 36, said: ""She is devastated. Britney thought he was a lovely man.""

Speaking from his home in Los Angeles, his brother Karl told how John died.

""John was on a journey from Kabul when he was shot at and killed. We were told by the State that John had died, they told us the Taliban did it. This is just awful. My family are heartbroken, my parents are elderly so this is very tough for them, and all of us. We know Britney's upset too.

""John was still good friends with Britney, he talked to her regularly. They dated for a while but always kept in touch afterwards,"" the Mirror quoted him as saying.

John's body was repatriated to the US last week and a small family funeral was held at a Buddhist temple in LA.","['britney', 'afghan', 'ended', 'john', 'relationship', 'killed', 'romance', 'reignited', 'exlover', 'taliban', 'remained', 'told', 'friends', 'spears']","Britney remained friends with John after their romance ended but were said to have reignited their relationship last summer.
Britney remained friends with John after their romance ended but were said to have reignited their relationship last summer.
Pop star Britney Spears is left ""devastated"" after her former lover and a hero pilot, who helped her quit booze, has been killed by the Taliban in Afghanistan.
They remained friends after their romance ended but were said to have reignited their relationship last summer.
We were told by the State that John had died, they told us the Taliban did it."
"Selena Gomez finds Kylie's texts on Justin 's phone, goes furious",Selena Gomez reportedly went mad after she found text messages and pictures on her on/off boyfriend Justin Bieber's phone from Kylie Jenner.,,2014-04-30T13:00:25+05:30,"The 21-year-old singer, who has had an on/off relationship with Justin for three years, ended her friendship with the reality TV star earlier this month after she found out she'd been texting the 'Baby' hitmaker and sending him photos.

A source told RadarOnline.com: ""Selena flipped out and there was a huge fight between the girls. She now wants nothing to do with Kylie or [her sister] Kendall.""

Selena has been attending church regularly in the hope that it'll help her deal with her depression. Selena has been attending church regularly in the hope that it'll help her deal with her depression.

However, it's not just the sisters that have had the cold shoulder from Selena - who was seen cuddling Justin at the Coachella Valley Music and Arts Festival earlier this month - as she's also dumped the 20-year-old singer.

The source explained: ""Selena was also furious at Justin. They're not together right now.""

Meanwhile, the 'Come & Get It' hitmaker has recently turned back to her old friends because she wants to focus on her career and doesn't want to be known as a party girl.

The 'Spring Breakers' actress, who spent three weeks in rehab in January, has also been attending church regularly in the hope that it'll help her deal with her depression.

A source said previously: ""Selena is trying to change her ways by going to church and more so to avoid going to rehab. She feels like she has a spiritual gap and that maybe that's why she is struggling.

""She learned about the spiritual aspect in rehab when they talked about the Twelve Steps of Alcoholics Anonymous.""","['source', 'kylies', 's', 'selena', 'rehab', 'itll', 'finds', 'hope', 'justin', 'deal', 'furious', 'texts', 'church', 'goes', 'gomez', 'regularly', 'help', 'phone']","A source told RadarOnline.com: ""Selena flipped out and there was a huge fight between the girls.
Selena has been attending church regularly in the hope that it'll help her deal with her depression.
Selena has been attending church regularly in the hope that it'll help her deal with her depression.
The source explained: ""Selena was also furious at Justin.
A source said previously: ""Selena is trying to change her ways by going to church and more so to avoid going to rehab."
LETTERS,,,1993-09-15T00:00:00+05:30,"A PYRRHIC VICTORY

I am anguished by the immorality of means and the crude tactics adopted by the Rao Government to defeat the no-confidence motion sponsored by the combined opposition (""A Battered PM"", August 15). Never in the past had a government at the Centre stooped to ignoble means like using money and indulging in horse-trading to remain in power. While the Congress(I) has only served to further erode morality in public life, the moral authority of the Government to rule the country has been undermined. Hyderabad s.b. singh

The role played by Mulayam Singh Yadav in the survival of the Congress(I) Government cannot be easily dismissed. He nurtures dreams of becoming chief minister of Uttar Pradesh by riding on Narasimha Rao's shoulders. But are these weak shoulders capable of carrying him? Dehra Dun shailendra seinger

RAO IS IRREPLACEABLE

The opinion poll (' 'Three Way Split"", August 15) reveals two very interesting aspects of the public mood. They are: the emerging consensus on the Ram Mandir and Rao's lead in comparison to other prime ministerial hopefuls. Isn't it ironical that Rao still commands confidence in spite of the scandals besieging him? This only highlights the sad fact that there is an absolute lack of credible leaders in the country. Pune vijayan b.

Your electoral prediction does not take into account political parties other than the main three-Congress(I), bjp. National Front-Left Front combine. The smaller, regional parties play a crucial role in determining the result in a general election. Madras c.t. vairavan

The opinion poll only highlights how short public memory is and the ease with which politicians manipulate the minds of the people. This is reflected in the way political equations have undergone a complete change within a short span of six months. But the sad part is that we Indians are caught between the devil and the deep sea. Even if there is a mid-term poll, there isn't much to choose from. Indore ananth srinivas

Your story based on the marg poll seems to have been cooked up within the four walls of your office. If you think there is no bjp wave, all you need to do is hold a mid-term poll to find out the truth. The way the bjp has grown in the past few years is only because of the personality of L.K. Advani. I do not believe that he comes fourth in the race for prime minister. Next time you publish a so-called opinion poll, make sure that you present it in such a way that it does not look or sound so made-up. New Delhi asha prabha

CRIMINAL FARCE

This is a case of grotesque juxtaposition (""Gunning for Cover"", August 15). Men who are facing criminal charges are being protected by the state while it is society which needs protection from them. And the very same state is, on the other hand, fighting these men in the courts.

Bhopal KHALII) AL HASAN

THE TIME CRUNCH

It is hard to believe that bereft of its Air Time Committee (atc), Doordarshan was unable to evolve reasonable criteria for allotting time slots on its satellite channels (""Air Time Inanities"", August 15). If that was really the case, one is hard put to explain dd's success on its two channels. Besides, it will be grossly underestimating the Indian bureaucracy's sophistication to blame it on plain incompetence. The real reason perhaps was the time crunch. Hyderabad Dr codadu pratap

STILL SMOKY

One can't be certain even now whether the cbi will be able, or allowed, to produce clinching evidence linking Rajiv Gandhi with the Bofors pay-off (""The Smoke Clears August 15). But it doesn't really matter. Anyone who believes that the late prime minister was not one of the beneficiaries must be naive or a fool. Or Mani Shankar Aiyar. Bangalore k.r. narayanaswamy

LET REASON REIGN

Your story on the rationalist movement (""The Triumph of Reason"", August 15) was refreshing. People need to emerge from the shadows of astrology and superstition. They need to discover that success depends on the work of their hands and not on the lines on their palms. On the other hand, it is necessary to realise that science too is not infallible. When I was at school we were taught that neutrons were the smallest particles. Now we have discovered neutrinos and quarks. Kanpur chhotechai

BIG BUSYBODY

By forcing Russia to backtrack on its deal with India to supply cryogenic rocket technology (""Misguided Muscle"", August 15), Uncle Sam has clearly proved that in addition to its many faults, it is also the biggest busybody in the world. By his abject surrender to US blackmail, Boris Yeltsin has damaged his own stature and credibility. I'm certain the Russian President would even roll over and play dead if his American masters asked him to. New Delhi samir mahajan

The US has once again established its credentials as a 'world policeman' by forcing Russia to break its agreement with India. Obviously the US is concerned about our success in space technology and wants to protect its own multimillion-dollar arms market. The Government must provide adequate funds, necessary facilities and moral support to our technocrats and scientists to undertake a space research programme to devise an indigenous substitute for the cryogenic engine technology.

Solan PRAMOD SHARMA

CLEANING THE CAPITAL

The most important thing is to control the menace of air pollution (""Capital Punishment"", August 15). The main culprit is the ever increasing number of vehicles on the road. It is, therefore, imperative that air pollution control leg- islation be strictly implemented immediately. The authorities should be equipped with modern gadgets to check the levels of emission and must be empowered to file cases against the defaulters. Above all, the courts should decide cases promptly in order to deter offenders. New Delhi k.k. bajaj

The problems of Delhi, so professionally summed up by you, are really well known. What is lacking is any long-term plan to tackle them with sincerity and determination. The greatest need at the moment is to set up an efficient transport system by implementing the Metropolitan Rapid Transport System through public and private funding. A few zones in the city could be declared out of bounds for private vehicles. Pedestrian plazas will cut down traffic snarls in the congested areas. If none of these plans work and things continue to deteriorate, we could shift the capital elsewhere and hope that history does not repeat itself. Bangalore d.b.n. murthy

In a typically Indian way we will all complain about our suffering, vehemently discuss Delhi's problems till we tire ourselves and then continue life as before. Nobody will take the initiative and take the necessary decisions. Ideas and proposals will be written down and then be lost in the bureaucratic jungle. New Delhi thomas and nancy niggli

STRESS ON QUANTITY

Your special survey on housing (""Building on Shortages"", August 15) was enlightening and relevant. However, you have not stressed the necessity of building large-scale low-cost housing. For most people interested in just finding a roof over their heads, fancy flats and bungalows are out of reach. There must be emphasis on the construction of inexpensive dwellings and importance should be given to utility and comfort rather than merely style and decor. Panchkula, Haryana alokgupta

DENIGRATING OURSELVES

Your tribute to A.K. Ramanujan (""Without Obituary"", August 15) cites the MacArthur prize as ""the highest critical accolade in the US"", while the Sahitya Akademi is called ""puny"". The former, established by an insurance tycoon, is nothing more than a monetary award given to dozens every year-well known and obscure, accomplished and potentially outstanding-merely to relieve them of the need to chase money. Do we still need to drool over any little recognition abroad while denigrating our own institutions? Madras s. ashok

MIRACULOUS MATA

The sarcasm and tone of your story on Mata Amritanandamayi, is intolerable (""The Gurus For the '90s"". July 31). My wife and I were deemed by doctors to be infertile but we were blessed with a child only by her divine grace and love. Amma's children shed tears of joy and relief lying in her lap. We offer these tears to our Mata. What qualification, what spiritual authority do you possess to write about one who is the divine mother of the universe? Madras t.n. krishnachandran

Mata Amritanandamayi, who you have written so harshly about, is the ambrosia that saved my husband's life and restored our domestic harmony. He was an alcoholic and smoking for over a decade. Then, just one confession to the Mata brought about a transformation which neither the Alcoholics Anonymous nor a clinical psychologist was able to bring about. I will be eternally grateful to her. Madras vinaya govindam

A QUESTION OF TRUST

Lt-General A.S. Bhullar, director-general, Bureau of Indian Standards (bis), is right in saying in his letter that the bis is the first organisation to issue quality system certificates. But Indian Register Quality Systems (irqs), a department of Indian Register of Shipping, is the first duly accredited Indian organisation for certification of quality systems (""Certified Fit"", Trade Winds, May 31). The certification system of the bis has not been independently verified as meeting internationally accepted criteria for certification bodies, unlike irqs which has been accredited by Raad voor de Certifi-catie of the Netherlands. Consequently, the bis certificate may not be easily accepted by importers abroad. This is not to say that the bis system is inferior. What is urgently needed is a national accreditation system and organisation-like the UK's National Accreditation Council for Certification Bodies- as recommended by the EC experts' group. Bombay h.k. taneja. Chief Executive, Indian Register of Shipping","['madras', 'way', 'bis', '15', 'delhi', 'need', 'letters', 'poll', 'system', 'public', 'indian']","Dehra Dun shailendra seingerRAO IS IRREPLACEABLEThe opinion poll (' 'Three Way Split"", August 15) reveals two very interesting aspects of the public mood.
vairavanThe opinion poll only highlights how short public memory is and the ease with which politicians manipulate the minds of the people.
This is reflected in the way political equations have undergone a complete change within a short span of six months.
murthyIn a typically Indian way we will all complain about our suffering, vehemently discuss Delhi's problems till we tire ourselves and then continue life as before.
This is not to say that the bis system is inferior."
'Drunchies' behind youth obesity epidemic,,,2018-08-08T13:06:00+05:30,"Washington, Aug 8 (PTI) Drunchies, or the desire to eat salty, unhealthy foods after a night of heavy drinking, may be contributing to the obesity epidemic among college students, scientists say.

Researchers from University at Buffalo in the US decided to look at a sample of 286 college students to better understand how drinking affects what they eat, both that night and for their first meal the next day when, most likely, they are hungover.

""Given the obesity epidemic and the rates of alcohol consumption on college campuses, we need to be aware of not only the negative effect of alcohol consumption, but also the impact it has on what people are eating while they are drinking,"" said Jessica Kruger, an assistant professor at the University at Buffalo.

Research on the effects of drinking and diet is scarce, Kruger said, adding that eating more unhealthy foods following alcohol consumption is an often overlooked behaviour in traditional addiction research.

The inspiration for the study, published in the Californian Journal of Health Promotion, came from an ad researchers saw in a university newspaper.

""It said, 'Got Drunchies?' and had ads for pizza, tacos, and other fast-food places that were open late after the bars closed,"" Kruger said.

An average beer contains 150 calories. If a person drinks five beers, it accounts for third of their daily energy intake. Add two slices of pizza or a burrito to that at the end of the night, and it's a recipe for weight gain, she said.

""So, we dug a bit deeper and first figured out what the 'drunchies' were, and then decided this would be interesting to study,"" Kruger said.

Study participants were asked to complete an anonymous online survey.

Researchers found that drinking influenced study participants' dietary behaviours before going to bed.

All alcohol drinkers were more likely to eat something before they went to bed after drinking alcohol than in general before they go to bed.

Specifically, they were more likely to opt for salty snack foods and pizza. Healthy foods, such as dark green vegetables and other veggies they would ordinarily eat, were not as appealing.

Of particular concern, the researchers noted, was the fact that participants did not report drinking more water or other non-alcoholic beverages before bed.

That exacerbates dehydration, which may lead to additionally unhealthy food choices.

The following day after drinking, participants' dietary patterns varied from the night before. They were less likely to skip meals the morning after a night of drinking compared to a typical morning.

They favoured foods like pizza or tacos over milk and dairy products and grains, most likely because of the so-called hangover cures that get passed down to students and which entail eating foods that ""soak up"" the alcohol.

Dispelling these myths is one way to promote a healthy diet even after a night of binge drinking, Kruger said. PTI MHN MHN","['participants', 'obesity', 'night', 'pizza', 'eat', 'epidemic', 'drinking', 'youth', 'drunchies', 'kruger', 'university', 'likely', 'foods', 'alcohol']","Washington, Aug 8 (PTI) Drunchies, or the desire to eat salty, unhealthy foods after a night of heavy drinking, may be contributing to the obesity epidemic among college students, scientists say.
All alcohol drinkers were more likely to eat something before they went to bed after drinking alcohol than in general before they go to bed.
The following day after drinking, participants' dietary patterns varied from the night before.
They were less likely to skip meals the morning after a night of drinking compared to a typical morning.
Dispelling these myths is one way to promote a healthy diet even after a night of binge drinking, Kruger said."
