Headlines,Descriptions,Authors,Published_Dates,Articles,Keywords,Summaries
Drink dependence up in urban Indian women,The 33-year-old married woman from Chandigarh had never imagined that her excessive clubbing and partying would one day push her to the brink of suicide. But it did.,,2012-11-30T17:24:51+05:30,"The 33-year-old married woman from Chandigarh had never imagined that her excessive clubbing and partying would one day push her to the brink of suicide. But it did.

She was not the only one. In an increasing trend of urban women taking to alcohol to cope with everyday stresses as societal norms ease, a 28-year-old woman working as a senior executive in a property broking firm in Mumbai also developed suicidal tendencies.

What started for both the Bacchus lovers as socialising, ended up in drink dependence and pushed them into the infamous club of over 14 million alcohol consumers in the country who require help. Though there are no exact figures of how many of these are women, the trend is clear.

The Mumbai woman ran up a debt of Rs25 lakh (Rs2.5 million) and attempted suicide due to her ""unmanageable"" life and depression. The Chandigarh woman showed addiction- related suicidal tendencies after a turbulent married life, extra-marital affairs and a failed patch-up bid with her husband.

The two are now trying to get a grip over their lives and move away from drink dependence, with some help from de-addiction experts who say they needed to be cared like brain patients who don't know how to prevent themselves from returning to the old habit despite being aware of its perils.

But their difficult phase is over, says NGO Tulasi Home's consultant doctor Goruv Gupta. ""Realising or accepting that one needs help is the toughest part of getting over the drink dependence problem.""

Sociologist Sachin Kumar, associated with Alcoholics Anonymous, told IANS: ""Intoxication by women in some communities has existed for time immemorial. Traditionally, it has been a collective activity but in modern times the incidence of individual drinking has shown a rise.""

The social checks or restraint that used to prescribe the limit of alcohol consumption in older times have faded over the years, leading to worst forms of drink dependence among both men and women, he said.

According to a 2009 article in journal The Lancet, Indians, officially, are still among the world's lowest consumers of alcohol - government statistics show only 21 percent of adult men and around two percent of women drink. But up to a fifth of this group - about 14 million people - are dependent drinkers requiring ""help"".

""Addiction is a chronic, relapsing disease, characterised by compulsive alcohol seeking and use, and by neurochemical and molecular changes in the brain,"" said Gupta.

For women drinkers, the news is worse than for men.

Gupta warned that alcohol addiction was more harmful for a woman's body as compared to a man; in a woman, alchohol tends to induce permanent hormonal changes in the body, making rehabilitation more difficult.

The problem of shortage of de-addiction centres was also more acute for women.

Ruchika Kumari, who works at several private de-addiction centres in Delhi, agreed: ""Alcohol addiction is considered to carry a bigger social stigma for women as compared to men and the challenge of weaning away is tougher for them due to shortage of fully-equipped centres.""

""Families need to leave the women dependent drinkers at deaddiction centre's for medical aid and counselling and this needs a lot of faith in the facility,"" she said.

""Most people prefer private facilities as they score over the government sector in terms of security, hygiene and quality of treatment.""

She revealed that there was no particular age bracket for women drinkers. ""At our centre in south Delhi, we have women from 48 years to 28 years seeking counselling.""

The service that private centres offer to get rid of dependence comes at a price.

A six-week rehabilitation procedure in some of the high-end centres in Delhi costs around Rs1 lakh (Rs100,000). In Delhi alone there are over three dozen NGO-run, private and government facilities that offer help to people with drink dependence.

Gupta warned against ill-trained quacks offering help to dependent drinkers and ending up traumatising the patient.

""I have seen a case where a patient was sent by his family to a private facility in Haryana and there he was tortured, stripped and humiliated in the name of de-addiction,"" he said.","['centres', 'help', 'women', 'drinkers', 'woman', 'dependence', 'drink', 'private', 'indian', 'deaddiction', 'alcohol', 'urban']","""Realising or accepting that one needs help is the toughest part of getting over the drink dependence problem.""
For women drinkers, the news is worse than for men.
She revealed that there was no particular age bracket for women drinkers.
The service that private centres offer to get rid of dependence comes at a price.
In Delhi alone there are over three dozen NGO-run, private and government facilities that offer help to people with drink dependence."
IAF faces HC ire for confining corporal to psychiatric ward for alcohol dependency,,,2018-07-12T19:13:00+05:30,"New Delhi, Jul 12 (PTI) The Indian Air Force (IAF) faced the ire of the Delhi High Court today for confining one of its non-commissioned officers, a corporal, to a psychiatric ward for over two months, because he was an alcoholic and suffered from mental disorders.

A bench of justices S Muralidhar and Vinod Goel questioned the rationale behind the IAF's decision, asking how it determined on a daily basis that the corporal still ""craved for alcohol"".

The court also said the newly-enacted Mental Health Act made it clear that a person could not be forced to undergo treatment without his consent, adding that the IAF ""cannot ignore the laws of the country"".

Terming the conduct of the IAF ""irresponsible"", the bench wondered how many of such cases there might be, which were yet to be highlighted.

""How were you determining on a daily basis that his craving for alcohol had not gone down? What tests were conducted by you? This is completely irresponsible. We wonder how many such cases are there.

""This is a clear case where a man is saying he has been detained without consent. Under the new Mental Health Act, you cannot force him to undergo treatment without his consent. Then how are you pumping him full of drugs? We do not know who should be proceeded against,"" the bench said.

It added that the IAF needed to be reminded not to interfere with a person's liberty as ""short of chaining him up, everything else was done here"" and directed that the corporal be produced in court tomorrow.

According to the IAF, represented by the Centre's standing counsel, Ripudaman Singh Bhardwaj, the action against the corporal was taken on a complaint from his wife that he turned violent after consuming alcohol.

Bhardwaj said the corporal, Kriyad Yogesh Bhankhariya, had alcohol dependency issues for which he was initially treated in the psychiatric ward of the Army Base Hospital here and thereafter, in June, he was shifted to the medical centre at the Tughlakabad Air Force Station.

The court said if the non-commissioned officer (NCO) was an alcoholic, then the IAF ought to have sought the help of the ""Alcoholics Anonymous"" on how to deal with the matter as any psychiatric would confirm that confinement of a person was advisable only in extreme cases.

""It is worrying, the manner in which you have approached the situation,"" the bench told the IAF.

The court was hearing a habeas corpus petition filed by the 30-year-old corporal's father, claiming that his son was being illegally confined at the Army Base Hospital. PTI HMP SKV RC RC","['iaf', 'ire', 'mental', 'bench', 'psychiatric', 'force', 'ward', 'faces', 'hc', 'dependency', 'corporal', 'confining', 'undergo', 'court', 'consent', 'alcohol']","New Delhi, Jul 12 (PTI) The Indian Air Force (IAF) faced the ire of the Delhi High Court today for confining one of its non-commissioned officers, a corporal, to a psychiatric ward for over two months, because he was an alcoholic and suffered from mental disorders.
Terming the conduct of the IAF ""irresponsible"", the bench wondered how many of such cases there might be, which were yet to be highlighted.
""How were you determining on a daily basis that his craving for alcohol had not gone down?
Under the new Mental Health Act, you cannot force him to undergo treatment without his consent.
""It is worrying, the manner in which you have approached the situation,"" the bench told the IAF."
Alcohol use and safe drinking,"15%,2011,2014,24th,45%,8th,absorb,absorbed,abuse,accessed,accidents,adult,age,agencies,alateen,alcmisuse,alcmisuserfinalrs,alcohol,alcoholic,alcoholics,alcoholism,alternative,altogether,american,amount,amounts,anon,anonymous,appear,around,attempts,available,avoid,baby,because,beer,beers,behavioral,behaviors,being,below,best,birth,blood,bloodstream,body,brain,break,breast,breathing,broken,bus,call,cancers,car,carbohydrate,carbonated,care,cecil,centers,certain,champagne,change,chap,check,coma,concerned,confusion,connor,considered,consumption,counseling,counselors,counter,dangerous,dates,day,death,defects,define,defined,definition,dependence,designated,despite,developing,different,disorders,doctor,drink,drinkers,drinking,drinks,drive,driver,drownings,drug,drunk,eds,elsevier,employee,empty,euphoria,example,fact,falls,family,faster,fat,february,fetal,fizzy,food,foods,force,frequently,friends,functions,get,gets,getting,going,goldman,gov,groups,hard,harm,head,health,heart,here,history,home,homicide,hospitals,htm,impairment,increased,increases,ineffective,infections,information,inhibitions,institute,interact,interested,interventions,intoxicated,involves,law,legal,legally,level,levels,likely,limit,liquor,list,liver,local,make,making,man,means,medication,medicine,medicines,member,members,mental,minutes,misuse,moderation,month,motor,national,neck,never,niaaa,nih,non,old,org,ounces,paralysis,past,peak,per,personal,philadelphia,plan,pregnancy,pregnant,preventive,primary,private,problem,provided,provider,public,quickly,rakel,rate,reached,recommendation,reduce,reduced,regarding,related,resources,respiratory,responsible,responsibly,rises,risk,risks,risky,runs,safe,saunders,schafer,school,screening,seikel,seniors,services,severe,sex,sexually,sherin,sick,slowly,slows,slurred,snack,speech,spite,statement,states,stays,stis,stomach,stop,stronger,student,stupor,substances,suicide,support,symptoms,syndrome,taking,task,taxi,teen,teens,textbook,them,transmitted,trouble,type,types,unable,unplanned,until,unwanted,uspreventiveservicestaskforce,uspstf12,vehicle,want,way,ways,well,whether,while,widely,wine,woman,work,world,years,yourself,",,2014-09-24T09:54:54+05:30,"Definition

Alcohol use involves drinking beer, wine, or hard liquor.

Alternative Names

Beer consumption; Wine consumption; Hard liquor consumption; Safe drinking

Information

Alcohol is one of the most widely used drug substances in the world.

TEEN DRINKING

Alcohol use is not only an adult problem. Most American high school seniors have had an alcoholic drink within the past month, despite the fact that the legal drinking age is 21 years old in the U.S.

About 1 in 5 teens are considered ""problem drinkers."" This means that they:

Get drunk

Have accidents related to alcohol use

Get into trouble with the law, family members, friends, school, or dates because of alcohol

THE EFFECTS OF ALCOHOL

Alcoholic drinks have different amounts of alcohol in them:

Beeris about 5% alcohol, although some beers can have more.

Wine is usually 12 to 15% alcohol.

Hard liquor is about 45% alcohol.

Alcohol gets into your bloodstream quickly.

The amount and type of food in your stomach can change how quickly this occurs. For example, high-carbohydrate and high-fat foods can make your body absorb alcohol more slowly.

Certain types of alcoholic drinks get into your bloodstream faster. A carbonated (fizzy) alcoholic drink, such as champagne, will be absorbed faster than a non-carbonated drink.

Alcohol slows your breathing rate, heart rate, and how well your brain functions. These effects may appear within 10 minutes and peak at around 40 to 60 minutes. Alcohol stays in your bloodstream until it is broken down by the liver. The amount of alcohol in your blood is called your ""blood alcohol level."" If you drink alcohol faster than the liver can break it down, this level rises.

Your blood alcohol level is used to legally define whether or not you are drunk. The blood alcohol legal limit usually falls between 0.08 and 0.10 in most states. Below is a list of blood alcohol levels and the likely symptoms.

0.05 -- reduced inhibitions

0.10 -- slurred speech

0.20 -- euphoria and motor impairment

0.30 -- confusion

0.40 -- stupor

0.50 -- coma

0.60 -- respiratory paralysis and death

You can have symptoms of ""being drunk"" at blood alcohol levels below the legal definition of being drunk. Also, people who drink alcohol frequently may not have symptoms until a higher blood alcohol level is reached.

HEALTH RISKS OF ALCOHOL

Alcohol increases the risk of:

Alcoholism or alcohol dependence

Falls, drownings, and other accidents

Head, neck, stomach, and breast cancers

Motor vehicle accidents

Risky sex behaviors, unplanned or unwanted pregnancy, and sexually transmitted infections (STIs)

Suicide and homicide

Drinking during pregnancy can harm the developing baby. Severe birth defects or fetal alcohol syndrome are possible.

RESPONSIBLE DRINKING

If you drink alcohol, it is best to do so in moderation. Moderation means the drinking is not getting you intoxicated (or drunk) and you are drinking no more than 1 drink per day if you are a woman and no more than 2 if you are a man. A drink is defined as 12 ounces of beer, 5 ounces of wine, or 1 ounces of liquor.

Here are some ways to drink responsibly, provided you do not have a drinking problem, are of legal age to drink alcohol, and are not pregnant:

Never drink alcohol and drive a car.

If you are going to drink, have a designated driver, or plan an alternative way home, such as a taxi or bus.

Do not drink on an empty stomach. Snack before and while drinking alcohol.

If you are taking medication, including over-the-counter drugs, check with your doctor before drinking alcohol. Alcohol can make the effects of many medicines stronger. It can also interact with other medicines, making them ineffective or dangerous or make you sick.

Do not drink if you have a history of alcohol abuse or alcoholism.

If alcoholism runs in your family, you may be at increased risk of developing alcoholism yourself, so you may want to avoid drinking alcohol altogether.

CALL YOUR HEALTH CARE PROVIDER IF:

You are concerned about your personal alcohol use or that of a family member

You are interested in more information regarding alcohol use, alcohol abuse , or support groups

, or support groups You are unable to reduce or stop your alcohol consumption, in spite of attempts to stop drinking

Other resources include:

Local Alcoholics Anonymous or Al-anon/Alateen groups

Local hospitals

Public or private mental health agencies

School or work counselors

Student or employee health centers

References

National Institute on Alcohol Abuse and Alcoholism. Alcohol and health. Available at: http://www.niaaa.nih.gov/alcohol-health. Accessed on February 24, 2014.

OConnor PG. Alcohol abuse and dependence. In: Goldman L, Schafer AI, eds. Goldmans Cecil Medicine. 24th ed. Philadelphia, Pa: Elsevier Saunders; 2011:chap 32.

Sherin K, Seikel S. Alcohol use disorders. Rakel RE, Rakel DP, eds. Textbook of Family Medicine. 8th ed. Philadelphia, Pa: Elsevier Saunders; 2011:chap 49.

U.S. Preventive Services Task Force. Screening and behavioral counseling interventions in primary care to reduce alcohol misuse: recommendation statement. Available at: http://www.uspreventiveservicestaskforce.org/uspstf12/alcmisuse/alcmisuserfinalrs.htm. Accessed on February 24, 2014.

Review Date:

2/24/2014

Reviewed By:

Fred K. Berger, MD, Addiction and Forensic Psychiatrist, Scripps Memorial Hospital, La Jolla, California. Also reviewed by David Zieve, MD, MHA, Isla Ogilvie, PhD, and the A.D.A.M. Editorial team.","['safe', 'level', 'drunk', 'family', 'consumption', 'drinking', 'drink', 'blood', 'legal', 'health', 'alcohol']","The amount of alcohol in your blood is called your ""blood alcohol level.""
Also, people who drink alcohol frequently may not have symptoms until a higher blood alcohol level is reached.
Here are some ways to drink responsibly, provided you do not have a drinking problem, are of legal age to drink alcohol, and are not pregnant:Never drink alcohol and drive a car.
Snack before and while drinking alcohol.
If you are taking medication, including over-the-counter drugs, check with your doctor before drinking alcohol."
Upcoming Events: December 21 -- December 27,Upcoming Events: December 21 -- December 27,,2007-12-15T05:18:00+05:30,Get real-time alerts and all the news on your phone with the all-new India Today app. Download from,"['21', 'upcoming', 'download', 'alerts', 'app', 'events', '27', 'realtime', 'today', 'india', 'allnew', 'phone']","Get real-time alerts and all the news on your phone with the all-new India Today app.
Download from"
Fetal alcohol syndrome,"100,18th,2007,2010,23rd,4357,662,800,abnormal,abuse,abusing,across,active,administration,affect,alateen,alcohol,alcoholics,alcoholism,almost,already,amount,amounts,anon,anonymous,appear,appears,appointment,areas,asd,assistance,atrial,avoid,avoiding,babies,baby,back,because,behavior,behavioral,behaviors,behrman,being,best,binge,birth,blood,bloom,bones,born,brain,call,care,carlo,chap,checked,child,children,closely,complications,control,coordination,council,counseling,cunningham,cut,death,decreased,defect,defects,delayed,delivery,dependency,development,diagnosed,different,difficult,disability,drink,drinking,drinks,drug,drunk,early,easily,eds,educational,elsevier,epicanthal,established,exam,extra,eyes,face,fas,fetal,fetus,finding,first,fit,folds,general,get,good,gov,groove,grows,growth,harm,harmful,having,head,health,heart,heavily,hill,imaging,important,increase,infant,infants,information,institute,intellectual,intoxicated,jaw,jenson,join,kliegman,large,larger,level,leveno,lip,major,manage,mcgraw,medications,mental,miscarriage,months,mother,mouth,movement,mri,murmur,muscle,narrow,national,ncadd,needs,nelson,new,niaaa,nih,none,normal,nose,obstetrics,occur,offer,org,organizations,outcome,passes,pediatrics,philadelphia,physical,placenta,poor,poses,pregnancy,pregnant,premature,prevents,problems,program,provider,providers,referral,referred,regularly,rehabilitation,related,resources,result,risk,risks,routing,safe,same,samhsa,saunders,seen,septal,service,services,sexually,show,signs,skills,slow,small,smooth,social,speech,stanton,stillbirth,stop,strategies,structure,studies,substance,symptoms,syndrome,team,teratology,tests,textbook,thin,thinking,three,throughout,time,timing,tone,treatment,trying,ultrasound,unborn,upper,using,varies,ventricular,vsd,while,williams,woman,womb,women,work,york,",,2014-09-24T09:55:10+05:30,"Definition

Fetal alcohol syndrome is growth, mental, and physical problems that may occur in a baby when a mother drinks alcohol during pregnancy.

Alternative Names

Alcohol in pregnancy; Alcohol-related birth defects; Fetal alcohol effects; FAS

Causes, incidence, and risk factors

Using or abusing alcohol during pregnancy can cause the same risks as using alcohol in general. However, it poses extra risks to the unborn baby. When a pregnant woman drinks alcohol, it easily passes across the placenta to the fetus. Because of this, drinking alcohol can harm the babys development.

A pregnant woman who drinks any amount of alcohol is at risk for having a child with fetal alcohol syndrome. No ""safe"" level of alcohol use during pregnancy has been established. Larger amounts of alcohol appear to increase the problems. Binge drinking is more harmful than drinking small amounts of alcohol.

Timing of alcohol use during pregnancy is also important. Alcohol use appears to be the most harmful during the first 3 months of pregnancy; however, drinking alcohol any time during pregnancy can be harmful.

Symptoms

A baby with fetal alcohol syndrome may have the following symptoms:

Poor growth while the baby is in the womb and after birth

Decreased muscle tone and poor coordination

Delayed development and problems in three or more major areas: thinking, speech, movement, or social skills

Heart defects such as ventricular septal defect (VSD) or atrial septal defect (ASD)

or Problems with the face, including: Narrow, small eyes with large epicanthal folds Small head Small upper jaw Smooth groove in upper lip Smooth and thin upper lip



Signs and tests

A physical exam of the baby may show a heart murmur or other heart problems. As the baby grows, there may be signs of delayed mental development. There also may be problems with the face and bones.

Tests include:

Blood alcohol level in pregnant women who show signs of being drunk (intoxicated)

Brain imaging studies (CT or MRI) after the child is born

Pregnancy ultrasound

Treatment

Women who are pregnant or who are trying to get pregnant should avoid drinking any amount of alcohol. Pregnant women with alcoholism should join an alcohol abuse rehabilitation program and be checked closely by a health care provider throughout pregnancy.

Support Groups

The following organizations may offer assistance:

National Council on Alcoholism and Drug Dependency -- www.ncadd.org

National Drug and Alcohol Treatment Referral Routing Service -- 1-800-662-4357

The following organizations are good resources for information on alcoholism:

Alcoholics Anonymous - www.alcoholics-anonymous.org

Al-Anon/Alateen - www.al-anon.org

National Institute on Alcohol Abuse and Alcoholism - www.niaaa.nih.gov/

Substance Abuse and Mental Health Services Administration - www.samhsa.gov

Expectations (prognosis)

The outcome for infants with fetal alcohol syndrome varies. Almost none of these babies have normal brain development.

Infants and children with fetal alcohol syndrome have many different problems, which can be difficult to manage. Children do best if they are diagnosed early and referred to a team of health care providers who can work on educational and behavioral strategies that fit the childs needs.

Complications

Drinking alcohol during pregnancy may result in:

Miscarriage or stillbirth

or Premature delivery

Complications seen in the infant may include:

Abnormal heart structure

Behavior problems

Infant death

Intellectual disability

Problems in the structure of the head, eyes, nose, or mouth

Poor growth before birth

Slow growth and poor coordination after birth

Calling your health care provider

Call for an appointment with your health care provider if you are drinking alcohol regularly or heavily, and are finding it difficult to cut back or stop. Also, call if you are drinking alcohol in any amount while you are pregnant or trying to get pregnant.

Prevention

Avoiding alcohol during pregnancy prevents fetal alcohol syndrome. Counseling can help women who have already had a child with fetal alcohol syndrome.

Sexually active women who drink heavily should use birth control and control their drinking behaviors, or stop using alcohol before trying to get pregnant.

References

Carlo WA. Fetal alcohol syndrome. In: Kliegman RM, Behrman RE, Jenson HB, Stanton BF, eds. Nelson Textbook of Pediatrics. 18th ed. Philadelphia, Pa: Saunders Elsevier; 2007:chap 100.2.

Cunningham FG, Leveno KJ, Bloom SL, et al. Teratology and medications that affect the fetus. In: Cunningham FG, Leveno KJ, Bloom SL, et al, eds. Williams Obstetrics. 23rd ed. New York, NY: McGraw-Hill; 2010:chap 14.

Review Date:

8/8/2012

Reviewed By:

A.D.A.M. Health Solutions, Ebix, Inc., Editorial Team: David Zieve, MD, MHA, and David R. Eltz. Previously reviewed by Linda J. Vorvick, MD, Medical Director, MEDEX Northwest Division of Physician Assistant Studies, University of Washington, School of Medicine (8/15/2011)","['fetal', 'women', 'problems', 'pregnancy', 'drinking', 'syndrome', 'pregnant', 'baby', 'health', 'alcohol']","Alternative NamesAlcohol in pregnancy; Alcohol-related birth defects; Fetal alcohol effects; FASCauses, incidence, and risk factorsUsing or abusing alcohol during pregnancy can cause the same risks as using alcohol in general.
A pregnant woman who drinks any amount of alcohol is at risk for having a child with fetal alcohol syndrome.
Infants and children with fetal alcohol syndrome have many different problems, which can be difficult to manage.
PreventionAvoiding alcohol during pregnancy prevents fetal alcohol syndrome.
Fetal alcohol syndrome."
