Headlines,Descriptions,Authors,Published_Dates,Articles,Keywords,Summaries
Sale of refurbished laptop lands Amazon in soup,"CHANDIGARH: The District Consumer Disputes Redressal Forum, Chandigarh, has ordered Bengaluru-based company Amazon India—Bridge Gateway to pay around Rs 1 lakh to a Chandigarh-based resident for the sale of a refurbished laptop.",Tribune News Service,2018-12-15T01:43:00,"Chandigarh, December 14The District Consumer Disputes Redressal Forum, Chandigarh, has ordered Bengaluru-based company Amazon India—Bridge Gateway to pay around Rs 1 lakh to a Chandigarh-based resident for the sale of a refurbished laptop.The online platform has been asked to pay Rs 69, 990, at an annual interest of 9 per cent, along with Rs 10,000 litigation in expenses and a compensation of Rs 20,000 for the unfair trade practice and harassment to Ravinder Singh, a resident of Sector 43-B. Singh had ordered a Dell laptop for Rs 69,990 in May, 2016. Cglobal, Mumbai, delivered it to Singh.He claimed that the laptop did not function properly and within three months, the operating software had to be reinstalled, hard disk replacement was required and motherboard was tried to be fixed.In a span of one year, it remained with the service centre for most of the time. When he approached Dell, he was told that the system was a refurbished one.Dell told the consumer forum that the laptop was originally sold in the USA in February 2016 to Costco and the same was returned to Dell and resold to Cachet Works USA LLC in March 2016 as a refurbished system. The system was imported to India via a parallel xhannel. The one-year warranty on laptop expired in March 2017.(adsbygoogle = window.adsbygoogle || []).push({ });The court observed, “...the opposite party (Amazon) is solely liable if the product sold by a third party seller on its platform turned to be fake/imitated/refurbished. At any rate, Amazon’s measures for countering fakes seems to be weak due to its lax policies, which promoted selling of fake products, as sellers could remain anonymous and know that they would face no legal recourse.” — TNS","['amazon', '2016', 'sold', 'told', 'rs', 'refurbished', 'soup', 'lands', 'sale', 'laptop', 'pay', 'usa', 'system', 'dell']","Told to pay Rs 1 lakh to city residentChandigarh, December 14The District Consumer Disputes Redressal Forum, Chandigarh, has ordered Bengaluru-based company Amazon India—Bridge Gateway to pay around Rs 1 lakh to a Chandigarh-based resident for the sale of a refurbished laptop.
Singh had ordered a Dell laptop for Rs 69,990 in May, 2016.
When he approached Dell, he was told that the system was a refurbished one.
Dell told the consumer forum that the laptop was originally sold in the USA in February 2016 to Costco and the same was returned to Dell and resold to Cachet Works USA LLC in March 2016 as a refurbished system.
The court observed, “...the opposite party (Amazon) is solely liable if the product sold by a third party seller on its platform turned to be fake/imitated/refurbished."
"Arrest of Akali leader, kin stayed","ABOHAR: The court of Sessions Judge, Fazilka, has stayed the arrest of Mohinder Pratap Bathla, his brother Harinder, Harinder’s wife Sangeeta and their son Arpit in connection with an inquiry by the Superintendent of Police in Abohar.",Tribune News Service,2019-02-14T07:00:00,"Our CorrespondentAbohar, February 13The court of Sessions Judge, Fazilka, has stayed the arrest of Mohinder Pratap Bathla, his brother Harinder, Harinder’s wife Sangeeta and their son Arpit in connection with an inquiry by the Superintendent of Police in Abohar. The arrest stands stayed subject to joining of the inquiry proceedings pertaining to a letter allegedly written by a girl who died last year. Mohinder Pratap Bathla is SAD businessmen wing district president. SAD president Sukhbir Badal had last week held a press conference in his presence in Chandigarh alleging that Bathla was being targeted due to political vendetta. Mohinder, Harinder, Sangeeta and Arpit had sought a blanket bail.(adsbygoogle = window.adsbygoogle || []).push({ });The report from the SP indicated as if a complaint dated November 10, 2018, was moved by Cheena Sukhija was being inquired into, but no copy of the said complaint was enclosed. The counsel for the bail applicants explained that Cheena Sukhija has since died. She was in love with bail applicant Arpit Bathla and both the families had agreed to solemnise their marriage after completion of studies, but after her death, an anonymous complaint allegedly made by Cheena was received by the police that she was going to commit suicide. Her father Rakesh and mother Riya Sukhija had already issued their statements that their deceased daughter had not sent any such letter to the police. After giving a careful thought to the submissions, the court stayed arrest of bail applicants.","['kin', 'sangeeta', 'arpit', 'akali', 'complaint', 'sad', 'stayed', 'bathla', 'bail', 'leader', 'arrest', 'sukhija', 'cheena']","Our CorrespondentAbohar, February 13The court of Sessions Judge, Fazilka, has stayed the arrest of Mohinder Pratap Bathla, his brother Harinder, Harinder’s wife Sangeeta and their son Arpit in connection with an inquiry by the Superintendent of Police in Abohar.
The arrest stands stayed subject to joining of the inquiry proceedings pertaining to a letter allegedly written by a girl who died last year.
The report from the SP indicated as if a complaint dated November 10, 2018, was moved by Cheena Sukhija was being inquired into, but no copy of the said complaint was enclosed.
The counsel for the bail applicants explained that Cheena Sukhija has since died.
After giving a careful thought to the submissions, the court stayed arrest of bail applicants."
Security blanket in Panchkula,"Panchkula: The deployment of paramilitary forces and the state police force will continue around the Panchkula District Courts complex, Sector 1, for the hearing in two murder cases against Dera Sacha Sauda chief Gurmeet Ram Rahim Singh on September 16.",Tribune News Service,2017-09-15T02:40:00,"Panchkula: The deployment of paramilitary forces and the state police force will continue around the Panchkula District Courts complex, Sector 1, for the hearing in two murder cases against Dera Sacha Sauda chief Gurmeet Ram Rahim Singh on September 16. The hearing will take place at the CBI court in Panchkula.The dera chief is the main accused in the murder case of dera member Ranjit Singh. He has also been charged by the CBI with the murder of Sirsa-based journalist Ram Chander Chhatrapati.Panchkula Police Commissioner AS Chawla said they would not allow anybody to take law into his hands. The paramilitary forces were still deployed in Sector 1 and inside and outside the court complex as well. Sufficient number of Haryana Police personnel was deployed in Sector 1, who were allowing entry of people only after proper checking, he said. Ranjit, an affluent farmer, was a former manager of the dera. Ranjit was shot dead allegedly at the behest of Ram Rahim in 2002. The other case is regarding the murder of Ram Chander Chhatrapati, a Sirsa-based journalist, who had launched his own evening newspaper “Pura Sach” in 2000.Chhatrapati’s son Anshul said his father was murdered on October 24, 2002, five months after the newspaper he owned published an anonymous letter alleging rape charges against the dera head.(adsbygoogle = window.adsbygoogle || []).push({ });Uncertainty over dera chief’s appearance There is uncertainty over the dera chief’s appearance in person or through video-conferencing. A senior police official said they were trying for the dera chief’s appearance through video-conferencing. Earlier, there were orders of video-conferencing from Sirsa, but since the dera head is now languishing in a Rohtak jail, they would wait for the court’s order, he said.  — TNS","['dera', 'security', 'chief', 'sector', 'sirsabased', 'singh', 'ram', 'chiefs', 'panchkula', 'hearing', 'blanket', 'videoconferencing', 'murder']","The dera chief is the main accused in the murder case of dera member Ranjit Singh.
He has also been charged by the CBI with the murder of Sirsa-based journalist Ram Chander Chhatrapati.
Panchkula Police Commissioner AS Chawla said they would not allow anybody to take law into his hands.
Uncertainty over dera chief’s appearanceThere is uncertainty over the dera chief’s appearance in person or through video-conferencing.
A senior police official said they were trying for the dera chief’s appearance through video-conferencing."
Orbit bus case: High Court turns down CBI probe plea,"CHANDIGARH: Just eight months after a 13-year-old girl died on being allegedly thrown off a bus owned by Orbit Aviation, the plea for a CBI probe into the matter today failed to find favour with the Punjab and Haryana High Court.",Tribune News Service,2015-12-04T01:08:00,"Tribune News ServiceChandigarh, December 3Just eight months after a 13-year-old girl died on being allegedly thrown off a bus owned by Orbit Aviation, the plea for a CBI probe into the matter today failed to find favour with the Punjab and Haryana High Court.As the case came up for resumed hearing, the Bench of Justice Satish Kumar Mittal and Justice Shekhar Dhawan made it clear that the need for an independent probe by the premier investigating agency was not being felt as a commission had already initiated inquiry into the matter.The Bench also adjourned the hearing of the case sine die till the receipt of the report by the commission headed by former Chief Justice of Kerala High Court Justice VK Bali.At the onset, amicus curie or the friend of the court advocate RS Bains insisted upon a CBI enquiry. Taking a note of the assertion, the Bench verbally observed an application could be moved before the trial court, if it was found at a later stage that the case was not moving in the right direction.(adsbygoogle = window.adsbygoogle || []).push({ });The petition for a CBI probe into the matter was filed by advocate Jasdeep Singh Bains in person. Soon after, Moga Senior Superintendent of Police told the court that a notification had been issued on May 8 constituting a committee headed by Punjab and Haryana High Court’s former judge, Justice Ashutosh Mohunta, to study and recommend measures on passenger safety in public transport with specific reference to women and children.Another notification has also been issued on appointing a commission headed by Justice Bali to probe the Moga incident. He added the petitioner has no cause of action to invoke the extraordinary jurisdiction of court.The court, on a previous date of hearing, had made it clear that it would look into ownership and profits made during the past five years by Orbit Aviation — the transport company owned by the Badal family.It had further taken suo motu cognisance of a handwritten anonymous letter saying the Badals had “amassed wealth at the cost of the state” and should be sent behind bars.Written in connection with the Orbit case, the letter by a “sufferer” had quoted The Tribune. Among other things, it had questioned the business interest of the Badals.He had added: “If a government employee cannot do any business in his or his family’s name, how all Badals are doing business of transport, cable TV, TV channel and sand mafia, restaurants and five-star hotels since the Badals’ have been elected by the people just to govern the state and not to earn from the state”.","['plea', 'cbi', 'transport', 'bus', 'turns', 'court', 'high', 'headed', 'state', 'case', 'probe', 'justice', 'orbit', 'hearing']","Tribune News ServiceChandigarh, December 3Just eight months after a 13-year-old girl died on being allegedly thrown off a bus owned by Orbit Aviation, the plea for a CBI probe into the matter today failed to find favour with the Punjab and Haryana High Court.
The Bench also adjourned the hearing of the case sine die till the receipt of the report by the commission headed by former Chief Justice of Kerala High Court Justice VK Bali.
At the onset, amicus curie or the friend of the court advocate RS Bains insisted upon a CBI enquiry.
Another notification has also been issued on appointing a commission headed by Justice Bali to probe the Moga incident.
Written in connection with the Orbit case, the letter by a “sufferer” had quoted The Tribune."
Experts struggle to fix Britain’s National Health Service cyber-hack,LONDON: Experts have been working round-the-clock to restore IT systems of Britain’s National Health Service (NHS) after a large-scale cyber-hack by an international criminal gang wreaked havoc around the country.,Tribune News Service,2017-05-13T15:09:00,"London, May 13 Experts have been working round-the-clock to restore IT systems of Britain’s National Health Service (NHS) after a large-scale cyber-hack by an international criminal gang wreaked havoc around the country.With nearly 45 NHS organisations from London to Scotland hit in the “ransomware” attack on Friday, patients of the state-funded countrywide service are facing days of chaos as appointments and surgeries have been cancelled.Ciaran Martin, who leads UK’s National Cyber Security Centre, said his team was doing everything in its power to get “vital services” back up and running.“We are very aware that attacks on critical services such as the NHS have a massive impact on individuals and their families, and we are doing everything in our power to help them restore these vital services,” he said.(adsbygoogle = window.adsbygoogle || []).push({ });“It’s important to understand that cyber attacks can be different from other forms of crime in that their sometimes highly technical and anonymous nature means it can take some time to understand how it worked, who was behind it and what the impact is,” he told the BBC.Critically ill patients were being diverted to unaffected hospitals as computer systems failed in accident and emergency (A&E) units and doctors were locked out of test results, X- rays and patient records.NHS England said patients needing emergency treatment should go to Accidents & Emergency or access emergency services as they normally would.However, there have been some reports of ambulances being diverted from affected hospitals. Individual NHS trusts have asked registered patients not to attend unless it is urgent.London’s Barts Health NHS Trust, the largest trust in the UK, cancelled all outpatient appointments at its five hospitals on Saturday.The NHS has not been affected in Wales and Northern Ireland.The assault is part of an attack that has affected organisations in more than 70 countries, including the US, China, Russia and Spain, and disrupted power and telephone companies.Gangs are thought to have used tools stolen from US spies and dumped online by hackers linked to Russia.“This is not targeted at the NHS, it’s an international attack and a number of countries and organisations have been affected,” British Prime Minister Theresa May said yesterday.“The National Cyber Security Centre is working closely with NHS Digital to ensure they support the organisations concerned and that they protect patient safety. We are not aware of any evidence that patient data has been compromised,” she added.Ransomware programmes, which are sent by email and spread swiftly, can be bought on the dark web with sellers negotiating a percentage of the takings.“We will be advising NHS trusts to modernise their platforms,” UK Home Secretary Amber Rudd said.The malware used in the NHS attack is called WannaCry and attacks Windows operating systems.It encrypts files on a user’s computer, blocking them from view, before demanding money, via an on-screen message, to access them again.The demand is for a payment of $300 in virtual currency Bitcoin to unlock the files.The virus is usually covertly installed on to computers by hiding within emails containing links, which users are tricked into opening.A German ticket machine, a university laboratory in Italy and a number of Spanish firms - including telecoms giant Telefonica, power firm Iberdrola and utility provider Gas Natural - are among those hit by the outbreak.Portugal Telecom, delivery company FedEx, a Swedish local authority and Megafon, the second largest mobile phone network in Russia, also said they had been affected. — PTI","['patient', 'power', 'emergency', 'national', 'experts', 'health', 'affected', 'organisations', 'service', 'cyberhack', 'attack', 'services', 'patients', 'britains', 'struggle', 'fix', 'nhs']","London, May 13Experts have been working round-the-clock to restore IT systems of Britain’s National Health Service (NHS) after a large-scale cyber-hack by an international criminal gang wreaked havoc around the country.
Ciaran Martin, who leads UK’s National Cyber Security Centre, said his team was doing everything in its power to get “vital services” back up and running.
NHS England said patients needing emergency treatment should go to Accidents & Emergency or access emergency services as they normally would.
“The National Cyber Security Centre is working closely with NHS Digital to ensure they support the organisations concerned and that they protect patient safety.
The malware used in the NHS attack is called WannaCry and attacks Windows operating systems."
"BJP MPs to meet Modi today, seek CM’s ouster","SHIMLA: Close on the heel of announcement of Chief Minister Virbhadra Singh that he would meet Prime Minister Narendra Modi and apprise him of “political vendetta” being unleashed against him at the behest of Union Finance minister Arun Jaitley and former Chief Minister Prem Kumar Dhumal, the state BJP today fired a salvo by taking appointment with Prime minister for seeking ouster of the Chief Minister facing corruption charges.",Tribune News Service,2015-12-09T00:37:00,"Tribune News ServiceShimla, December 8Close on the heel of announcement of Chief Minister Virbhadra Singh that he would meet Prime Minister Narendra Modi and apprise him of “political vendetta” being unleashed against him at the behest of Union Finance minister Arun Jaitley and former Chief Minister Prem Kumar Dhumal, the state BJP today fired a salvo by taking appointment with Prime minister for seeking ouster of the Chief Minister facing corruption charges.All six MPs — Union Health Minister J P Nadda, former Chief Minister Shanta Kumar, BJYM president Anurag Thakur, Varinder Kashyap, Ram Swaroop Sharma and Bimla Kashyap — party general secretary and incharge of Himachal, Srikant Sharma; Leader of the Opposition in Vidhan Sabha P K Dhumal and state BJP chief Satpal Singh Satti will meet the Prime Minister tomorrow and press for removal of the chief minister.“The appointment with Prime Minister has been fixed at 2 PM and the top leadership of the party would apprise him of the corruption charges against Singh and stress that his continuance in office could hamper and influence the investigations”, party spokesman Ganesh Dutt confirmed.Meeting PM will not stop probe: Dhumal to CM(adsbygoogle = window.adsbygoogle || []).push({ });Our CorrespondentUna: Former Chief Minister Prem Kumar Dhumal today questioned Virbhadra Singh whether former Prime Minister Manmohan Singh was also not aware of the allegations of financial irregularities against him when he was Union Minister for Steel in the UPA regime.Responding to Virbhadra Singh’s statements that he would meet Prime Minister Narendra Modi to apprise him of the facts of the cases registered against him by the CBI and Enforcement Directorate (ED), Dhumal pointed out that Virbhadra Singh was shifted to less important department in the Union Cabinet after allegations of anonymous payments being made by someone to ‘VBS’ had surfaced when Virbhadra Singh was the Union Minister for Steel.Dhumal said it was right of every Chief Minister to meet Prime Minister, but this can not stop investigations into the ongoing cases against him. He said if Virbhadra Singh had nothing to hide, he should not fear from the investigations being done by the CBI, Income Tax Department and the ED.Reacting to Chief Minister’s allegations that the BJP legislators had not allowed the Assembly to function during the recently concluded session, Dhumal said it was mutually decided between the ruling and opposition in the Speaker’s chamber to allow time for discussion on corruption charges. However, he said the discussion was disallowed and the Assembly was adjourned abruptly by the ruling party.The former CM charged that the working of the Congress government in the state was paralysed, adding that even the Centrally sponsored schemes were not being implemented properly. Development works were either stalled or being delayed, while the focus of the ruling was only to shield the Chief Minister from corruption charges. He said the employees, who had completed four, nine and 14 years of service were still awaiting pay increments and youth were unable to find jobs.The fair price shops did not have essential commodities and government school students were bereft of uniforms, said Dhumal, adding that the condition of roads was going from bad to worse. BJP state president and Una MLA Satpal Singh Satti was also present.","['chief', 'virbhadra', 'dhumal', 'mps', 'modi', 'union', 'minister', 'meet', 'bjp', 'state', 'seek', 'prime', 'corruption', 'today', 'cms', 'ouster', 'singh']","Our CorrespondentUna: Former Chief Minister Prem Kumar Dhumal today questioned Virbhadra Singh whether former Prime Minister Manmohan Singh was also not aware of the allegations of financial irregularities against him when he was Union Minister for Steel in the UPA regime.
Dhumal said it was right of every Chief Minister to meet Prime Minister, but this can not stop investigations into the ongoing cases against him.
He said if Virbhadra Singh had nothing to hide, he should not fear from the investigations being done by the CBI, Income Tax Department and the ED.
Development works were either stalled or being delayed, while the focus of the ruling was only to shield the Chief Minister from corruption charges.
BJP state president and Una MLA Satpal Singh Satti was also present."
