Headlines,Descriptions,Authors,Published_Dates,Articles,Keywords,Summaries
Several dozen killed near Mali’s border with Niger,"BAMAKO: Several dozen civilians have been shot dead by gunmen who raided an area in northeastern Mali near the border with Niger, local officials and a Touareg self-defence group told AFP on Thursday.",Tribune News Service,2018-12-13T20:13:00,"Bamako, December 13 Several dozen civilians have been shot dead by gunmen who raided an area in northeastern Mali near the border with Niger, local officials and a Touareg self-defence group told AFP on Thursday.The attack, which took place early Wednesday, occurred in an area which has been badly hit by jihadist violence that has claimed several hundred lives this year, most of them civilians of Touareg or Peul ethnicity.“Gunmen riding on motorbikes raided many areas in the southern part of the Menaka region and executed civilians from the (Touareg) Idaksahak community,” said the Movement for the Salvation of Azawad (MSA), which spoke of 47 people killed.Local officials, who confirmed the attack, put the number of dead at several dozen but said they couldn’t.The MSA, part of a Touareg rebellion movement in the north, said the assailants headed for the Niger border after first setting a bushfire.(adsbygoogle = window.adsbygoogle || []).push({ });A Menaka official who wished to remain anonymous said he could not give an exact death toll as “by the time the Malian army arrived, MSA fighters had already buried the bodies”.Another local official said he had been able to speak with one person hurt in the attack and transferred to Menaka and accused the assailants of “firing on civilians”.The regional governor’s office was not immediately available for comment on the attack.MINUSMA, the UN mission to Mali, did not give a figure for casualties but deplored the attack on Twitter, urging the Malian authorities to investigate and bring those responsible to justice.It also said it was deploying a human rights team to investigate what had happened.In August, a panel of experts said in a report to the UN Security Council that inter-communal conflicts in the region were exacerbating existing tensions resulting from clashes between jihadists groups and international and Malian forces.France helped Malian forces stave off a jihadist insurgency that took control of large parts of the troubled north in 2012, but large swathes of the country remain out of the government’s control, despite a 2015 peace accord designed to isolate the Islamists.Since then, attacks have extended to central and southern regions of Mali and over the borders into neighbouring Burkina Faso and Niger. — AFP","['near', 'msa', 'menaka', 'malis', 'took', 'mali', 'killed', 'border', 'malian', 'civilians', 'attack', 'niger', 'touareg', 'dozen', 'southern']","Bamako, December 13Several dozen civilians have been shot dead by gunmen who raided an area in northeastern Mali near the border with Niger, local officials and a Touareg self-defence group told AFP on Thursday.
Local officials, who confirmed the attack, put the number of dead at several dozen but said they couldn’t.
The MSA, part of a Touareg rebellion movement in the north, said the assailants headed for the Niger border after first setting a bushfire.
It also said it was deploying a human rights team to investigate what had happened.
Since then, attacks have extended to central and southern regions of Mali and over the borders into neighbouring Burkina Faso and Niger."
Iranian student files police complaint against 10 for manhandling him,NEW DELHI: An Iranian studying at JNU on Monday filed a police complaint against 10 people for allegedly manhandling him while an ABVP member claimed that they were roughed up for celebrating India’s win over Pakistan in a cricket match.,Tribune News Service,2017-06-05T12:12:00,"New Delhi, June 5An Iranian studying at JNU on Monday filed a police complaint against 10 people for allegedly manhandling him while an ABVP member claimed that they were roughed up for celebrating India’s win over Pakistan in a cricket match.“Vinay, a resident of room number one of Damodar Hotel’s D Block, was bursting crackers in the gallery. When the guard intervened, he started arguing,” the student claimed in a complaint to the hostel senior warden and chief proctor.“While I was observing the situation, one of them pushed me and Vinay punched me on the nose. It was a group of 10 people at least, including Vinay and another person Saurabh Sharma,” the student, who wished to remain anonymous, alleged.“The whole group was drunk,” he added.(adsbygoogle = window.adsbygoogle || []).push({ });He alleged that there were many complaints against the unruly behaviour of the student and requested the authorities to take appropriate action against him.The Iranian national has filed a complaint with Vasant Kunj (North) Police Station, a senior police official said.ABVP member Saurabh Sharma, whose name was mentioned in the complaint, claimed that he was celebrating India’s victory against Pakistan in the cricket match on Sunday when a few persons, some of whom might be foreign nationals, not happy with the result, manhandled him. PTI","['files', 'pakistan', 'member', 'vinay', 'senior', 'complaint', 'saurabh', 'claimed', 'sharma', 'manhandling', 'iranian', 'student']","New Delhi, June 5An Iranian studying at JNU on Monday filed a police complaint against 10 people for allegedly manhandling him while an ABVP member claimed that they were roughed up for celebrating India’s win over Pakistan in a cricket match.
When the guard intervened, he started arguing,” the student claimed in a complaint to the hostel senior warden and chief proctor.
It was a group of 10 people at least, including Vinay and another person Saurabh Sharma,” the student, who wished to remain anonymous, alleged.
He alleged that there were many complaints against the unruly behaviour of the student and requested the authorities to take appropriate action against him.
The Iranian national has filed a complaint with Vasant Kunj (North) Police Station, a senior police official said."
Thane businessman gets extortion calls from gangster,"THANE: A businessman from Ulhasnagar here received extortion calls demanding a ransom of Rs 50 lakh, with the caller claiming to be fugitive gangster Suresh Pujari, the police said on Thursday.",Tribune News Service,2017-05-25T14:36:00,"Thane, May 25 A businessman from Ulhasnagar here received extortion calls demanding a ransom of Rs 50 lakh, with the caller claiming to be fugitive gangster Suresh Pujari, the police said on Thursday.The businessman, who owns a garment shop in the township, received three to four calls allegedly from Pujari, on his mobile between May 22 and May 24 from number “+301”,  a Vitthalwadi police station official said.In his complaint lodged with Vitthalwadi police last night, the victim stated that after each time he switched off his phone on getting the calls, he received a message from the same number, asking him to shell out Rs 50 lakh or else boys will be sent to his (businessman’s) office to open fire at him.A case has been registered under IPC section 384 (extortion) and 507 (criminal intimidation by an anonymous communication) in this connection and further investigations are on. — PTI(adsbygoogle = window.adsbygoogle || []).push({ });","['thane', 'received', 'vitthalwadi', 'pujari', 'extortion', 'calls', 'gangster', 'businessman', 'rs', 'number', 'lakh', '50', 'gets']","Thane, May 25A businessman from Ulhasnagar here received extortion calls demanding a ransom of Rs 50 lakh, with the caller claiming to be fugitive gangster Suresh Pujari, the police said on Thursday.
The businessman, who owns a garment shop in the township, received three to four calls allegedly from Pujari, on his mobile between May 22 and May 24 from number “+301”, a Vitthalwadi police station official said.
In his complaint lodged with Vitthalwadi police last night, the victim stated that after each time he switched off his phone on getting the calls, he received a message from the same number, asking him to shell out Rs 50 lakh or else boys will be sent to his (businessman’s) office to open fire at him.
A case has been registered under IPC section 384 (extortion) and 507 (criminal intimidation by an anonymous communication) in this connection and further investigations are on."
"Amazon picks New York, suburban Washington for new, split HQ: WSJ","WASHINGTON: Amazon has decided to split its new headquarters between New York City and a Washington suburb in Northern Virginia, The Wall Street Journal reported.",Tribune News Service,2018-11-13T13:34:00,"Washington, November 13Amazon has decided to split its new headquarters between New York City and a Washington suburb in Northern Virginia, The Wall Street Journal reported.An official announcement from the online retail giant is expected as early as Tuesday, the newspaper said Monday night, quoting people familiar with the issue.After a year-long search in which more than 200 cities wooed the web giant for the project — and the treasure of jobs, development and tax revenue it will bring — Amazon opted to divvy up its so-called HQ2 between the Long Island City neighborhood of Queens in New York and the Crystal City area of Arlington, Virginia, across the Potomac River from Washington.Reports to this effect first ran last week in the Journal and in The New York Times.As many as 50,000 jobs would be divided evenly between the two cities, according to these reports.(adsbygoogle = window.adsbygoogle || []).push({ });The Journal last week quoted an anonymous source as saying Amazon decided that dividing its second headquarters between two locations would spread the economic benefits as well as burdens — such as pressure on housing and transportation.Amazon also feared that if it put the facility in one city it might not find enough engineers to staff it, the paper says.Its current headquarters is in Seattle, where the company's ""urban campus"" is woven into the fabric of the northwestern city. — AFP","['amazon', 'decided', 'jobs', 'week', 'virginia', 'picks', 'giant', 'wsj', 'york', 'washington', 'city', 'headquarters', 'journal', 'split', 'hq', 'suburban']","Washington, November 13Amazon has decided to split its new headquarters between New York City and a Washington suburb in Northern Virginia, The Wall Street Journal reported.
Reports to this effect first ran last week in the Journal and in The New York Times.
As many as 50,000 jobs would be divided evenly between the two cities, according to these reports.
Amazon also feared that if it put the facility in one city it might not find enough engineers to staff it, the paper says.
Its current headquarters is in Seattle, where the company's ""urban campus"" is woven into the fabric of the northwestern city."
"Accountability commission can try politicians, rules High Court","SRINAGAR: In a significant decision aimed at empowering the State Accountability Commission (SAC), the  Jammu and Kashmir High Court today overturned its ruling by restoring the anti-graft body’s suo motu powers to look into complaints against erring public functionaries, including ministers, legislators and people’s representatives, in corruption cases.",Tribune News Service,2016-02-02T01:01:00,"Ishfaq TantryTribune News ServiceSrinagar, February 1In a significant decision aimed at empowering the State Accountability Commission (SAC), the  Jammu and Kashmir High Court today overturned its ruling by restoring the anti-graft body’s suo motu powers to look into complaints against erring public functionaries, including ministers, legislators and people’s representatives, in corruption cases.In its judgment announced at the Jammu wing today, the High Court set a rider that the commission will not make its proceedings in such cases public till the process was completed.Allowing an appeal filed by the SAC, a Division Bench comprising  Justices Muzaffar Hussain Attar and BS Walia set aside the ruling of Justice Hasnain Masoodi and restored the commission’s  powers of initiating suo motu proceedings against any minister, legislator or people’s representative on the basis of an anonymous complaint or media report.(adsbygoogle = window.adsbygoogle || []).push({ });The HC put the rider that  the commission “shall hold such proceedings in secrecy” and its “progress will not be made public” till completion of the process.“In such circumstances, it shall not have to disclose the contents of the anonymous or pseudonymous complaint or make it known to the public as to which press report has been taken cognisance of for conducting of preliminary enquiry,” the Bench observed in its 40-page judgment.The Bench  observed that striking down of Regulation 9 of the Regulations of 2005 by the single-Judge Bench had not denuded the SAC of its power of suo motu initiation of proceedings against a public functionary and that power was still intact.Acting on a bunch of 35 petitions challenging suo motu powers of the SAC, the single-Judge Bench ruled on January 7, 2013, that the SAC could not suo motu direct investigation, inquiry or proceedings against a public functionary on the basis of an anonymous complaint.The commission had filed an appeal against this ruling. It was represented by the Supreme Court lawyers Collin Gonsalves and Pranav Kohli.Pleading for restoration of of suo motu powers to look into complaints against erring public functionaries, the SAC had submitted in its  appeal that “any restrictive interpretation” would result in “demise” of the Accountability Commission Act, “enacted for transparency and accountability” in public administration.“The commission should be credited with the power to take its probe to a logical conclusion. Even an anonymous complaint or media report deserves cognisance by the commission to achieve the objective of the Act,” the lawyers had submitted.Both the Jammu and Kashmir Government and the petitioners against whom the SAC initiated proceedings had opposed suo motu powers of the commission. All ex-ministers against whom the SAC passed orders or initiated suo motu proceedings in corruption cases had obtained stay orders from the High Court.In February 2012, the High Court had stayed the orders of the SAC to chairmen of six development boards and two advisers of then Chief Minister Omar Abdullah to appear before the commission.","['rules', 'motu', 'court', 'politicians', 'high', 'commission', 'sac', 'accountability', 'suo', 'public', 'try', 'bench', 'proceedings', 'powers']","In its judgment announced at the Jammu wing today, the High Court set a rider that the commission will not make its proceedings in such cases public till the process was completed.
The HC put the rider that the commission “shall hold such proceedings in secrecy” and its “progress will not be made public” till completion of the process.
Both the Jammu and Kashmir Government and the petitioners against whom the SAC initiated proceedings had opposed suo motu powers of the commission.
All ex-ministers against whom the SAC passed orders or initiated suo motu proceedings in corruption cases had obtained stay orders from the High Court.
In February 2012, the High Court had stayed the orders of the SAC to chairmen of six development boards and two advisers of then Chief Minister Omar Abdullah to appear before the commission."
Honour killing suspected in Panipat village,PANIPAT: A suspected case of honour killing has been reported in the district.,Tribune News Service,2017-09-30T00:18:00,"Tribune News ServicePanipat, September 29A suspected case of honour killing has been reported in the district. Acting upon an anonymous telephone call, a police team recovered samples of bones and ash from the pyre today.The deceased was identified as 17-year-old Ravina of Joshi village in the Madlauda area of Panipat. The matter came to light this morning when a call was received at the police control room.The police were told that the girl was killed by her parents and was being cremated in the wee hours today. Samalkha DSP Bali Singh said the girl had been killed by her parents by electrocution.(adsbygoogle = window.adsbygoogle || []).push({ });Madlauda SHO Narender Dahiya and a forensic team reached the cremation ground, but the body had been fully burnt by then.The forensic team collected some remains and bones from the pyre and sent these to the forensic laboratory, said the DSP.“We have registered a case and arrested Ravina’s father Suresh and uncle Shyama,” he said. The girl had gone out with someone around 10 days back, but her parents did not contact the police, he added.He further said they brought the girl back three or four days back and killed and cremated her this morning. The accused would be produced in court tomorrow, he said.Police sources said the girl’s death and cremation in the wee hours caused suspicion. Relatives gave varying statements about her death. An intensive probe was launched to unearth the truth, he asserted.","['hours', 'village', 'morning', 'girl', 'killed', 'forensic', 'parents', 'panipat', 'suspected', 'wee', 'killing', 'team', 'pyre', 'honour', 'death']","Tribune News ServicePanipat, September 29A suspected case of honour killing has been reported in the district.
The deceased was identified as 17-year-old Ravina of Joshi village in the Madlauda area of Panipat.
The police were told that the girl was killed by her parents and was being cremated in the wee hours today.
Madlauda SHO Narender Dahiya and a forensic team reached the cremation ground, but the body had been fully burnt by then.
The forensic team collected some remains and bones from the pyre and sent these to the forensic laboratory, said the DSP."
"Panama Papers: Huge tax leak outs Putin aides, world leaders","PARIS: A massive leak of 11.5 million tax documents has exposed the secret offshore dealings of aides to Russian president Vladimir Putin, world leaders and celebrities including Barcelona forward Lionel Messi. An investigation into the documents by more than 100 media groups, described as one of the largest such probes in history, revealed the hidden offshore dealings in the assets of around 140 political figures.",Tribune News Service,2016-04-04T16:50:00,"Paris, April 4   A massive leak of 11.5 million tax documents has exposed the secret offshore dealings of aides to Russian president Vladimir Putin, world leaders and celebrities including Barcelona forward Lionel Messi.An investigation into the documents by more than 100 media groups, described as one of the largest such probes in history, revealed the hidden offshore dealings in the assets of around 140 political figures.The vast stash of records was obtained from an anonymous source by German daily Sueddeutsche Zeitung and shared with media worldwide by the International Consortium of Investigative Journalists (ICIJ).The documents, from around 214,000 offshore entities covering almost 40 years, came from Mossack Fonseca, a Panama-based law firm with offices in more than 35 countries.The investigations allege close associates of Putin, who is not himself named in the documents, ""secretly shuffled as much as USD 2 billion through banks and shadow companies"".(adsbygoogle = window.adsbygoogle || []).push({ });Twelve current or former heads of state are named in the investigations, including the prime ministers of Iceland and Pakistan, the president of Ukraine and the king of Saudi Arabia, as well as sporting and movie stars like Jackie Chan.They allege Chinese President Xi Jinping's family has links to offshore accounts, as did the father of British Premier David Cameron, and claim Iceland's prime minister secretly owned millions of dollars of bank bonds during the financial crisis.Xi has led a high-profile anti-graft drive in China, targeting excessive wealth amassed by Communist Party cadres.The papers also cast fresh light on the corruption scandal engulfing football's world governing body, revealing that FIFA ethics committee member Juan Pedro Damiani had business ties with three men who have been indicted over the probe.Disgraced UEFA chief Michel Platini allegedly used Mossack Fonseca to administer an offshore company, while Messi and his father apparently own a shell company not discovered in a Spanish investigation into the football star's tax affairs.Platini's communications service said in a statement sent to AFP that ""all of his accounts and assets are known to the tax authorities in Switzerland, where he has been a tax resident since 2007"".'Disinformation' Media reports alleging links between Russian President Vladimir Putin and offshore transactions worth billions of dollars aim to discredit the Kremlin leader ahead of Russia's upcoming elections, his spokesman said on Monday.""The main target of this disinformation is our president, especially in the context of the upcoming parliamentary elections and in the context of a longer-term perspective — I mean presidential elections in two years,"" Dmitry Peskov told a conference call with journalists.""This Putinophobia abroad has reached such a point that it is in fact taboo to say something good about Russia, or about any actions by Russia or any Russian achievements. But it's a must to say bad things, a lot of bad things, and when there's nothing to say, it must be concocted. This is evident to us."" Peskov said the publications contained ""nothing concrete and nothing new"" about Putin. More heads rollA nephew of South African President Jacob Zuma and the son of Ghana's former president John Agyekum Kufuor were among African figures named in the Panama Papers trove of leaked tax documents.Zuma's nephew, Clive Khulubuse Zuma, is a cigar-chomping mining magnate who is thought to own up to 19 collectible cars.The documents from Panamanian law firm Mossack Fonseca show that Khulubuse Zuma was authorised to represent Caprikat Limited, one of two offshore companies that controversially acquired oil fields in the Democratic Republic of Congo.In 2010, as questions were raised about the acquisition, British Virgin Islands authorities ordered Mossack Fonseca to provide additional background information on Zuma. Later that year, Mossack Fonseca ended its relationship with the companies.Zuma and representatives of the companies have rejected allegations of wrongdoing and claimed the oil deals are ""quite attractive"" to the DRC government.Also implicated is John Addo Kufuor, the eldest son of Ghana's former president John Agyekum Kufuor, who led the country from 2001 to 2009.A trained accountant, the younger Kufuor is said in the documents to have controlled a $75,000 bank account in Panama for his father and his mother that he ran through an offshore company. He did not respond to the ICIJ's requests for comment.The son of Congolese President Denis Sassou Nguesso also appears in the Mossack Fonseca files, in the 1990s.Denis Christel Sassou Nguesso is said to have approached Mossack Fonseca about setting up a company based in the British Virgin Islands, called Phoenix Best Finance, according to the French daily Le Monde, which is one of the media partners for the release of the documents.Sassou Nguesso told Le Monde he did not know the law firm and had no knowledge of Phoenix Best Finance.The documents were first obtained by German newspaper Sueddeutsche Zeitung a year ago, led by the International Consortium of Investigative Journalists and involving more than 100 publications from nearly 80 countries. — Agencies","['zuma', 'mossack', 'company', 'world', 'putin', 'leak', 'tax', 'outs', 'huge', 'fonseca', 'leaders', 'documents', 'panama', 'son', 'papers', 'kufuor', 'president', 'offshore', 'aides']","King of Saudi Arabia, actor Jackie Chan, footballer Lionel Messi on listParis, April 4A massive leak of 11.5 million tax documents has exposed the secret offshore dealings of aides to Russian president Vladimir Putin, world leaders and celebrities including Barcelona forward Lionel Messi.
The documents, from around 214,000 offshore entities covering almost 40 years, came from Mossack Fonseca, a Panama-based law firm with offices in more than 35 countries.
In 2010, as questions were raised about the acquisition, British Virgin Islands authorities ordered Mossack Fonseca to provide additional background information on Zuma.
Later that year, Mossack Fonseca ended its relationship with the companies.
The son of Congolese President Denis Sassou Nguesso also appears in the Mossack Fonseca files, in the 1990s."
