Headlines,Descriptions,Authors,Published_Dates,Articles,Keywords,Summaries
IAF faces HC ire for confining corporal to psychiatric ward for alcohol dependency,"NEW DELHI: The Indian Air Force (IAF) faced the ire of the Delhi High Court on Thursday for confining one of its non-commissioned officers, a corporal, to a psychiatric ward for over two months, because he was an alcoholic and suffered from mental disorders.",Tribune News Service,2018-07-12T21:45:00,"New Delhi, July 12 The Indian Air Force (IAF) faced the ire of the Delhi High Court on Thursday for confining one of its non-commissioned officers, a corporal, to a psychiatric ward for over two months, because he was an alcoholic and suffered from mental disorders.A Bench of justices S Muralidhar and Vinod Goel questioned the rationale behind the IAF’s decision, asking how it determined on a daily basis that the corporal still “craved for alcohol”.The court also said the newly-enacted Mental Health Act made it clear that a person could not be forced to undergo treatment without his consent, adding that the IAF “cannot ignore the laws of the country”.Terming the conduct of the IAF “irresponsible”, the Bench wondered how many of such cases there might be, which were yet to be highlighted.“How were you determining on a daily basis that his craving for alcohol had not gone down? What tests were conducted by you? This is completely irresponsible. We wonder how many such cases are there.(adsbygoogle = window.adsbygoogle || []).push({ });“This is a clear case where a man is saying he has been detained without consent. Under the new Mental Health Act, you cannot force him to undergo treatment without his consent. Then how are you pumping him full of drugs? We do not know who should be proceeded against,” the Bench said.It added that the IAF needed to be reminded not to interfere with a person’s liberty as “short of chaining him up, everything else was done here” and directed that the corporal be produced in court tomorrow.According to the IAF, represented by the Centre’s standing counsel, Ripudaman Singh Bhardwaj, the action against the corporal was taken on a complaint from his wife that he turned violent after consuming alcohol.Bhardwaj said the corporal, Kriyad Yogesh Bhankhariya, had alcohol dependency issues for which he was initially treated in the psychiatric ward of the Army Base Hospital here and thereafter, in June, he was shifted to the medical centre at the Tughlakabad Air Force Station.The court said if the non-commissioned officer (NCO) was an alcoholic, then the IAF ought to have sought the help of the “Alcoholics Anonymous” on how to deal with the matter as any psychiatric would confirm that confinement of a person was advisable only in extreme cases.“It is worrying, the manner in which you have approached the situation,” the Bench told the IAF.The court was hearing a habeas corpus petition filed by the 30-year-old corporal’s father, claiming that his son was being illegally confined at the Army Base Hospital. —PTI","['confining', 'court', 'corporal', 'iaf', 'ward', 'psychiatric', 'faces', 'consent', 'undergo', 'dependency', 'mental', 'bench', 'alcohol', 'force', 'ire', 'hc']","New Delhi, July 12The Indian Air Force (IAF) faced the ire of the Delhi High Court on Thursday for confining one of its non-commissioned officers, a corporal, to a psychiatric ward for over two months, because he was an alcoholic and suffered from mental disorders.
Terming the conduct of the IAF “irresponsible”, the Bench wondered how many of such cases there might be, which were yet to be highlighted.
“How were you determining on a daily basis that his craving for alcohol had not gone down?
Under the new Mental Health Act, you cannot force him to undergo treatment without his consent.
“It is worrying, the manner in which you have approached the situation,” the Bench told the IAF."
I’ve been sober for 10 years: Mel Gibson,"Actor-filmmaker Mel Gibson has claimed he has been sober for 10 years, following his controversial drunk driving arrest and anti-Semitic rant in 2006.",Tribune News Service,2016-10-19T00:15:00,"Actor-filmmaker Mel Gibson has claimed he has been sober for 10 years, following his controversial drunk driving arrest and anti-Semitic rant in 2006.The 60-year-old was the subject of controversy in 2006 when he was arrested by a policeman in Malibu for drunk driving, and was subsequently filmed giving an anti-Semitic rant.He then landed himself in trouble again in 2010 when his ex-girlfriend Oksana Grigorieva claimed the What Women Want actor had punched her and broken her teeth. She then released secretly recorded audio in which Gibson allegedly went on another racially-charged tirade.(adsbygoogle = window.adsbygoogle || []).push({ });Now, the Braveheart star has credited Alcoholics Anonymous for helping him clean up his life, and insists he's a changed man.""I am a member of (the) 12-step program and I achieved sobriety like that. I've got 10 years of sobriety under my belt. I had other lengths before that like eight years one time, fall off, four years, it's like that, like through a revolving door.""The star now describes his past outbursts as the ""worst moment"" of his life, and says what he did ""wasn't meant to be public"".""Imagine the worst moment you have even had being recorded and broadcast to the world and it wasn't meant to be public.You didn't stand on a soapbox and do it, but that's what happens, you know,"" he said. —PTI","['sobriety', 'meant', 'mel', 'sober', 'wasnt', 'gibson', 'star', 'worst', 'life', 'drunk', 'moment', 'recorded', 'ive']","Actor-filmmaker Mel Gibson has claimed he has been sober for 10 years, following his controversial drunk driving arrest and anti-Semitic rant in 2006.
She then released secretly recorded audio in which Gibson allegedly went on another racially-charged tirade.
Now, the Braveheart star has credited Alcoholics Anonymous for helping him clean up his life, and insists he's a changed man.
The star now describes his past outbursts as the ""worst moment"" of his life, and says what he did ""wasn't meant to be public"".
""Imagine the worst moment you have even had being recorded and broadcast to the world and it wasn't meant to be public."
Students participate in national camp,Volunteers of the Red Cross Unit of SSD Girls College participated in a national-level camp organised in Vellore in Tamil Nadu recently.,Tribune News Service,2017-04-06T01:04:00,"Volunteers of the Red Cross Unit of SSD Girls College participated in a national-level camp organised in Vellore in Tamil Nadu recently. The camp was organised at VIT University. As many as 150 students from 25 universities of nine states participated in the camp. Students of the SSD Girls College— Gurneet Kaur, Ria Kapoor, Yashika and Harinder Kaur— participated in the camp under the guidance of Youth Red Cross Programme officer Prof Monica Kapoor.  The students participated in several events, such as the role of the youth in the Red Cross Society, goal setting and emotional intelligence, the Swachh Bharat Abhiyan, Yoga – a magic of life, emergency situation and disaster management, first-aid training, Alcoholics Anonymous group, emerging diseases, road to positive health, dignity in mental health and others.Visit to religious placesAs many as 54 students, led by six professors of Malwa College, Bathinda, went on a one-day trip to historical and religious places of Shri Anandpur Sahib, Sirhind, Fatehgarh Sahib and Patiala recently. At Sri Anandpur Sahib they paid obeisance at Takht Sri Keshgarh Sahib and also visited Virasat-e-Khalsa. They were informed about the importance of these places. NK Gosain, principal of the college, said such tours added to the knowledge of the students and helped them in knowing about the historical background, culture and the supreme sacrifices of the great Sikh Gurus. Head of the Department of Management and Commerce Dr Rupinder Kaur Sidhu said the students enjoyed the trip. Keeping in view the interest of the students, more such tours would be organised in the future, she added.PlacementsA placement camp was held at Guru Kashi University (GKU) for students of BSc Agriculture (hons) Dr RK Gumber and his associate Surinder Kumar of Ankur Seeds Limited scrutinised the resume of the students and interviewed them for field jobs in seed sector. Dr Mehboob Singh, director, Corporate Cell, said 43 students participated in the interview and four students, Karamjit Kaur, Gursimran Singh, Gurmet Singh and Karanjit Singh, were selected. The selected candidates would be deputed in Sirsa and Jind, he added. Dr AS Sidhu, Dean of the University College of Agriculture, said the students were prepared to face the interview and were aware about the current needs of the seed industry. Sukhraj Singh Sidhu, managing director, appreciated the organisers of the placement drive. Col Dr BS Dhaliwal, Vice-Chancellor, GKU, and registrar, Dr Jagtar Singh Dhiman, congratulated the selected students. — TNS(adsbygoogle = window.adsbygoogle || []).push({ });","['participated', 'kaur', 'university', 'sidhu', 'camp', 'national', 'sahib', 'participate', 'students', 'college', 'dr', 'singh']","CAMPUS NOTESVolunteers of the Red Cross Unit of SSD Girls College participated in a national-level camp organised in Vellore in Tamil Nadu recently.
As many as 150 students from 25 universities of nine states participated in the camp.
Students of the SSD Girls College— Gurneet Kaur, Ria Kapoor, Yashika and Harinder Kaur— participated in the camp under the guidance of Youth Red Cross Programme officer Prof Monica Kapoor.
Head of the Department of Management and Commerce Dr Rupinder Kaur Sidhu said the students enjoyed the trip.
Dr Mehboob Singh, director, Corporate Cell, said 43 students participated in the interview and four students, Karamjit Kaur, Gursimran Singh, Gurmet Singh and Karanjit Singh, were selected."
"Legalise drugs, get rid of addiction","TWO different news, apparently unrelated, made it to the newspapers a fortnight or so back. The first of these appeared, possibly, in The Tribune, with the headline  “81 lakh lesser tobacco consumers since 2010”.",Rajendra P Jindal,2017-08-07T00:19:00,"Rajendra P JindalTWO different news, apparently unrelated, made it to the newspapers a fortnight or so back. The first of these appeared, possibly, in The Tribune, with the headline  “81 lakh lesser tobacco consumers since 2010”. The other news item appeared the very next day, and was titled ""Punjab Inspector held for drug trafficking"" The same evening, it was prominently splashed on all television channels. It continued to be followed in the media for the next couple of days until it was drowned by similar news.An ordinary reader may be excused for not seeing any relation between these two. But let us take them one by one. It may be news to most readers that tobacco (nicotine) is a drug too, albeit a legal one, in all the senses of the word that “drug” conveys. Until a few years ago, rich and powerful tobacco companies in the US, most of the medical researchers and doctors (the latter too on the payroll of tobacco companies) refused to admit that tobacco is a drug. It was contended that it is, at worst, a habit-forming substance only. With the help of PET and MRI scans, it has been conclusively proved that nicotine creates the same biochemical and molecular effects in the brain as any other drug such as cocaine and heroin and many other activities such as a kiss, a hug or a word of praise. This effect is known as elevation of a neurotransmitter substance (a chemical which carries messages from one micro part of the brain to the other) called “Dopamine”. The surge in the level of Dopamine produces a feeling of pleasure, at least initially. This effect is not common to the same degree in everybody; probably it is modified by a genetic factor. Therefore, whereas some people can ""take it and leave it"", others become addicted. Smoking or chewing tobacco is as addictive as any other drug and as difficult to get rid of. It gives the same sense of pleasure and the physical ill-effects are much more than any other drug. No other drug causes fatal cancers, heart and chest problems and many serious ailments.The interesting question that arises is: how were 81 lakh people able to give it up without even a single one ever being arrested or put into jail? No amount of tobacco was confiscated and no police officer or politician was ever accused of dealing with tobacco. One reason is that unlike other drugs, tobacco was never prohibited. Secondly, it is the education by various means and at various fora about the ill-effects of tobacco that has worked the miracle. In school and college textbooks, on radio and television as well as cigarette advertisement boards and even cigarette packets, ill-effects of smoking are prominently displayed. Most people seem to know that smoking causes the cancer of the lungs, even if they know nothing else. Therefore, compared to many more than those who have given up smoking are those who want to and are trying to give up smoking.  (adsbygoogle = window.adsbygoogle || []).push({ });As far as the other news that a Punjab Police Sub-inspector was held for drug trafficking, nobody should have trouble believing that the episode is only the tip of the iceberg. A junior police officer cannot run a drug empire without the collusion of  colleagues and seniors. In the run-up to the Punjab Assembly elections, the chiefs of at least two of the political parties declared that they will totally abolish the drug menace from Punjab within a month of coming to power. The one who is now the Chief Minister, sotto voce, scaled the peak of rhetoric and ignorance when he declared that “the back of the drug trade has been broken”. As the subsequent events, including the news in discussion have revealed, the demon called drug trade is healthy and well, thank you. Are these leaders innocent, ignorant, naive or plain simpletons? The drug trade will persist as long as our approach to handling it remains archaic.For some unknown reason, in contrast to smoking and consumption of alcohol, consuming drugs has always been considered a character flaw, a criminal activity. The dopamine hypothesis has proved that drug addiction is a disorder of the brain no different from that caused by nicotine and alcohol. It is a mental illness of similar nature. The right place for a drug addict, therefore, is a hospital and not a prison and the way to deal with drugs is not to prohibit them but to legalise them just as it is in the case of tobacco and alcohol. Why are we so keen and insistent on prohibiting drugs and not tobacco and alcohol, while the latter two are more harmful? It obviously cannot be because we are a nation with knee-jerk puritanism. In that case, we would prohibit alcohol also. There are two reasons for the insistence on drug prohibition. The drug trade will exist as long as there is prohibition that generates exorbitant profits for the drug lords like our Sub-inspector and his seniors as well as politicians. Also, we inherently want to punish narco-trafficking, not eradicate it. However, the most novel reason for drug prohibition so far has been propounded by the American author Barbara Ehrenreich. She feels that we cling to prohibition for the same reason one clings to so many other self -destructive habits like nicotine, cocaine and heroin: because of the way it makes us feel — good and self righteous. If we surrender now, it will send the wrong message. Says she, “Legal drugs, even if heavily taxed and extensively regulated would no doubt be cheaper than illegal ones. This could mean more people sampling them out of curiosity. This danger has to be weighed against the insidious marketing dynamics of illegal drugs whose widely inflated prices compel the user to become a pusher and a recruiter of new users”. It is time to try a new approach to the drug problem. The people who want to use drugs know where to get them and no law has yet dissuaded people from using them. Legalise, regulate and tax drugs to the hilt. Take the money that would have gone towards preventive laws and spend it on education, healthcare and rehabilitation. A word about rehabilitation too. Dopamine-related research has shown that abstinence, if maintained, not only halts the physical and psychological damage wrought by drugs but also reverses it in large measure. A majority of the rehabilitation centres, mushrooming all over and uniformly lacking sufficient staff with enough expertise (psychiatrists and psychotherapists) and dedication (nurses and helpers), are worse than prisons. An addict needs long treatment, perhaps running into months. During this period, there are failures but their rate is no different from that for other chronic diseases. Nearly half the recovering addicts fail to maintain complete abstinence after a year, about the same proportion of patients with diabetes and hypertension who fail to comply with their medication regimens. Therefore, occasional relapse only means that more treatment is required, not that the addict be imprisoned. Alcoholic Anonymous and Narcotic Anonymous are the two organisations which probably have the highest cure rate because their members never refer to themselves as “cured”; they always call themselves “recovering addicts”. We could begin with a drug like marijuana and see how abolishing prohibition works. Then, we could move on to more drugs. Doesn't it sound like an idea that might catch on?The writer is a surgeon at the Guru Gobind Singh Medical College and Hospital, Faridkot","['drugs', 'tobacco', 'punjab', 'reason', 'nicotine', 'prohibition', 'drug', 'smoking', 'legalise', 'trade', 'alcohol', 'rid', 'addiction']","One reason is that unlike other drugs, tobacco was never prohibited.
As the subsequent events, including the news in discussion have revealed, the demon called drug trade is healthy and well, thank you.
The drug trade will persist as long as our approach to handling it remains archaic.
Why are we so keen and insistent on prohibiting drugs and not tobacco and alcohol, while the latter two are more harmful?
However, the most novel reason for drug prohibition so far has been propounded by the American author Barbara Ehrenreich."
"In two yrs, 3 cases of sexual harassment in police dept",CHANDIGARH: The Punjab Police’ departmental committee on sexual harassment allegations has received just three complaints in the last two years.,Tribune News Service,2018-10-25T01:13:00,"Jupinderjit SinghTribune News ServiceChandigarh, October 24The Punjab Police’ departmental committee on sexual harassment allegations has received just three complaints in the last two years. The latest was against a head clerk posted with a battalion. The committee has indicted him and recommended action against him.The complaints have been made mostly against non-gazetted ranks, with dismissed cop Salwinder Singh being the only exception. However, many anonymous complaints against senior officers have been received  in which they have been accused of misuse of authority, helping some non-police complainant women in property cases or giving favours to women constables. The anonymous complaints are not taken seriously.An official associated with the committee said the biggest case was against former SP Salwinder Singh. The committee was set up in 2008 and the first complaint was received after two years. The official said negligible number of complaints should not be construed as if there were no sexual harassment incidents in the police or less compared to other departments. (adsbygoogle = window.adsbygoogle || []).push({ });","['yrs', 'harassment', 'complaints', 'received', 'cases', 'salwinder', 'anonymous', 'sexual', 'women', 'official', 'committee', 'dept', 'singh']","Jupinderjit SinghTribune News ServiceChandigarh, October 24The Punjab Police’ departmental committee on sexual harassment allegations has received just three complaints in the last two years.
The complaints have been made mostly against non-gazetted ranks, with dismissed cop Salwinder Singh being the only exception.
The anonymous complaints are not taken seriously.
An official associated with the committee said the biggest case was against former SP Salwinder Singh.
The official said negligible number of complaints should not be construed as if there were no sexual harassment incidents in the police or less compared to other departments."
Bus permits: Plea seeks transparency,CHANDIGARH: The Orbit case has taken another turn. An application has been moved in the case by the amicus curiae or the friend of the court for issuance of appropriate direction on framing transparent timetable for buses.,Tribune News Service,2015-07-11T01:27:00,"Tribune News ServiceChandigarh, July 10The Orbit case has taken another turn. An application has been moved in the case by the amicus curiae or the friend of the court for issuance of appropriate direction on framing transparent timetable for buses.Directions have also been sought for displaying bus fares and taking cognisance of decisions taken by the Punjab Government which were against the public interest. The petition is expected to come up for hearing on Monday.The plea comes nearly three months after a 13-year-old girl died when her alleged molesters threw her off the bus owned by Orbit Aviation — the transport company owned by the ruling Badal family.The high court has already taken suo motu cognisance of a handwritten anonymous letter in the Orbit bus case alleging that the Badals have “amassed wealth at the cost of the state” and should be sent behind bars.(adsbygoogle = window.adsbygoogle || []).push({ });Seeking a CBI probe, the letter adds: “The amount earned by them be recovered and further a fine of Rs100 crore be imposed on them as theirs is a more serious case than the one involving Tamil Nadu Chief Minister Jayalalithaa.”","['plea', 'letter', 'bus', 'permits', 'seeks', 'court', 'cognisance', 'taken', 'wealth', 'turn', 'case', 'transparency', 'owned', 'orbit']","ORBIT CASETribune News ServiceChandigarh, July 10The Orbit case has taken another turn.
An application has been moved in the case by the amicus curiae or the friend of the court for issuance of appropriate direction on framing transparent timetable for buses.
Directions have also been sought for displaying bus fares and taking cognisance of decisions taken by the Punjab Government which were against the public interest.
The plea comes nearly three months after a 13-year-old girl died when her alleged molesters threw her off the bus owned by Orbit Aviation — the transport company owned by the ruling Badal family.
The high court has already taken suo motu cognisance of a handwritten anonymous letter in the Orbit bus case alleging that the Badals have “amassed wealth at the cost of the state” and should be sent behind bars."
