Headlines,Descriptions,Authors,Published_Dates,Articles,Keywords,Summaries
Alcoholics Anonymous News and Updates from The Economic Times,Alcoholics Anonymous News and Updates from The Economictimes.com,,None,"Food ministry seeks delay in ethanol blending plan 24 May, 2011, 03.04AM IST The food ministry is set to oppose the mandatory 5% ethanol blending programme, fearing diversion of foodgrain for manufacture of ethanol.

Muzaffarnagar clashes sour its famed jaggery business 19 Sep, 2013, 04.59AM IST The flourishing business of jaggery (gurh) in the region is already on the verge of a shutdown as workers have fled after the clashes.

How a web of corruption allows lucrative international red sanders smuggling: A smuggler's account 24 May, 2015, 11.06AM IST Encounter deaths of 20 woodcutters shot down by the forest police force of AP deep inside the Seshachalam forests are part of this activity.

Only the culturally rooted can effectively answer people like Dinanath Batra 7 Aug, 2014, 12.29PM IST Even in sports, the privileged position of cricket and the corresponding neglect of almost every other sport is directly a product of our colonised past.

Tickle your funny-bone with Johny Lever Live and other gigs 20 Jun, 2014, 12.58PM IST Here are the top picks of food, art and culture in the city today

United Spirits to set up business review panel 2 May, 2011, 05.32AM IST United Spirits, the world's largest drinks maker by volume, will set up a four-member executive committee on Monday to review business performance and oversee new business initiatives.

Pricing uncertainty forces Uttar Pradesh sugar mills to shut down 20 Nov, 2013, 07.46AM IST Sugar mills have posted notices telling the farmers that they should look for alternatives to sell their cane crop as mills won’t be able to buy this sugar season.

Dance bar effect: Will Mumbai's nightlife regain its zing or cause social problems? 21 Jul, 2013, 07.06AM IST Only a few seasoned erstwhile patrons of these joints still living in Mumbai strike a discordant note.

Kishore Chhabria joins fray for 50% rights of disputed brandy brand Mansion House 22 Aug, 2014, 04.00AM IST This move will now pit Chhabria against Amit Dahanukar-led Tilaknagar Industries, which is the country’s 5th largest distiller.

Food festivals are hot new trend in the metros. But how viable is the business? 6 Dec, 2015, 03.10AM IST Why indeed has the revitalised mela become so popular? And what kind of business really does it make, for both organisers and participants?

Polls to boost liquor, sports utility vehicles & FMCG sectors 13 Mar, 2009, 04.44AM IST The spin-off effects of poll spending and post-election revelry could help businesses like liquor, auto and FMCG.","['mills', 'food', 'ministry', 'business', 'economic', 'review', 'anonymous', 'times', 'spirits', 'sugar', '20', 'updates', 'ist', 'alcoholics', 'set']","Food ministry seeks delay in ethanol blending plan 24 May, 2011, 03.04AM IST The food ministry is set to oppose the mandatory 5% ethanol blending programme, fearing diversion of foodgrain for manufacture of ethanol.
Pricing uncertainty forces Uttar Pradesh sugar mills to shut down 20 Nov, 2013, 07.46AM IST Sugar mills have posted notices telling the farmers that they should look for alternatives to sell their cane crop as mills won’t be able to buy this sugar season.
21 Jul, 2013, 07.06AM IST Only a few seasoned erstwhile patrons of these joints still living in Mumbai strike a discordant note.
6 Dec, 2015, 03.10AM IST Why indeed has the revitalised mela become so popular?
And what kind of business really does it make, for both organisers and participants?"
Inner Power,"The agnostics say they cant suddenly start believing in God, others who already believe say they have no faith left that He can perform a miracle for them.",,2014-06-17T05:50:00.000Z,"In a head-to-head evaluation of the Alcoholics Anonymous (AA) rehabilitation programme against two well-validated professionally developed psychotherapies , it was found that AA was just as effective. The well-known 12-step facilitation turned out to be as good as the best therapies professionals had. It also showed that their success rate was a decent 36%. But did they rely heavily on God to achieve this?For instance, point #2 of the AA’s 12-step charter for healing states, “Came to believe that a Power greater than ourselves could restore us to sanity.” But the moment newcomers read Step 2, they are confronted with a dilemma, often a serious one. The agnostics say they can’t suddenly start believing in God, others who already believe say they have no faith left that He can perform a miracle for them, and the atheists refuse to believe in Him. How does the AA respond?It rephrases the step as “recognising a higher power that can give strength”. It also dilutes the in-your-face impact by reiterating that when they speak of God, they mean our own conception of Him. This is apparently all that’s needed to begin the spiritual growth, and to effect our first conscious relation with God as we understand Him. That immediately shows a convenient way out for believers, agnostics and atheists alike.Like, who says that God or “higher power” has to be an external agency? Successful recovering alcoholics — which include a significant number of atheists — state that they simply started believing that such a power resided in their own deeper selves.","['power', 'say', 'step', 'aa', 'believe', 'alcoholics', 'believing', 'atheists', 'god', 'higher', 'inner']","In a head-to-head evaluation of the Alcoholics Anonymous (AA) rehabilitation programme against two well-validated professionally developed psychotherapies , it was found that AA was just as effective.
How does the AA respond?It rephrases the step as “recognising a higher power that can give strength”.
It also dilutes the in-your-face impact by reiterating that when they speak of God, they mean our own conception of Him.
That immediately shows a convenient way out for believers, agnostics and atheists alike.Like, who says that God or “higher power” has to be an external agency?
Successful recovering alcoholics — which include a significant number of atheists — state that they simply started believing that such a power resided in their own deeper selves."
Living to see another day,"What's so great about living for the day? Or for that matter, its various high-speed variants that urge us to exist in the here and now, the passing present, that urgent, ephemeral and apparently most-important ‘moment ? Stuff like “For the past is but a shadow.........",,2010-07-23T06:14:00.000Z,"What's so great about living for the day? Or for that matter, its various high-speed variants that urge us to exist in the here and now, the passing present, that urgent, ephemeral and apparently most-important ‘moment’ ? Stuff like “For the past is but a shadow and the future an unknown; therefore, voyager revel in the instant you transit through for ’tis the only thing you know” . (Yes, it’s made up, but you get the drift.)



The Bible says give us this day our daily bread — and not, for instance, our week’s supply. Buddhists tell us to take one breath at a time. The Gita’s advice is to concentrate on present action.



Alcoholics Anonymous, whose rules are similar — namely, to lay off the liquor only on a day-to-day basis — is at least understandable . Psychologists know there’s a neat therapeutic trick of reinforcement involved by means of which a person can reward himself with one brownie point on completion of each 24-hour period that passes without downing a drink.



Yet, when that same rule gets applied to everyone across all levels of living, it hardly makes sense. If all of us did that — which naturally would be the goal of such an exhortation — and took it literally, then we’d end up in monasteries, mountain-tops or in our own reclusive and absolute worlds.



There’s nothing intrinsically wrong in that, but if taken to its logical extreme, it would be like how most animals live: not for the day, not for the minute, not even for the moment because their lives are a mindless and biotic persistence that keeps traversing through infinitely thin slices of time till that fleeting instant also passes through them and they die.



So, if living one day at a time means don’t think about tomorrow or the next day and just live the now, it’s a no-brainer . Because unlike animals, we have an awareness that allows us to learn from past mistakes and anticipate possible futures and, therefore , why should we unnecessarily and suddenly renounce this added feature of our brains?



Also, what if all the enlightened people in our history had thought they should be living in the moment and not tomorrow, not next year; that they should be enjoying life today? If they had simply allowed their wisdom to lie fallow while wallowing in its bliss by themselves, would we have had some of our greatest religions today? No. It goes without saying they definitely lived for another day.","['means', 'passes', 'live', 'moment', 'day', 'tomorrow', 'living', 'past', 'present', 'today']","What's so great about living for the day?
The Bible says give us this day our daily bread — and not, for instance, our week’s supply.
Yet, when that same rule gets applied to everyone across all levels of living, it hardly makes sense.
So, if living one day at a time means don’t think about tomorrow or the next day and just live the now, it’s a no-brainer .
It goes without saying they definitely lived for another day."
Can NREGS become more effective if treated as a business?,"A school of thought has emerged that believes several social sector initiatives, if promoted as business enterprises, can have greater impact.",,2010-04-05T11:34:00.000Z,"Can Alcoholics Anonymous (AA) be turned into a profitable business venture? Or, can Mumbai-based Party Hard Drivers (PHD), the first company in the country to specialise in providing drivers by night so that people do not drink and drive, be called “social business’’?



As cathedrals of capitalism tottered on the brink of fiscal chaos following the Lehman collapse, high priests of socialism began pushing their ideology. Now, with the economy reviving, there are once again talks of fusion of the two “isms’’. There is a section of ideators that thinks several philanthropic efforts, if treated as “social business’’, can become profitable and have high welfare impact.



“Social business’ ’ is a term used by Nobel laureate and maestro of microfinance Muhammad Yunus to describe a commercial activity where businesses whose primary goal is to help the targeted group plough their entire profits back into their work rather than give dividends to shareholders. According to Yunus, a social business enterprise is created not to maximise profits, but with a declared mission to maximise benefits to the people served, without incurring losses.



It has become fashionable for some corporates to pontificate on corporate social responsibility (CSR), which social entrepreneurs call more of a PR exercise than a genuine effort to help the poor. As companies increase allocations for CSR activities and begin targeting the bottom of the pyramid, social business is gaining currency.



While addressing industry leaders in Mumbai recently, Yunus, who pioneered microfinancing, said: “We, as humankind, have multidimensions: We have selfless parts and we have a self-centred part. Most of the businesses today are focused on the self-centred part. It is all about me, it is all about my. The social business is all about you. The objective of social business is not to maximise profit, but to get maximum social benefits.’’



The founder of Bangladesh’s Grameen Bank also proposed setting up a separate stock exchange for the listing of social enterprises as one of the funding sources for such firms. “The social business is not charity as it can be run through raising funds from the stock market. In the Indian context, social business can be possible in a number of areas such as water, health, urban poverty, education and environment,’’ Yunus said.



There are some takers for Yunus’s proposal. Says Nishith Desai, founder of Nishith Desai Associates, a Mumbai-based international law firm, “If Alcoholics Anonymous (AA), for example , becomes part of the social business venture, raising funds and scaling up operations will not be a problem for it and it will turn into a profitable enterprise.’’ Desai said AA, if structured as a social business enterprise, could offer services under three slabs: some free of cost, some at lower rates and others at significantly higher rates. The “customers’ ’ of AA —the relatives of the persons using the services of AA—could invest in AA even as their kin gets rid of alcoholism, thereby making it financially viable. Likewise , Party Hard Drivers , too, can scale up operations , as part of the social business model.","['maximise', 'nregs', 'effective', 'business', 'yunus', 'aa', 'profitable', 'drivers', 'venture', 'treated', 'social', 'enterprise', 'desai']","Can Alcoholics Anonymous (AA) be turned into a profitable business venture?
There is a section of ideators that thinks several philanthropic efforts, if treated as “social business’’, can become profitable and have high welfare impact.
As companies increase allocations for CSR activities and begin targeting the bottom of the pyramid, social business is gaining currency.
“The social business is not charity as it can be run through raising funds from the stock market.
Likewise , Party Hard Drivers , too, can scale up operations , as part of the social business model."
A simple case of sorry and thanks,"Alcoholics Anonymous, the community that helps people to stay sober and help other alcoholics do the same has always known there is a spiritual dimension involved in its work.",,2006-11-07T00:10:00.000Z,"Alcoholics Anonymous, the community that helps people to stay sober and help other alcoholics do the same has always known there is a spiritual dimension involved in its work. Which is why a typical individual course for a newcomer often includes a ritual of prayer and/or meditation.



Which is also why a very important step in the AA’s 12-step recovery programme includes a directive to make a list of all persons a member may have harmed, and become willing to make amends to them all except when to do so would injure them or others. Recovering alcoholics find this step not only to be one of the hardest to carry out but also the most emotionally rewarding.



But are only overdue apologies for misdeeds enough to motivate oneself? Mihaly Csikszentmihalyi who garnered wide attention with his best-selling book, Flow: The Psychology of Optimal Experience and has emerged as one of the leading figures in the growing positive-psychology movement, thinks not.



He argues that the most rewarding individual happiness lies in the skilful performance of meaningful work that fully occupies one’s attention. That, indeed, showing overdue gratitude is also just as important.



He refers to an experiment called “gratitude intervention” where volunteers are assigned randomly to various “interventions” and their happiness is assessed before and after. In essence, they are asked to think about a person who was kind or helpful to them but who has never been thanked for it.



Then the volunteer is supposed to write a one-page letter of thanks, make an appointment with the target person, and read the letter in his or her presence. The volunteers who are randomly assigned to do this task show significant increase in happiness half a year after completing it. And although other interventions based on positive psychology experiments also show impressive results, this appears to be the most effective.



It’s interesting to note that both a delayed sorry and thanks, which are basically corrective measures compressing the passing of time between the original event and its proper closure, should make us feel good.



It must mean that we ourselves are essentially good — a quality we forget to remember more readily than not. In other words, we often don’t know why we’re not happy and carry on living, ignorant that a simple action could, in fact, elevate us.","['happiness', 'step', 'sorry', 'volunteers', 'simple', 'person', 'thanks', 'work', 'psychology', 'overdue', 'case', 'alcoholics', 'randomly']","Which is why a typical individual course for a newcomer often includes a ritual of prayer and/or meditation.
Recovering alcoholics find this step not only to be one of the hardest to carry out but also the most emotionally rewarding.
Then the volunteer is supposed to write a one-page letter of thanks, make an appointment with the target person, and read the letter in his or her presence.
The volunteers who are randomly assigned to do this task show significant increase in happiness half a year after completing it.
In other words, we often don’t know why we’re not happy and carry on living, ignorant that a simple action could, in fact, elevate us."
