Headlines,Descriptions,Authors,Published_Dates,Articles,Keywords,Summaries
"interventions: Latest News & Videos, Photos about interventions","interventions Latest Breaking News, Pictures, Videos, and Special Reports from The Economic Times. interventions  Blogs, Comments and Archive News on Economictimes.com",,None,"Tribal Eviction: No intervention or survey till June, says ministry of tribal affairs 9 Apr, 2019, 08.45AM IST The state govt had been provided with a format and asked to check how many forest dwellers did not have rightful claims and could face eviction.

Jet crisis: Suresh Prabhu rules out intervention in commercial matters of airline 3 Apr, 2019, 06.34PM IST Suresh Prabhu ruled out any interference, saying the govt should not be doing any deals to help an airline.

When ex-RBI governors get political, it impacts autonomy cause: FM Arun Jaitley 1 Apr, 2019, 10.50AM IST Finance minister Arun Jaitley asserted that when former RBI governors join political battles, they hurt the cause of RBI autonomy.

Congress in Karnataka urges President Kovind's intervention against ongoing I-T raids in the state 30 Mar, 2019, 12.25PM IST Rao claimed that several complaints were lodged to the Election Commission by JD(S) but no ""actions were taken or initiated"".

Congress approaches EC, seeks its intervention in removing hoardings of Modi govt at public places 15 Mar, 2019, 02.38PM IST The Congress demanded that the Election Commission issue directions for immediate removal of all such hoardings and also seek a compliance report in the matter.","['videos', 'tribal', 'rbi', 'apr', 'latest', 'govt', 'prabhu', '2019', 'intervention', 'interventions', 'ist', 'state', 'photos', 'suresh']","Tribal Eviction: No intervention or survey till June, says ministry of tribal affairs 9 Apr, 2019, 08.45AM IST The state govt had been provided with a format and asked to check how many forest dwellers did not have rightful claims and could face eviction.
Jet crisis: Suresh Prabhu rules out intervention in commercial matters of airline 3 Apr, 2019, 06.34PM IST Suresh Prabhu ruled out any interference, saying the govt should not be doing any deals to help an airline.
When ex-RBI governors get political, it impacts autonomy cause: FM Arun Jaitley 1 Apr, 2019, 10.50AM IST Finance minister Arun Jaitley asserted that when former RBI governors join political battles, they hurt the cause of RBI autonomy.
Congress in Karnataka urges President Kovind's intervention against ongoing I-T raids in the state 30 Mar, 2019, 12.25PM IST Rao claimed that several complaints were lodged to the Election Commission by JD(S) but no ""actions were taken or initiated"".
Congress approaches EC, seeks its intervention in removing hoardings of Modi govt at public places 15 Mar, 2019, 02.38PM IST The Congress demanded that the Election Commission issue directions for immediate removal of all such hoardings and also seek a compliance report in the matter."
Enforcers News and Updates from The Economic Times,Enforcers News and Updates from The Economictimes.com,,None,"Cash, booze and gold: India seizures surge compared to 2014 vote 15 Apr, 2019, 01.59PM IST India’s enforcement agencies are confiscating as much as one billion rupees in cash and goods each day.

View: EC needs more rope to get to the bottom of campaign spending 18 Apr, 2019, 10.05AM IST The Supreme Court’s order to political parties to disclose the buyers of electoral bonds by May 31 is small comfort for those seeking more transparency.

The Latest: Trump says migrants to go to 'sanctuary cities' 15 Apr, 2019, 10.04PM IST 12:30 p.m. President Donald Trump now says that his proposal to send migrants to so-called sanctuary cities is taking effect.

Supreme Court won't stop enforcement of bump stock ban 28 Mar, 2019, 10.15PM IST WASHINGTON (AP) — The Supreme Court on Thursday declined to stop the Trump administration from enforcing its ban on bump stock devices, which allow semi-automatic weapons to fire like machine guns. The ban took effect Tuesday.

Chinese nationals employed in CPEC accused of trafficking Pakistani women 15 Apr, 2019, 08.27PM IST Chinese traffickers are running centres across key Pakistani cities to trap women from economically backward families under the pretext of marriages, media reports have said.

Not only Mallya and Nirav, 36 businessmen fled from country in recent past, ED informs court 15 Apr, 2019, 07.02PM IST The Enforcement Directorate told special judge Arvind Kumar that 36 businessmen, including Vijay Mallya and Nirav Modi, have fled from the country in the recent past.

National security, terrorism most important issues facing India: Arun Jaitley 15 Apr, 2019, 05.57PM IST Arun Jaitley asserted that the biggest challenge before India is the issue of Jammu & Kashmir and terror as it concerns nation's sovereignty.

The Latest: Officials discuss range of immigration changes 16 Apr, 2019, 05.20AM IST 7:45 p.m. Top administration officials have been discussing ways to increase pressure on countries with high numbers of citizens who overstay their visas in the U.S.

Over 2 lakh seats to be added in varsities for 10 pc quota for poor in General category: Cabinet 15 Apr, 2019, 02.21PM IST The Union Cabinet chaired by Prime Minister Narendra Modi on Monday approved the provisions of reservations in admission for EWS students in Central Educational Institutions.

Enforcement Directorate argues for Robert Vadra’s custody in money-laundering case 26 Mar, 2019, 09.41AM IST The special court, meanwhile, extended Robert Vadra’s interim protection from arrest to Wednesday, when the ED is expected to submit evidence justifying its demand.

Enforcement Directorate files 1500-page charge sheet against Gautam Khaitan 25 Mar, 2019, 12.21PM IST The charge sheet against Khaitan was filed before Special CBI Judge Arvind Kumar under sections 3 and 4 of the Prevention of Money Laundering Act (PMLA).","['apr', 'economic', 'court', 'enforcers', 'trump', 'enforcement', '2019', 'special', 'times', '15', 'mar', 'updates', 'ist', 'india']","Cash, booze and gold: India seizures surge compared to 2014 vote 15 Apr, 2019, 01.59PM IST India’s enforcement agencies are confiscating as much as one billion rupees in cash and goods each day.
The Latest: Trump says migrants to go to 'sanctuary cities' 15 Apr, 2019, 10.04PM IST 12:30 p.m. President Donald Trump now says that his proposal to send migrants to so-called sanctuary cities is taking effect.
Chinese nationals employed in CPEC accused of trafficking Pakistani women 15 Apr, 2019, 08.27PM IST Chinese traffickers are running centres across key Pakistani cities to trap women from economically backward families under the pretext of marriages, media reports have said.
National security, terrorism most important issues facing India: Arun Jaitley 15 Apr, 2019, 05.57PM IST Arun Jaitley asserted that the biggest challenge before India is the issue of Jammu & Kashmir and terror as it concerns nation's sovereignty.
Enforcement Directorate argues for Robert Vadra’s custody in money-laundering case 26 Mar, 2019, 09.41AM IST The special court, meanwhile, extended Robert Vadra’s interim protection from arrest to Wednesday, when the ED is expected to submit evidence justifying its demand."
"Kekade is brand ambassador of mission safe food Pune, Retail News, ET Retail",The Food and Drugs Administration has roped in chef Shailendra Kekade as the brand ambassador for its initiative - 'mission safe food Pune'.,www.ETRetail.com,None,"PUNE: The Food and Drugs Administration has roped in chef Shailendra Kekade as the brand ambassador for its initiative - 'mission safe food Pune'.""This will help boost the mission. The brand ambassador will help us reach all the segments of people who are residing in Pune whom we are targetting to make this mission successful,"" said Shashikant Kekare, joint commissioner (food), FDA , Pune division.Kekade who runs a food show on a channel said, ""The responsibility given to me by FDA is very huge and challenging. As a Puneite, I will make sure that I don't leave any stone unturned to make sure that the mission hits the right target.""Assistant commissioners (food) Dilip Sangat, Sanjay Naragude, Shivkumar Kodgire and Sanee Awsarmmel, chairman of Indian Hospitality Ventures and Gurvinder Bindra , chairman, Bindra's Hospitality were present at the announcement function.The Food and Drugs Administration (FDA) has rolled out an ambitious food safety plan in the city to set an example in entire Maharashtra regarding food safety and hygiene.Under this plan, the FDA in association with reputed catering firms will initiate mass training and orientation in food handling and hygiene practices which will be imparted to all restaurants owners, kitchen operators from various hotels and basic food cart owners.","['mission', 'food', 'plan', 'brand', 'owners', 'fda', 'help', 'et', 'sure', 'safe', 'kekade', 'hospitality', 'pune', 'ambassador', 'safety', 'retail']","PUNE: The Food and Drugs Administration has roped in chef Shailendra Kekade as the brand ambassador for its initiative - 'mission safe food Pune'.
""This will help boost the mission.
The brand ambassador will help us reach all the segments of people who are residing in Pune whom we are targetting to make this mission successful,"" said Shashikant Kekare, joint commissioner (food), FDA , Pune division.Kekade who runs a food show on a channel said, ""The responsibility given to me by FDA is very huge and challenging.
As a Puneite, I will make sure that I don't leave any stone unturned to make sure that the mission hits the right target.
""Assistant commissioners (food) Dilip Sangat, Sanjay Naragude, Shivkumar Kodgire and Sanee Awsarmmel, chairman of Indian Hospitality Ventures and Gurvinder Bindra , chairman, Bindra's Hospitality were present at the announcement function.The Food and Drugs Administration (FDA) has rolled out an ambitious food safety plan in the city to set an example in entire Maharashtra regarding food safety and hygiene.Under this plan, the FDA in association with reputed catering firms will initiate mass training and orientation in food handling and hygiene practices which will be imparted to all restaurants owners, kitchen operators from various hotels and basic food cart owners."
