Headlines,Descriptions,Authors,Published_Dates,Articles,Keywords,Summaries
"Go cold turkey, for god’s sake!",A friend who attended a workshop of Overeaters Anonymous says it is possible for any ravenous soul to eat much less than he or she usually does.,,2010-09-30T07:50:00.000Z,"A friend who attended a workshop of Overeaters Anonymous says it is possible for any ravenous soul to eat much less than he or she usually does. “Even for you,” he said, “and the break really helps.”Well, in this world, there are rehab clinics and therapy centres with both ordinary and fancy names to wean you or anyone away from anything and everything irrespective of age and addiction. They are for everybody, from sweettoothed 75-plus-year-olds to 40-ish alcoholics to teenaged brownsugar addicts to Facebook-crazy primary schoolchildren.The idea of such we-help-you-livebetter entities is to help you take a recess amid excesses in the hope that it helps you stay in control of your work and life in the long run. It is true that all this rehab business has been on for a long time now, but it never goes out of fashion for obvious reasons.One expression that is in sync with changing realities and times is the immensely likeable “going cold turkey” . Which means if you are addicted to heroin , instead of confessing you want to go to a rehab unit, you could say, “I want to go heroin cold turkey” . School kids could proudly declare, “We plan to go social media cold turkey” if they wish to keep off keyboard or mouse or smart phones for three-four days or even a week.The fact is cold turkey is no longer associated with food, drinks, drugs, sex and related things alone. You could go “work cold turkey” , and detoxify your officeclouded mind, unwind, recharge your live-positive batteries, stabilise blood pressure and return, cleansed! In fact, companies and governments must insist that their employees go work cold turkey once in a while, especially immediately after intense bouts of hard work.Going cold turkey for religious reasons is as old as religions or maybe, older. In fact, religious prohibitions may have helped people preserve their faith, identity and health. Research shows that any religious ban or temporary refrain on consumption and action has practical considerations as well. Our prophets seemed to have taken into account everything from weather to hygiene to welfare of their people before writing edicts on dos and don’ts . Since the time we started recording history, physicians across faiths have advised fasting as a therapy to feel better and look better.Another friend who attended a Vipassana course near Delhi rightly pointed out that going cold turkey is possible without even realising it. Of course, there are myriad ways to distract oneself and go cold turkey. Politicians contesting elections do that. A hard day’s night gets a new meaning in poll campaigning which, ironically, is one of the many ways our politicians keep fit.To be sure, going cold turkey or being forced to do that is as old as the human race. Later when kingdoms emerged, brothers asked brothers to go kingdom cold turkey. The list of examples is endless even in regimes that had no emperors. Comrade Mao Zedong himself had forced Deng Xiaoping to go politics cold turkey and banished him to China’s hinterland.To cut a long story short, one should not feel that going cold turkey, of one’s own volition or by force, is always bad. When people in democracies vote unpopular governments out of power, what they do is to push their governments to go government cold turkey. It is good to go cold turkey despite the risk of delirium tremens and irrespective of whether the case is of overwork or drug addiction or political one-upmanship or inefficiency.One constantly feels that some people must go profession cold turkey. A few names that crop up are of V S Naipaul who should be told to go writing cold turkey; Nicholas Sarkozy who should be asked to go politics cold turkey and Malayalam film stars Mohan Lal and Mammooty who should go acting cold turkey. Oh! How could one miss him? Will someone advise Suresh Kalmadi to go sports management cold turkey, please?","['going', 'religious', 'writing', 'gods', 'turkey', 'rehab', 'governments', 'cold', 'work', 'long', 'sake', 'fact']","You could go “work cold turkey” , and detoxify your officeclouded mind, unwind, recharge your live-positive batteries, stabilise blood pressure and return, cleansed!
Comrade Mao Zedong himself had forced Deng Xiaoping to go politics cold turkey and banished him to China’s hinterland.To cut a long story short, one should not feel that going cold turkey, of one’s own volition or by force, is always bad.
It is good to go cold turkey despite the risk of delirium tremens and irrespective of whether the case is of overwork or drug addiction or political one-upmanship or inefficiency.One constantly feels that some people must go profession cold turkey.
A few names that crop up are of V S Naipaul who should be told to go writing cold turkey; Nicholas Sarkozy who should be asked to go politics cold turkey and Malayalam film stars Mohan Lal and Mammooty who should go acting cold turkey.
Will someone advise Suresh Kalmadi to go sports management cold turkey, please?"
No way or the highway,"Sitting here, in an undisclosed location 502 metres away from a National Highway that wishes to remain anonymous, I want to have what Justices Jagdish Singh Kehar, Dhanandjaya Y Chandrachud and L Nageswara Rao were...",,"April 16, 2017","Sitting here, in an undisclosed location 502 metres away from a National Highway that wishes to remain anonymous, I want to have what Justices Jagdish Singh Kehar, Dhanandjaya Y Chandrachud and L Nageswara Rao were having when, on December 15, 2016, they passed the Supreme Court order prohibiting the sale of alcohol within 500 m of national and state highways.

The other alternative would be to drink myself blotto while trying to understand, with all the sincerity I can muster on Easter, the significance of having 500 m as the Lakshman rekha for imbibing the unholy stuff. What happens within this mysterious radius? Or, rather, since this is all about preventing bad stuff from happening, what will now no longer happen within this charmed circle?

The venerable Supreme Court, responding to a petition seeking the ban, has even used the reasoning of doing what the Centre had prepared in a ‘policy for alcoholic beverages and alcohol’ to dodge the bullet of ‘judicial overreach’. But that un-policied policy had mentioned turning spaces within 100 m from a state or national highway into a mini-Gujarat-Bihar. And as world record-holders Usain Bolt and David Rudisha know well, 500 m and 100 m have a 400 m farak.

The judges passed the order — after much earlier passing the bar — to ostensibly clamp down on drunken driving and minimise highway accidents, for which suitably numbers, damned numbers and statistics were duly trotted to make every child sleep in this post-Gabbar world.

I can only imagine the brain-movie that must have run through the venerable justices’ heads: A man procuring a bottle of the nasty stuff from a thek 323 m away from a highway. Glug-glugging half the bottle and returning to the car which he had been driving stone sober earlier. Now drunk, tyres a-squeal he sets out into the night, swerving and a potential roadrunner of a criminal driving into a tragedy.

The fact that a person behind a wheel need not have been denied a drink or two or four from a source that isn’t a liquor shop near a highway may have eluded the sober heads of justice. Perhaps, having a thek or a bar 500 m away from the car, rather than from a highway, would have been more logical. For, a 500 m walk can, indeed, do wonderful stuff to clear one’s head that a 100 m Keshto Mukherjee-inspired jaunt can only dream of.

The earlier court order was modified in a March 31 order that lowered the threshold from 500 m to 220 m for towns of fewer than 20,000 people. One supposes that there are less people or black buck a drunken driver who is not a Bollywood star can mow down in these places. This also gives a gentle nudge in favour of family planning, I reckon.

But a Patiala peg measure of confusion is poured down my hatch when I hear that the court has exempted Meghalaya and Sikkim from the ban, since that would have meant more than 90% of shops would have to be shut down. The message I am getting in this exemption is that if Pune, with 17 state highways passing through the city, had 175,800 liquor permit holders instead of the 1,758 that it really has, Pune — and who knows, maybe Maharashtra as a whole — would also have been exempted having ‘livelihoods at stake’.

Instead of planning to lay off many of their staff, standalone hotel and restaurant-owners affected by the highway booze ban should actually go on a hiring spree. That would put more livelihoods in jeopardy, and even the cold heart of justice will then hear — as it did from Meghalaya and Sikkim — plaintive sitar strains that always signify hardships in Hindi movies.

But what I still can’t get my not-yet-spinning head around is the mystery of the petitioner, Harman Sidhu, a man a year older than I am, so hopefully someone I should be able to understand. Sidhu has been wheelchair-bound since a road accident in 1996.

Was he hit by a drunken motorist? No. Was he a drunken driver himself who paid the price of driving under the influence? Nyet.

Sidhu was reportedly in a car with two friends returning to Chandigarh from Himachal Pradesh and sitting in the back seat when the three friends spotted a leopard. They decided to “drive off road” to see if they could catch it again. But the car fell into a gorge. In his own words, there is no mention of drinking.

Er, so why does the highway theka or hotel bar or liquor shop get the rap? Call it the majesty of justice akin to banning smoking, because even though the fire was caused by faulty wiring, it’s still about wanting you to quit smoking for your own good. A little dodgy logic can be forgiven when the cause is good. So what if this also means the breathalyser industry also taking a hit. And there being no need any longer in many stretches of this land of ours for a policeman to tell you to breathe into his face. Such awkwardness will be now avoided.

Dear god, let me get a drink 501 m away from this highway, which I hope will very soon, inspired by the West Bengal government, be denotified and turned into an ‘arterial road’. Cheers.","['car', 'court', 'drunken', 'm', 'highway', 'way', 'stuff', 'having', 'driving', 'order', '500']","But that un-policied policy had mentioned turning spaces within 100 m from a state or national highway into a mini-Gujarat-Bihar.
And as world record-holders Usain Bolt and David Rudisha know well, 500 m and 100 m have a 400 m farak.
Perhaps, having a thek or a bar 500 m away from the car, rather than from a highway, would have been more logical.
The earlier court order was modified in a March 31 order that lowered the threshold from 500 m to 220 m for towns of fewer than 20,000 people.
Er, so why does the highway theka or hotel bar or liquor shop get the rap?"
Here's what make 12 number special as we enter 2012,"Its a number like any other. Yet, twelve has interesting references and significance in fields as diverse as mythology, astrology, astronomy and sports.",,2012-01-01T03:07:00.000Z,"It’s a number like any other. Yet, twelve has interesting references and significance in fields as diverse as mythology, astrology, astronomy and sports. As we enter 2012, read on what makes 12 so special.



The Ancients Loved It...



1. Greek mythology has it that 12 Olympians — gods who live atop Mount Olympus — are the principal deities of the Greek pantheon. Zeus is the king of the gods.



2. Heracles, the Greek mythological hero, was given 12 impossible tasks to complete. The 12th task was capturing a multi-headed hound called Cerberus.



3. According to followers of Shia Islam, prophet Muhammad had 12 successors known as Imams. Shia Islam followers believe that the 12th and final Imam, Muhammad al Mahdi, will rise and restore order in the world.



4. In Christian mythology the number keeps turning up. Jesus had 12 apostles, including Judas Iscariot. When Judas betrays Jesus and commits suicide, Matthias becomes the 12th apostle.



5. The Purna Kumbh Mela takes place once in twelve years. The Maha Kumbh comes after 12 Purna Kumbhs and is held once every 144 years. The last Purna Kumbh Mela was in 2001. 60 million people landed up, making it the largest human gathering ever.



So Much So that Our Traditions Revolve Around Them Even Today...







1. Christmas is celebrated across 12 days beginning Christmas Day (December 25).



2. Bar Mitzvah — a coming of age festival of the Jews — is observed when a girl turns 12. For a boy, it’s observed on his 13th birthday.



3. Cubans bring in the New Year by eating 12 grapes — each for a month gone by — at the stroke of midnight. The custom is supposed to bring luck.



Our Bodies Like the Number...



1. The human body has 12 pairs of ribs.



2. Humans also have 12 pairs of cranial nerves.



3. The average man has 12 pints of blood. Women have 9 pints.



So Do Star Gazers...



12 men have walked on the moon till date. Most of the world today uses the decimal system — we count things in multiples of 10. That probably comes from the fact that we have 10 fingers.



However, ancient Egyptians did not count with their fingers. Instead, they chose to count with the joints on their fingers (excluding the thumb). That’s 12 clicks per hand.



That’s perhaps why we started measuring time in units of 12 — 12 hours for half a day and 24 hours for a day. Ancient Indian astronomers too divided time into 12 halves between sunrise and sunset. The choice of 12 is attributed to the 12 lunar cycles in a year.



...And Astrologers



Both Chinese and western zodiacs have 12 signs. The Chinese zodiac is divided by years and not months, unlike the western zodiac. For example, the period between January 23, 2012 and February 9, 2013 is called the year of the dragon.","['count', 'enter', 'western', 'number', 'day', 'greek', '12', 'heres', 'purna', 'special', 'kumbh', 'mythology', '12th', 'zodiac']","As we enter 2012, read on what makes 12 so special.
Greek mythology has it that 12 Olympians — gods who live atop Mount Olympus — are the principal deities of the Greek pantheon.
The Maha Kumbh comes after 12 Purna Kumbhs and is held once every 144 years.
That’s perhaps why we started measuring time in units of 12 — 12 hours for half a day and 24 hours for a day.
The Chinese zodiac is divided by years and not months, unlike the western zodiac."
Correction begins with admission,"Tiger Woods has now ‘rediscovered his childhood religion. The championgolfer , who faced censure for his alleged extra-marital liaisons, said he hoped to relearn the lesson of selfrestraint taught by Buddhism. His statement had been analysed “like a State of Union address......",,2010-02-24T05:00:00.000Z,"Tiger Woods has now ‘rediscovered’ his childhood religion. The championgolfer , who faced censure for his alleged extra-marital liaisons, said he hoped to relearn the lesson of selfrestraint taught by Buddhism. His statement had been analysed “like a State of Union address even though the only union Tiger Woods addressed was his own” , a sympathetic columnist said, “( for) this was no voluntary conversion to an old religion. Rather , this was a forced one to the new Oprahite religion of emotional openness and making public one’s miseries and failings.”



Newspersons who asked the Dalai Lama to comment discovered that the Tibetan spiritual leader was blissfully unaware of Tiger Woods’ travails, having somehow been uninformed of the golfer’s triumphs as well. When the matter was explained to him, the exiled Tibetan Buddhist extolled the importance of ‘self-discipline with awareness of consequences’ .



The embattled golf champion himself said as much in his carefully scripted statement of apology: in recent years he had ‘drifted away’ from the Buddhist values of his upbringing which taught that “a craving for things outside ourselves causes unhappy and pointless search for security” .



But would that satisfy the scolds berating Woods for letting his impulses get the better of him? As his former coach, Butch Harmon , said, “( They) want Woods to stand there in front of everybody , take his medicine, be humble , be embarrassed, be humiliated , and answer the questions.”



His self-lacerating public apology could also be part of the famous 12-step plan for recovering from addictions, compulsions and other behavioural problems. The process starts with the admission that one is powerless against the demons of addiction and compulsion . One then moves on to admit “a greater power that can give strength” .



One way of achieving this, as encoded by the next step, is by establishing cosmic connections: make a decision to turn our will and our lives over to the care of God as we understand Him, says the original Alcoholics Anonymous programme . In its summation, the Bhagavad Gita calls it the supreme secret of transcendence (psychologists might call it ‘transference’ ) which promises to empower the seeker to withstand most severe soul-crushing pressures . But what if one has no faith in redemption? Then beg, borrow or steal some!","['begins', 'public', 'buddhist', 'correction', 'union', 'religion', 'woods', 'admission', 'tibetan', 'statement', 'taught', 'tiger', 'apology']","Tiger Woods has now ‘rediscovered’ his childhood religion.
The championgolfer , who faced censure for his alleged extra-marital liaisons, said he hoped to relearn the lesson of selfrestraint taught by Buddhism.
His statement had been analysed “like a State of Union address even though the only union Tiger Woods addressed was his own” , a sympathetic columnist said, “( for) this was no voluntary conversion to an old religion.
When the matter was explained to him, the exiled Tibetan Buddhist extolled the importance of ‘self-discipline with awareness of consequences’ .
The process starts with the admission that one is powerless against the demons of addiction and compulsion ."
"Page 2098 : Economic Times Blog: News Blogs, Business Articles & Opinions","Page 2098 : Browse through Business Blogs, News, Articles, Expert Opinions & more on Economic Times Blog. Find news blogs on markets, stocks, wealth, mutual fund & more.",,None,"Another story by Priyadarshan with a good-for-nothing protagonist being proud of doing nothing, his only complaint being he is hit by anyone and everyone. The humor shall be added this once by a very hungry…","['shall', 'economic', 'articles', 'page', 'times', 'humor', 'business', 'hit', 'opinions', 'hungry', 'priyadarshan', 'blog', 'proud', 'protagonist', 'complaint', '2098', 'goodfornothing', 'doing', 'blogs']","Another story by Priyadarshan with a good-for-nothing protagonist being proud of doing nothing, his only complaint being he is hit by anyone and everyone.
The humor shall be added this once by a very hungry…"
"Page 2083 : Economic Times Blog: News Blogs, Business Articles & Opinions","Page 2083 : Browse through Business Blogs, News, Articles, Expert Opinions & more on Economic Times Blog. Find news blogs on markets, stocks, wealth, mutual fund & more.",,None,"If you’re 27 and reading this, and you think it doesn’t apply to you, do a double take. Your skin has begun aging. What you do right now (male or female) will ensure how much…","['economic', 'articles', 'female', 'page', 'doesnt', 'times', 'business', 'youre', 'think', 'ensure', 'opinions', '2083', 'blog', 'skin', 'reading', 'right', 'male', 'blogs', 'double']","If you’re 27 and reading this, and you think it doesn’t apply to you, do a double take.
Your skin has begun aging.
What you do right now (male or female) will ensure how much…"
Page 1362 : India Blog,"Page 1362 : Browse through India Blogs, News, Articles, Expert Opinions & more on Economic Times Blog. Find latest news and articles on India.",,None,"She wakes up around 5.45 in the morning. She normally requires an alarm to wake her up, because 6 hours of sleep is all that she can hope to get and that isn’t really adequate. …","['blog', 'morning', 'hours', 'hope', 'requires', 'wake', 'normally', 'page', '1362', 'isnt', 'sleep', 'india', 'really', 'wakes']","She wakes up around 5.45 in the morning.
She normally requires an alarm to wake her up, because 6 hours of sleep is all that she can hope to get and that isn’t really adequate."
Age at first drink linked to binge drinking risk,"An early age of onset of drinking is a risk factor for subsequent heavy drinking and negative outcomes, scientists found.",,2014-09-24T19:15:00.000Z,"WASHINGTON: Teenagers who have their first drink at an early age are more likely to become a binge drinker or even an alcoholic, a new study has warned.An early age of onset of drinking is a risk factor for subsequent heavy drinking and negative outcomes, scientists found.The study found that starting to use alcohol at an early age and quickly progressing to drinking to intoxication jointly are related to underage alcohol use and binge drinking.Meghan E Morean, assistant professor of psychology at Oberlin College Ohio and adjunct assistant professor of psychiatry at Yale School of Medicine asked 295 adolescent drinkers (163 females, 132 males) who were predominantly Caucasian with an average age of 16 years to complete an anonymous survey about their substance use in February of 2010.These self-report questions assessed AO and age at first intoxication - for example, ""How old were you the first time you tried alcohol/got drunk?"" - as well as the previous month's consumption of alcohol, including an assessment of the frequency of engaging in binge drinking (defined as more than 5 drinks).""Our research suggests that teenagers who have their first drink at an early age drink more heavily, on average, than those who start drinking later on,"" said Morean.""Our work also suggests that how quickly teenagers move from having their first drink to getting drunk for the first time is an important piece of the puzzle.""In total, having your first drink at a young age and quickly moving to drinking to the point of getting drunk are associated with underage alcohol use and binge drinking, which we defined as five or more drinks on an occasion in this study.""To summarise, we would expect a teenager who had his first drink at age 14, and who got drunk at 15, to be a heavier drinker than a teenager who had his first drink at age 14, and waited to get drunk until age 18,"" Morean said.""The key finding here is that both age of first use and delay from first use to first intoxication serve as risk factors for heavy drinking in adolescence,"" added William R Corbin, associate professor and director of clinical training in the department of psychology at Arizona State University The research appears in Alcoholism : Clinical & Experimental Research.","['drink', 'teenagers', 'age', 'drinking', 'risk', 'linked', 'drunk', 'alcohol', 'research', 'quickly', 'early', 'binge']","- as well as the previous month's consumption of alcohol, including an assessment of the frequency of engaging in binge drinking (defined as more than 5 drinks).
""Our research suggests that teenagers who have their first drink at an early age drink more heavily, on average, than those who start drinking later on,"" said Morean.
""Our work also suggests that how quickly teenagers move from having their first drink to getting drunk for the first time is an important piece of the puzzle.
""In total, having your first drink at a young age and quickly moving to drinking to the point of getting drunk are associated with underage alcohol use and binge drinking, which we defined as five or more drinks on an occasion in this study.
""To summarise, we would expect a teenager who had his first drink at age 14, and who got drunk at 15, to be a heavier drinker than a teenager who had his first drink at age 14, and waited to get drunk until age 18,"" Morean said."
"Page 2060 : Economic Times Blog: News Blogs, Business Articles & Opinions","Page 2060 : Browse through Business Blogs, News, Articles, Expert Opinions & more on Economic Times Blog. Find news blogs on markets, stocks, wealth, mutual fund & more.",,None,"Knowledge Management is a bi**h. Nobody knows what it is or what it does but everyone has an opinion on it. Just as someone drinking lassi, imagines himself or herself to be more of an…","['blog', 'opinion', 'business', 'economic', 'articles', 'bih', 'drinking', 'opinions', 'management', 'knowledge', 'page', 'times', 'does', 'imagines', '2060', 'blogs', 'lassi', 'knows']","Knowledge Management is a bi**h. Nobody knows what it is or what it does but everyone has an opinion on it.
Just as someone drinking lassi, imagines himself or herself to be more of an…"
Page 1307 : India Blog,"Page 1307 : Browse through India Blogs, News, Articles, Expert Opinions & more on Economic Times Blog. Find latest news and articles on India.",,None,"It has been three years since the Right of Children to Free and Compulsory Education Act, better known as the Right to Education Act, came into force. And the same questions of the past occupy…","['blog', '1307', 'force', 'occupy', 'right', 'questions', 'known', 'free', 'page', 'act', 'past', 'education', 'compulsory', 'india']","It has been three years since the Right of Children to Free and Compulsory Education Act, better known as the Right to Education Act, came into force.
And the same questions of the past occupy…"
