Headlines,Descriptions,Authors,Published_Dates,Articles,Keywords,Summaries
"Diageo would take 30 years to build United Spirits' network: Samar Singh Sheikhawat, United Breweries",It would take Diageo 30 years to build United Spirits' network,,2013-01-06T05:49:00.000Z,"The average price of a Kingfisher quart (large bottle) is Rs 100. Today, one can buy 100 things that cost Rs 100. A tube of Colgate Total — the largest one — is over Rs 100. Farm-fresh eggs today cost more than Rs 5, or Rs 60 for a dozen. Petrol is close to Rs 80 a litre. So in that context, for a discerning target audience, a Rs 100 price point is not the reason that they will not buy a Heineken.They will not buy because of the taste. In five-star hotels, no one questions prices because ambience, decor and hopefully service justify the pricing. But when a normal restaurant charges the same, a person will complain. In Heineken’s case, a customer pays for the best packaging, the most widely sold international premium mild beer brand and a huge history of 137 years. Our stated preference is to dominate all price points in all geographies.Well, I don’t know if they will bring Guinness. The spirits business is different from the beer business. We have no connection with the two. They all happen to be owned by the same business house. We do sponsorships together. Typically, their seasonality is totally different from ours. If our sales decline during the cold months, their consumption rises. The prices are different.Also, beer from the perspective of alcohol delivery is far more expensive than spirits. A bottle of whisky — a reasonably decent brand — will cost Rs 100 for 180 ml, which contains 40% pure alcohol. That is 72 ml of alcohol for Rs 100, or 1 rupee and 33 paise for 1 ml of alcohol. In beer, 650 ml of Kingfisher Premium contains 4% alcohol. That is 27 ml of alcohol for Rs 100 — exactly the opposite of spirits. In India, people drink to get smashed. No other reason. If that is the objective, it is far cheaper and far quicker to get a buzz on spirits than on beer. Which is why revenue-wise, the spirits business is much larger than the beer industry.Volume-wise, we (UBL) are actually slightly larger than USL — in 2011, we sold 135 million cases while they sold a little lesser. But our revenues were about Rs 3,500 crore compared with their Rs 8,000 crore because the unit price of a case of spirits is far higher than that of a case of beer. So a young boy starting to drink finds it far easier and cheaper to get smashed on a bottle of 180 ml of whisky than 650 ml of beer.I can’t comment. It is too early to tell what the product portfolio of Diageo will be or how the organisational structure will pan out.Have you tasted Guinness? My theory is that it will not work in India. First, it is served at room temperature. Second, it is black. Third, it has a fruity coffee kind of taste. Indians like their beer cold. The per capita consumption of beer today in India is 1.6 litres per person per year. That is next to nothing. Now where the beer market is so small and nascent, a niche beer will take 50 years to change the scenario.You have these microbreweries and beer clubs, which are all full but none is making money. There will be a couple of 1,000 people in every city who will like to drink specially brewed beer, but the overwhelming majority prefers regular beer. Haywards had launched Haywards Black, which was something like a stout. Bombed miserably.Not necessary. For instance, just hypothetically, what if it were decided that Guinness will be distributed through the UBL network? We don’t have a Guinness kind of product in our portfolio. If we believe that there is a market for it, the best way to market is through UBL and not USL.","['network', '30', 'price', 'samar', 'build', 'breweries', 'alcohol', 'sheikhawat', 'ml', 'far', 'business', '100', 'rs', 'united', 'spirits', 'diageo', 'guinness', 'singh', 'beer']","Today, one can buy 100 things that cost Rs 100.
A tube of Colgate Total — the largest one — is over Rs 100.
So in that context, for a discerning target audience, a Rs 100 price point is not the reason that they will not buy a Heineken.They will not buy because of the taste.
The spirits business is different from the beer business.
That is 72 ml of alcohol for Rs 100, or 1 rupee and 33 paise for 1 ml of alcohol."
Govt to move SC against Salman's acquittal : Pleader tells HC,Bollywood super star Salman Khan may face fresh trouble with the Maharashtra Government today informing the Bombay High Court of its decision to challenge in the Supreme Court.,,2015-12-23T19:58:00.000Z,"MUMBAI: Bollywood super star Salman Khan may face fresh trouble with the Maharashtra Government today informing the Bombay High Court of its decision to challenge in the Supreme Court the verdict acquitting him of all charges in the 2002 hit-and-run case.



The Government told the High Court that a Special Leave Petition (SLP) will be moved in the apex court against the December 10 verdict of Justice A R Joshi, who overturned the sessions court judgement that held Salman guilty and sentenced him to five years' imprisonment.



Government Pleader Abhinandan Vagyani informed a bench that the Law and Judiciary department had accorded sanction to file a SLP in the Supreme Court challenging the High Court verdict which had acquitted Salman, ruling that shoddy investigations were conducted by police in the case.



The SLP would be filed in due course, the pleader said during a hearing of a public interest litigation filed by journalist Nikhil Wagle, seeking compensation from Salman for the victims of the 2002 hit-and-run case.



Though the actor had deposited compensation almost a decade ago for the families of victims as directed by the HC, Wagle's petition is still being heard as the court expanded its scope to include the issues of enhancement of punishment in drink driving cases and forensic procedures adopted by the authorities to determine consumption of alcohol by accused.



On May 6, a sessions court had sentenced the actor to five years jail after it held him guilty of offences including culpable homicide not amounting to murder. Aggrieved, he filed an appeal in HC which acquitted him.



According to the prosecution, on September 28, 2002, Salman had rammed his car into a bakery in suburban Bandra, killing one person and injuring four others who were sleeping outside.



The case had generated a great deal of public interest in drink driving cases.



The PIL filed by Nikhil Wagle also raised issues about enhancing the punishment prescribed in law in such cases resulting in Union Government informing the HC last week that it was mulling to amend laws to increase punishment so that it can serve as deterrent.



Meanwhile, some social activists and legal experts welcomed the Government decision to move the Supreme Court to challenge the HC verdict.



Former DGP D Sivanandan termed this decision as ""one in tandem with the public perception."" He said there were many samaritans who wanted justice for the person who died in the mishap and also for late Ravindra Patil, police constable and bodyguard of Salman who had implicated the actor in the case.



Lawyer and human Rights Activist Abha Singh, who raised several questions during the trial on behalf of an intervenor in the case, said ""this decision of the state to appeal in Supreme Court will certainly clear the conflicting issues and ensure that justice is done in this case.","['salmans', 'decision', 'public', 'hc', 'filed', 'court', 'pleader', 'govt', 'punishment', 'supreme', 'sc', 'slp', 'salman', 'acquittal', 'tells', 'verdict']","Government Pleader Abhinandan Vagyani informed a bench that the Law and Judiciary department had accorded sanction to file a SLP in the Supreme Court challenging the High Court verdict which had acquitted Salman, ruling that shoddy investigations were conducted by police in the case.
Aggrieved, he filed an appeal in HC which acquitted him.
The case had generated a great deal of public interest in drink driving cases.
Meanwhile, some social activists and legal experts welcomed the Government decision to move the Supreme Court to challenge the HC verdict.
Former DGP D Sivanandan termed this decision as ""one in tandem with the public perception."""
"Travis Kalanick: The fall of Travis Kalanick was a lot weirder and darker than you thought, Auto News, ET Auto","A common factor in all crises was Kalanick’s unrelenting combativeness. Over time, he turned a lot of friends into enemies with stories to tell.",www.ETAuto.com,None,"A year ago, before the investor lawsuits and the federal investigations, before the mass resignations, and before the connotation of the word “ Uber ” shifted from “world’s most valuable startup” to “world’s most dysfunctional,” Uber’s executives sat around a hotel conference room table in San Francisco , trying to convince their chief executive officer, Travis Kalanick , that the company had a major problem: him.The executives were armed that day with something unusual for Uber Technologies Inc.: the results of a survey. Kalanick operated by gut feeling and with a stubborn sense of how people should feel, not how they did. Jeff Jones, Uber’s new president and former chief marketing officer for Target Corp. , wanted more substantial insights. As usual with Kalanick, the discussion grew contentious. Jones and his deputies argued that Uber’s riders and drivers viewed the company as made up of a bunch of greedy, self-centered jerks. And as usual, Kalanick retorted that the company had a public-relations problem, not a cultural one.Then a top executive excused herself to answer a phone call. A minute later, she reappeared and asked Kalanick to step into the hallway. Another executive joined them. They hunched over a laptop to watch a video that had just been posted online by Bloomberg News: grainy, black-and-white dashcam footage of Kalanick in the back seat of an UberBlack on Super Bowl weekend, heatedly arguing over fares with a driver named Fawzi Kamel.“Some people don’t like to take responsibility for their own shit!” Kalanick can be heard yelling at Kamel. “They blame everything in their life on somebody else!”As the clip ended, the three stood in stunned silence. Kalanick seemed to understand that his behavior required some form of contrition. According to a person who was there, he literally got down on his hands and knees and began squirming on the floor. “This is bad,” he muttered. “I’m terrible.”Then, contrition period over, he got up, called a board member, demanded a new PR strategy, and embarked on a yearlong starring role as the villain who gets his comeuppance in the most gripping startup drama since the dot-com bubble. It’s a story that, until now, has never been fully told.On Jan. 27 the newly inaugurated president issued his executive order imposing border restrictions on people from seven Muslim countries. Outrage erupted. People took to the streets; tech workers in Silicon Valley walked out of their offices in symbolic protest. And in New York, a small union called the New York Taxi Workers Alliance declared that there would be no taxi pickups from 6 pm to 7 pm on Saturday night at John F. Kennedy International Airport.For Uber, that would create extra demand at the airport, which meant it could charge more—but this would probably cause a backlash. So the New York managers decided to be good citizens and suspend surge pricing for the night. The backlash hit anyway. After years of negative revelations—spying on passengers, dubious driverless-car experiments in San Francisco, the CEO’s bragging about sexual conquests, to name just a few—the public was already inclined to believe the worst of Uber.Lyft Inc., the rival service that branded itself the anti-Uber, capitalized on the moment and donated $1 million to the American Civil Liberties Union.Further stoking the flames was Kalanick’s decision to join Trump’s business advisory council. Kalanick argued that his participation in the council wasn’t an endorsement of the president; he just wanted a seat at the table, along with Elon Musk, International Business Machines Corp.’s Ginni Rometty, and Walt Disney Co.’s Bob Iger. Ultimately, Kalanick decided the whole thing wasn’t worth the trouble and his minders set up a call so he could politely say no to Trump. The conversation apparently went as one would expect. Kalanick emerged to tell his colleagues that the president was “super un-pumped.”In mid-February, an engineer named Susan Fowler penned a blog post, “Reflecting on One Very, Very Strange Year at Uber,” about the sexual harassment she had witnessed in her time at the company. The explosive response to that post prompted Kalanick to hire Eric Holder Jr., the former US attorney general and a partner at the firm Covington & Burling LLP, to lead an investigation into Fowler’s claims. But the hits kept coming. The infamous dashcam footage surfaced; a few weeks later, the New York Times reported on a secret Uber technology called Greyball, which the company developed to identify and deny service to riders who had violated the company’s contractual terms. In some cities and countries, Uber managers used Greyball to avoid picking up taxi inspectors and other law enforcement officials who might want to ticket drivers or shut the service down.A common factor in all these crises was Kalanick’s unrelenting combativeness. Over time, he turned a lot of friends into enemies with stories to tell. Jones, the president who had commissioned the public survey, resigned in March after only six months on the job, citing differences over “beliefs and approach to leadership.”Google, too, should have been an ally. The company invested in Uber in 2013 and, four years later, owned a stake worth billions. But the two companies began to look more like competitors as both raced to build selfdriving cars. What might have remained a friendly rivalry soured irrevocably when Uber bought the self-driving trucking startup Otto for more than $600 million in stock. Most of Otto’s core employees were former Googlers, led by their own brash co-founder, Anthony Levandowski. Google co-founder Larry Page had already grown to loathe Kalanick. Now he was fuming.Google filed a lawsuit in late February, accusing Uber of stealing its secrets. Its allegations were devastating, the most damning one being that Levandowski had downloaded 14,000 Google files before he quit to start Otto.The legal fight, expected to go to trial shortly, may have been avoided if Kalanick had listened to his senior executives. Meanwhile, private investigators hired to conduct due diligence on Otto before the acquisition closed learned that Levandowski had possessed five disks of data from Google’s driverless effort and other information that included “source code, design files, laser files, engineering documents and software related to Google self-driving cars,” according to the investigators.Kalanick, who says he never read the investigators’ report, went forward with the deal anyway. And he agreed to protect Levandowski from legal attacks by Google. Then, after Google filed its lawsuit, Levandowski told the court he was likely to invoke the Fifth Amendment’s protection against self-incrimination. He would no longer help defend Uber, further imperilling the company’s case. But Kalanick insisted that the company stick by Levandowski.Kalanick was unable or unwilling to right himself. If anything, his judgment deteriorated. He decided that he should apologize privately to Kamel, the driver he berated on video. The plan was simple: meet with Kamel at some neutral and nonthreatening location, engage in five minutes of pleasantries, say sorry, and leave.The meeting went on for more than an hour, with Kalanick re-debating Kamel over Uber’s pricing policies. By the end, Kalanick suggested that he give the driver Uber stock, according to people familiar with the discussion.Wayne Ting, who ran Uber’s San Francisco business, was in the room with Kalanick and Kamel. In an email later circulated among employees and directors, Ting said he was deeply disturbed by what he saw. In the email, he wrote that Kalanick “no longer had the moral standing” to lead Uber. After Uber’s lawyers insisted the company wouldn’t pay Kamel to clean up Kalanick’s personal scandal, Kalanick agreed to pay Kamel $200,000 out of his own pocket, according to a person familiar with the matter.In late March, the tech publication the Information published an account of a visit by Kalanick and other Uber executives to a karaoke bar in Seoul in 2014. Kalanick’s then girlfriend Gabi Holzwarth, who went along on the work trip, told the Information that the bar was staffed by “escorts,” each woman labelled with a number so customers could pick them out more easily. (Holzwarth said she and Kalanick left the bar together after about an hour.) In June, Bloomberg News and the tech blog Recode reported that Eric Alexander, Uber’s president for Asia-Pacific, had obtained and carried around the confidential medical record from a horrific December 2014 rape of a 26-year-old passenger by an Uber driver in Delhi. Alexander, Kalanick, and other executives had discussed among themselves a preposterous theory—that the rape may have been a setup by Ola, Uber’s primary rival in India. The Asia news—especially the India revelations—resonated as loudly inside Uber as outside. “It was like a bomb went off inside the company,” said one senior exec.A short time later, six members of Uber’s ELT, or Executive Leadership Team, sent a confidential letter to the board. The letter, according to a person familiar with the matter, asked for an independent board chairman to be appointed and for accountability at the highest levels of the company. They demanded the board force Kalanick to take at least a three-month leave of absence.Over the years, Kalanick had a simple method for dealing with Bill Gurley, one of his earliest backers and board members. Kalanick told colleagues that all he had to do was ignore Gurley’s phone calls and Gurley would call less often. The silent treatment never seemed to bother Gurley much. A tall, affable Texan and a partner at venture capital firm Benchmark, he often appeared at conferences and on television evangelizing Uber and praising the entrepreneurial abilities of its CEO. In 2016, along with the rest of Uber’s board, he turned over more control to Kalanick as part of a $3.5 billion investment from Saudi Arabia’s sovereign wealth fund.As 2017 wore on, Kalanick became even less communicative than normal. He was regularly missing or cancelling leadership team meetings and wasn’t delivering on his declaration, made in a public letter, to hire “a Chief Operating Officer: a peer who can partner with me to write the next chapter in our journey.” In March, after years of trying, Gurley finally got himself appointed to the board’s audit committee and learned of the steep losses in Uber’s subprime vehicle-leasing division, which helped its drivers finance cars.Gurley’s cheerleading turned into anxiety and then horror. People at Benchmark worried that the Uber situation was affecting Gurley’s health.By the time the six executives sent their letter to the board urging that Kalanick take a leave of absence, Gurley was ready to consider it. The directors met on Sunday, June 11, at the Los Angeles offices of Holder’s law firm, Covington & Burling. They reviewed Holder’s report, which detailed not only a sequence of sexual harassment incidents at the company but also a culture of legal noncompliance that systematically equated rule-following with bureaucracy and failure. The board voted to adopt Holder’s 47 recommendations, including rewriting Uber’s absurdly bro-ish cultural values (“toe stepping,” “always be hustlin’”), restricting the consumption of alcohol at company events, and instituting an anonymous complaint process for employees.There was no discussion about asking Kalanick to resign, but the board agreed to a temporary sabbatical for the CEO, on his own terms. Kalanick was grieving from a recent family tragedy—his mother, Bonnie, was killed and his father, Donald, seriously injured in a boating accident in Fresno, Calif.Two days later, Arianna Huffington, the media entrepreneur and Kalanick’s staunchest ally on the board, led an all-hands meeting at Uber’s Market Street headquarters in San Francisco, announcing the board’s recommendations and Kalanick’s leave of absence. A 16-member committee of senior execs would run the company and institute a round of image-repairing changes.But employees and board members never stopped feeling his presence. Even in top-level conversations where Kalanick appeared to be absent, other executives and board members suspected that Huffington was serving as his proxy. The founder of the Huffington Post was a constant presence at Uber’s offices, making suggestions that seemed to promote her new wellness company, Thrive Global Holdings LLC. For example, she wanted to put “nap pods” at driver hubs and give drivers meditation wristbands. Huffington’s company received $50,000 in consulting fees from Uber.In a meeting at the firm’s offices in Woodside, Calif., a few days after Kalanick went on leave, Gurley and his partners came to a decision: Kalanick had to go, for good. They quietly reached out to other investors—First Round Capital, Menlo Ventures, Fidelity Investments, and Lowercase Capital—which all called meetings of their respective partnerships. Five signed a letter imploring Kalanick to resign.On June 20, Benchmark dispatched two partners, Matt Cohler and Peter Fenton, to confront Kalanick in Chicago, where he was interviewing Walter Robb, the former co-CEO of Whole Foods Market Inc., for the open COO spot. The venture capitalists surprised Kalanick at the Ritz-Carlton hotel and asked for his resignation as CEO and to relinquish the board seats he controlled. Cohler and Fenton told Kalanick he had a few hours before they went public with their allegations. They also said that if he resigned, they would tell the world he had quit on his own terms.To their surprise Kalanick signed the documents at the Ritz in Chicago. The New York Times ran a detailed story about the resignation, infuriating Kalanick. What he believed was going to be a graceful departure now looked like the Benchmark-administered ouster it actually was.Kalanick reneged on his agreement to let go of his board seat and the two others he controlled. And although he no longer came into the office, Kalanick managed to keep himself in the middle of the company’s affairs. He lobbied for his own pick as successor, former General Electric Co. chief Jeffrey Immelt. The Uber directors would have none of that. Kalanick also flew to Seattle to interview a wild-card candidate referred by investor TPG: Expedia Inc. CEO Dara Khosrowshahi Somehow, amid the dysfunction, Uber hired Khosrowshahi, who impressed the board with a thoughtful PowerPoint presentation that included a slide that read, “There can be only one CEO at a time.” Khosrowshahi was all that Kalanick wasn’t or couldn’t be: humble, a good listener, and a diplomat. In a pointed reversal of Kalanick’s mantra, he would say: “We don’t have a PR problem; we have an ‘us’ problem—we have behaved poorly.” And when the city of London revoked Uber’s operating license in September, Khosrowshahi visited, met with taxi regulators, and published an open letter. “On behalf of everyone at Uber globally, I apologize,” he wrote. “We will appeal this decision on behalf of millions of Londoners, but we do so with the knowledge that we must also change.”Kalanick has privately told people he thought the apology tour was a mistake. But his opinion no longer matters—Uber’s new COO, Barney Harford, says he was hired without ever meeting him. The SoftBank deal will make Kalanick a billionaire. Friends say he’s trying to keep busy. He’s setting up a family office and spending time with his father in Los Angeles. And he’s getting very good at 2048, the single-player smartphone puzzle game.","['ubers', 'uber', 'company', 'went', 'kalanick', 'executives', 'kalanicks', 'thought', 'auto', 'et', 'board', 'weirder', 'president', 'travis', 'kamel', 'darker', 'fall', 'lot']","Kalanick operated by gut feeling and with a stubborn sense of how people should feel, not how they did.
Jeff Jones, Uber’s new president and former chief marketing officer for Target Corp. , wanted more substantial insights.
Kalanick told colleagues that all he had to do was ignore Gurley’s phone calls and Gurley would call less often.
Even in top-level conversations where Kalanick appeared to be absent, other executives and board members suspected that Huffington was serving as his proxy.
And although he no longer came into the office, Kalanick managed to keep himself in the middle of the company’s affairs."
,,,,,,
